id,title,score,upvote_ratio,num_comments,created_utc,subreddit,subscribers,permalink,url,domain,num_awards,num_crossposts,crosspost_subreddits,post_type,is_nsfw,is_bot,is_megathread,body
90bu6w,Heat index was 110 degrees so we offered him a cold drink. He went for a full body soak instead,335948,0.99,4382,2018-07-20 07:14:38,aww,36719143,https://www.reddit.com/r/aww/comments/90bu6w/heat_index_was_110_degrees_so_we_offered_him_a/,https://v.redd.it/gyh95hiqc0b11,v.redd.it,0,263,,video,False,False,False,
v7x39u,"Man stops to rescue kitten, gets ambushed by platoon",327944,0.97,7348,2022-06-09 00:28:40,aww,36719143,https://www.reddit.com/r/aww/comments/v7x39u/man_stops_to_rescue_kitten_gets_ambushed_by/,https://v.redd.it/ja18l19v2g491,v.redd.it,0,357,,video,False,False,False,
hzkbop,"Meet the newest member of the family, Dutch!",287989,0.98,3577,2020-07-29 00:13:35,aww,36719143,https://www.reddit.com/r/aww/comments/hzkbop/meet_the_newest_member_of_the_family_dutch/,https://i.redd.it/fj8vqooc8nd51.jpg,i.redd.it,0,35,,image,False,False,False,
ehb706,"Ever since my niece saw Toy Story, she shouts “I’m leaving!” and then peeks at her room like this",276625,0.97,2221,2019-12-30 02:12:28,aww,36719143,https://www.reddit.com/r/aww/comments/ehb706/ever_since_my_niece_saw_toy_story_she_shouts_im/,https://i.redd.it/nbf6kvcbwm741.jpg,i.redd.it,0,61,,image,False,False,False,
exng3g,Bunnies flop over when they feel completely safe,245200,0.99,1801,2020-02-02 17:28:15,aww,36719143,https://www.reddit.com/r/aww/comments/exng3g/bunnies_flop_over_when_they_feel_completely_safe/,https://v.redd.it/trn6nvka2ie41,v.redd.it,0,104,,video,False,False,False,
mqdgix,"My deaf puppy doesn’t notice whenever I come home, so I get to wake her up gently and see her innocent excitement.",228174,0.99,2708,2021-04-14 04:14:32,aww,36719143,https://www.reddit.com/r/aww/comments/mqdgix/my_deaf_puppy_doesnt_notice_whenever_i_come_home/,https://v.redd.it/fqkrsp1br0t61,v.redd.it,0,36,,video,False,False,False,
cmrkpt,The dog is supposed to run up in front of her and sit.,221559,0.99,2778,2019-08-06 20:22:41,aww,36719143,https://www.reddit.com/r/aww/comments/cmrkpt/the_dog_is_supposed_to_run_up_in_front_of_her_and/,https://gfycat.com/bewitchedpleasedbongo,gfycat.com,0,193,,link,False,False,False,
v8k5c4,Update on the 13 kittens that ambushed this man. They’re getting their first bath this morning.,215483,0.96,3524,2022-06-09 21:33:58,aww,36719143,https://www.reddit.com/r/aww/comments/v8k5c4/update_on_the_13_kittens_that_ambushed_this_man/,https://v.redd.it/ts5v4phlcm491,v.redd.it,0,43,,video,False,False,False,
fnkcys,"While showing my 3 year old my Game Boy, I discovered a picture of my best friend from 1999.",203207,0.98,1422,2020-03-23 19:26:35,aww,36719143,https://www.reddit.com/r/aww/comments/fnkcys/while_showing_my_3_year_old_my_game_boy_i/,https://imgur.com/2cfU6dh,imgur.com,0,23,,image,False,False,False,
ahal9v,His favorite spot when traveling.,201777,0.98,1958,2019-01-18 19:16:41,aww,36719143,https://www.reddit.com/r/aww/comments/ahal9v/his_favorite_spot_when_traveling/,https://i.imgur.com/zH3iA75.gifv,i.imgur.com,0,149,,link,False,False,False,
vctk40,A video analysis of the difference between Joule joining Kelvin and Kelvin joining Joule.,199667,0.97,1567,2022-06-15 18:08:02,aww,36719143,https://www.reddit.com/r/aww/comments/vctk40/a_video_analysis_of_the_difference_between_joule/,https://v.redd.it/u4ozvjcd5s591,v.redd.it,0,79,,video,False,False,False,
ownzkg,They are so proud of it..,198065,0.98,1509,2021-08-03 02:41:11,aww,36719143,https://www.reddit.com/r/aww/comments/ownzkg/they_are_so_proud_of_it/,https://v.redd.it/ovfd4wayf0f71,v.redd.it,0,62,,video,False,False,False,
ckbolc,This is Tiger. He just turned 31. We are told he is the oldest cat in the state of Illinois,198004,0.98,4574,2019-07-31 23:06:04,aww,36719143,https://www.reddit.com/r/aww/comments/ckbolc/this_is_tiger_he_just_turned_31_we_are_told_he_is/,https://i.redd.it/sg3q5cuedod31.jpg,i.redd.it,0,27,,image,False,False,False,
aad0i8,Nothing will stop this dog from protecting his owner,197240,0.98,2621,2018-12-29 00:14:54,aww,36719143,https://www.reddit.com/r/aww/comments/aad0i8/nothing_will_stop_this_dog_from_protecting_his/,https://i.imgur.com/wXU8Pwk.gifv,i.imgur.com,0,83,,link,False,False,False,
cyh627,Monkeybro helps out,195211,0.99,2701,2019-09-02 04:55:00,aww,36719143,https://www.reddit.com/r/aww/comments/cyh627/monkeybro_helps_out/,https://v.redd.it/vjz99l0tg2k31,v.redd.it,0,195,,video,False,False,False,
sz1hy2,Say hello to Schnitzel,191350,0.92,2952,2022-02-23 04:44:49,aww,36719143,https://www.reddit.com/r/aww/comments/sz1hy2/say_hello_to_schnitzel/,https://i.redd.it/naba9ilyvgj81.jpg,i.redd.it,0,33,,image,False,False,False,
fo6q11,His favorite place is his bed.,188012,0.98,1864,2020-03-24 20:43:28,aww,36719143,https://www.reddit.com/r/aww/comments/fo6q11/his_favorite_place_is_his_bed/,https://v.redd.it/mwhayftxzmo41,v.redd.it,0,51,,video,False,False,False,
akoxqk,My daughter's reaction when holding her new baby sister. Much heavier than the dolls she practiced on. LOL,187285,0.95,1346,2019-01-28 21:45:04,aww,36719143,https://www.reddit.com/r/aww/comments/akoxqk/my_daughters_reaction_when_holding_her_new_baby/,https://i.redd.it/0l78k9pfu6d21.jpg,i.redd.it,0,41,,image,False,False,False,
hpte63,Father is a acrobat. His daughter inherited all his talent genes.,185037,0.94,2580,2020-07-12 17:37:54,aww,36719143,https://www.reddit.com/r/aww/comments/hpte63/father_is_a_acrobat_his_daughter_inherited_all/,https://v.redd.it/fdbh95823fa51,v.redd.it,0,37,,video,False,False,False,
ehldvi,Hey everyone! Reddit asked me to recreate the little girl looking for her toys to come to life as a painting. So I stayed up last night...and here it is ☺️,183804,0.95,1672,2019-12-30 17:47:04,aww,36719143,https://www.reddit.com/r/aww/comments/ehldvi/hey_everyone_reddit_asked_me_to_recreate_the/,https://i.redd.it/1ubakwq1jr741.jpg,i.redd.it,0,22,,image,False,False,False,
crpjwk,Every year this mama duck brings her babies to my house and I help her take care of them. This morning I opened my door to 13 new peeping fluff balls.,182798,0.99,2731,2019-08-17 23:28:49,aww,36719143,https://www.reddit.com/r/aww/comments/crpjwk/every_year_this_mama_duck_brings_her_babies_to_my/,https://i.redd.it/vd5ubvfxs1h31.jpg,i.redd.it,0,38,,image,False,False,False,
awyf90,Husband said he was going to make a bed frame. I thought it was for our new mattress.... It was for the cat.,181904,0.97,1607,2019-03-04 02:21:57,aww,36719143,https://www.reddit.com/r/aww/comments/awyf90/husband_said_he_was_going_to_make_a_bed_frame_i/,https://i.redd.it/un44882dvyj21.jpg,i.redd.it,0,45,,image,False,False,False,
98crc8,My 90yo neighbor hasn’t walked her dog in years so I volunteered to do it for her. So proud of Buddy’s weight loss!!!,181712,0.98,2121,2018-08-18 21:37:50,aww,36719143,https://www.reddit.com/r/aww/comments/98crc8/my_90yo_neighbor_hasnt_walked_her_dog_in_years_so/,https://i.redd.it/xhjwycxclvg11.jpg,i.redd.it,0,27,,image,False,False,False,
hg6xwr,Our cat went missing a year ago. Me and my wife found him while on a bike ride. As soon as he heard my voice he came running crying and now my entire year has been made! So unbelievably happy!,181205,0.98,2816,2020-06-26 18:18:05,aww,36719143,https://www.reddit.com/r/aww/comments/hg6xwr/our_cat_went_missing_a_year_ago_me_and_my_wife/,https://i.redd.it/p5r6vm9r39751.jpg,i.redd.it,0,9,,image,False,False,False,
gnl55y,Sticky bun for you!,180927,0.98,1508,2020-05-21 04:32:48,aww,36719143,https://www.reddit.com/r/aww/comments/gnl55y/sticky_bun_for_you/,https://v.redd.it/6dyyctsj30051,v.redd.it,0,66,,video,False,False,False,
b1rycu,Everyone needs a friend like #50,177946,0.97,2508,2019-03-16 18:00:16,aww,36719143,https://www.reddit.com/r/aww/comments/b1rycu/everyone_needs_a_friend_like_50/,https://v.redd.it/pfddij2q5hm21,v.redd.it,0,66,,video,False,False,False,
7m44jt,My sister made a sweater for Spaghetti...I think he loves it.,177053,0.94,2447,2017-12-26 04:24:12,aww,36719143,https://www.reddit.com/r/aww/comments/7m44jt/my_sister_made_a_sweater_for_spaghettii_think_he/,https://i.redd.it/yj0ny67qe5601.jpg,i.redd.it,0,48,,image,False,False,False,
fd3k8o,The apple doesn't fall far from the tree!,172929,0.98,865,2020-03-04 04:51:54,aww,36719143,https://www.reddit.com/r/aww/comments/fd3k8o/the_apple_doesnt_fall_far_from_the_tree/,https://i.imgur.com/XdM7sYk.gifv,i.imgur.com,0,69,,link,False,False,False,
f1nnuc,This little guy always bring dried seed to trade for some nuts,172464,0.98,2285,2020-02-10 14:22:30,aww,36719143,https://www.reddit.com/r/aww/comments/f1nnuc/this_little_guy_always_bring_dried_seed_to_trade/,https://gfycat.com/gleamingfriendlyacornwoodpecker,gfycat.com,0,99,,link,False,False,False,
ii4sdq,She’s been with me for 22 years and is still going strong,172391,0.97,1965,2020-08-28 16:10:31,aww,36719143,https://www.reddit.com/r/aww/comments/ii4sdq/shes_been_with_me_for_22_years_and_is_still_going/,https://i.redd.it/5f8igiff2qj51.jpg,i.redd.it,0,8,,image,False,False,False,
g1xb1p,Made her a bridge to the window she always stared at but could never reach.,171619,0.98,1788,2020-04-15 23:38:43,aww,36719143,https://www.reddit.com/r/aww/comments/g1xb1p/made_her_a_bridge_to_the_window_she_always_stared/,https://i.redd.it/7hffff9bv0t41.jpg,i.redd.it,0,21,,image,False,False,False,
fhdwou,My rescue cat allows me to help him groom,171301,0.98,1399,2020-03-12 15:25:05,aww,36719143,https://www.reddit.com/r/aww/comments/fhdwou/my_rescue_cat_allows_me_to_help_him_groom/,https://v.redd.it/ye63fo37s7m41,v.redd.it,0,48,,video,False,False,False,
i3l7k4,How to surreptitiously stretch within reach of kisses,170893,0.98,861,2020-08-04 20:50:28,aww,36719143,https://www.reddit.com/r/aww/comments/i3l7k4/how_to_surreptitiously_stretch_within_reach_of/,https://gfycat.com/appropriatehotchameleon,gfycat.com,0,54,,link,False,False,False,
l6tf78,4yo in Virginia today went outside to play then came back to the front door with a new friend,170885,0.96,2187,2021-01-28 15:50:22,aww,36719143,https://www.reddit.com/r/aww/comments/l6tf78/4yo_in_virginia_today_went_outside_to_play_then/,https://i.redd.it/4xmx8iuau1e61.jpg,i.redd.it,0,34,,image,False,False,False,
9hvobh,A regular customer's heartwarming reaction to a free cake on her birthday,170287,0.96,1873,2018-09-22 06:20:17,aww,36719143,https://www.reddit.com/r/aww/comments/9hvobh/a_regular_customers_heartwarming_reaction_to_a/,https://v.redd.it/yfws92wcton11,v.redd.it,0,61,,video,False,False,False,
c22hu3,Looking at my cameras during a business trip. When suddenly....,168504,0.97,2292,2019-06-18 19:21:04,aww,36719143,https://www.reddit.com/r/aww/comments/c22hu3/looking_at_my_cameras_during_a_business_trip_when/,https://gfycat.com/chiefterrifichorsemouse,gfycat.com,0,32,,link,False,False,False,
9vfzny,My son has loved my cat since the day he was born. She tolerates that love in a way I never thought possible.,167767,0.97,1638,2018-11-09 06:43:59,aww,36719143,https://www.reddit.com/r/aww/comments/9vfzny/my_son_has_loved_my_cat_since_the_day_he_was_born/,https://i.redd.it/wk37plw7h7x11.jpg,i.redd.it,0,16,,image,False,False,False,
bk2gzq,I'm babysitting my friend's cat and did a photoshoot for her,167320,0.97,1428,2019-05-03 06:22:58,aww,36719143,https://www.reddit.com/r/aww/comments/bk2gzq/im_babysitting_my_friends_cat_and_did_a/,https://i.imgur.com/fcuRqwl.jpg,i.imgur.com,0,38,,link,False,False,False,
k7vhum,"Two years and TONS of walks later, Shiloh has reached her target weight!!",167197,0.97,1458,2020-12-06 20:48:52,aww,36719143,https://www.reddit.com/r/aww/comments/k7vhum/two_years_and_tons_of_walks_later_shiloh_has/,https://i.redd.it/8j1wzxw53l361.png,i.redd.it,0,12,,image,False,False,False,
f3r8bv,That tail droop when the doggo’s date left,166730,0.97,1178,2020-02-14 17:32:28,aww,36719143,https://www.reddit.com/r/aww/comments/f3r8bv/that_tail_droop_when_the_doggos_date_left/,https://v.redd.it/drhvuimcqvg41,v.redd.it,0,36,,video,False,,False,
i0tx88,This little cutie climbed up on me while I applied to adopt her,166485,0.98,1733,2020-07-31 02:20:39,aww,36719143,https://www.reddit.com/r/aww/comments/i0tx88/this_little_cutie_climbed_up_on_me_while_i/,https://v.redd.it/s57kcrkp42e51,v.redd.it,0,16,,video,False,False,False,
ha83ob,My sister and I recreated our first picture together,166375,0.9,2454,2020-06-16 22:39:10,aww,36719143,https://www.reddit.com/r/aww/comments/ha83ob/my_sister_and_i_recreated_our_first_picture/,https://i.redd.it/6c2xjaq61b551.jpg,i.redd.it,0,10,,image,False,False,False,
8qc84c,Removed the top of my desk for cleaning. Cat did not understand,166161,0.97,1308,2018-06-12 00:57:23,aww,36719143,https://www.reddit.com/r/aww/comments/8qc84c/removed_the_top_of_my_desk_for_cleaning_cat_did/,https://gfycat.com/ObviousShockingBronco,gfycat.com,0,67,,link,False,False,False,
b0fi8e,Head scritches=Instant golden smiles,165762,0.97,629,2019-03-13 06:06:43,aww,36719143,https://www.reddit.com/r/aww/comments/b0fi8e/head_scritchesinstant_golden_smiles/,https://v.redd.it/bg7sxnt87sl21,v.redd.it,0,44,,video,False,False,False,
ijwrec,Sandra the orangutan started to clean her enclosure and wash her hands after observing her caretakers do the same thing,165464,0.98,2108,2020-08-31 17:38:41,aww,36719143,https://www.reddit.com/r/aww/comments/ijwrec/sandra_the_orangutan_started_to_clean_her/,https://gfycat.com/velvetyfreeleopardseal,gfycat.com,0,40,,link,False,False,False,
jjejkq,What happens when you have heated tile flooring,164415,0.97,1562,2020-10-28 06:53:55,aww,36719143,https://www.reddit.com/r/aww/comments/jjejkq/what_happens_when_you_have_heated_tile_flooring/,https://v.redd.it/l21oymdmmqv51,v.redd.it,0,59,,video,False,False,False,
buzdy7,Every year a bobcat mama gives birth to a litter of kittens on my roof. I set up a camera this time around.,164350,0.98,2018,2019-05-31 03:50:00,aww,36719143,https://www.reddit.com/r/aww/comments/buzdy7/every_year_a_bobcat_mama_gives_birth_to_a_litter/,https://v.redd.it/4y80r6bdbf131,v.redd.it,0,53,,video,False,False,False,
f2cpyt,Mum was fed up of the squirrels stealing all the bird food so she greased the feeder!,164276,0.96,3364,2020-02-12 00:08:35,aww,36719143,https://www.reddit.com/r/aww/comments/f2cpyt/mum_was_fed_up_of_the_squirrels_stealing_all_the/,https://v.redd.it/4j3zzht6acg41,v.redd.it,0,120,,video,False,False,False,
cqzckc,This is Maya. Her owner built her a luxury cabin so that people passing by can say hello and even talk to her while he's at work.,164049,0.98,1689,2019-08-16 06:58:35,aww,36719143,https://www.reddit.com/r/aww/comments/cqzckc/this_is_maya_her_owner_built_her_a_luxury_cabin/,https://i.imgur.com/ID6KeUr.gifv,i.imgur.com,0,48,,link,False,False,False,
b1tay1,The decoy keyboard is working,163889,0.98,1088,2019-03-16 20:27:36,aww,36719143,https://www.reddit.com/r/aww/comments/b1tay1/the_decoy_keyboard_is_working/,https://i.redd.it/psoryq2wvhm21.jpg,i.redd.it,0,35,,image,False,False,False,
dklv8d,Overexcited fan finally meets Hugh Jackman and can’t control himself.,161941,0.97,1955,2019-10-20 21:56:52,aww,36719143,https://www.reddit.com/r/aww/comments/dklv8d/overexcited_fan_finally_meets_hugh_jackman_and/,https://v.redd.it/puys1rtb2qt31,v.redd.it,0,52,,video,False,False,False,
a9b7c0,My sister’s blind dog loves fetch,160544,0.97,1326,2018-12-25 08:03:52,aww,36719143,https://www.reddit.com/r/aww/comments/a9b7c0/my_sisters_blind_dog_loves_fetch/,https://v.redd.it/nro5xyzl5c621,v.redd.it,0,48,,video,False,False,False,
9dlyi3,Good boy got the photo 10/10,160397,0.95,1379,2018-09-07 00:43:14,aww,36719143,https://www.reddit.com/r/aww/comments/9dlyi3/good_boy_got_the_photo_1010/,https://i.redd.it/g9w2q9iq3ok11.jpg,i.redd.it,0,30,,image,False,False,False,
iuvykg,Came for a dog and left with him,159529,0.96,2574,2020-09-18 06:05:44,aww,36719143,https://www.reddit.com/r/aww/comments/iuvykg/came_for_a_dog_and_left_with_him/,https://v.redd.it/30539jfgxsn51,v.redd.it,0,17,,video,False,False,False,
irvc69,There is a challenge where you put your hand near your dog like you're going to pet them but don't actually pet them. Someone tried it on their bird and it was adorable.,158630,0.97,1248,2020-09-13 15:08:17,aww,36719143,https://www.reddit.com/r/aww/comments/irvc69/there_is_a_challenge_where_you_put_your_hand_near/,https://v.redd.it/piq0a90pxvm51,v.redd.it,0,30,,video,False,False,False,
bx1911,This baby having a full conversation with daddy,158226,0.95,3255,2019-06-05 16:28:22,aww,36719143,https://www.reddit.com/r/aww/comments/bx1911/this_baby_having_a_full_conversation_with_daddy/,https://v.redd.it/gmfvwfwari231,v.redd.it,0,58,,video,False,False,False,
uk9805,Turtles helping each other in times of need,157166,0.96,1763,2022-05-07 14:24:03,aww,36719143,https://www.reddit.com/r/aww/comments/uk9805/turtles_helping_each_other_in_times_of_need/,https://v.redd.it/v00ktb0vp0y81,v.redd.it,0,86,,video,False,False,False,
arkysr,Staying at an AirBnB and I woke up to their kitten this morning licking my face. Instant 5 star review,156482,0.93,1353,2019-02-17 19:54:02,aww,36719143,https://www.reddit.com/r/aww/comments/arkysr/staying_at_an_airbnb_and_i_woke_up_to_their/,https://imgur.com/cHDLJ5I,imgur.com,0,11,,image,False,False,False,
9r9gfb,Kids sing Happy Birthday with sign language for their deaf custodian,156478,0.97,1780,2018-10-25 17:05:22,aww,36719143,https://www.reddit.com/r/aww/comments/9r9gfb/kids_sing_happy_birthday_with_sign_language_for/,https://v.redd.it/x92w55qkibu11,v.redd.it,0,45,,video,False,,False,
9yvn9w,This is how they sleep every night.,156383,0.97,1053,2018-11-21 01:23:05,aww,36719143,https://www.reddit.com/r/aww/comments/9yvn9w/this_is_how_they_sleep_every_night/,https://i.imgur.com/NzETyop.gifv,i.imgur.com,0,68,,link,False,False,False,
g8fxi5,I take my cat on adventures but he just sleeps right through them,156314,0.97,1369,2020-04-26 20:40:23,aww,36719143,https://www.reddit.com/r/aww/comments/g8fxi5/i_take_my_cat_on_adventures_but_he_just_sleeps/,https://v.redd.it/9gdrgdfjg6v41,v.redd.it,0,43,,video,False,False,False,
ih7abz,Charlie! He was my sober gift to myself. 130 days alcohol free today :),155891,0.94,2010,2020-08-27 02:27:09,aww,36719143,https://www.reddit.com/r/aww/comments/ih7abz/charlie_he_was_my_sober_gift_to_myself_130_days/,https://i.redd.it/ofs3co8muej51.jpg,i.redd.it,0,6,,image,False,False,False,
i1xk6k,What could be more wholesome than this,155422,0.93,1424,2020-08-02 00:31:08,aww,36719143,https://www.reddit.com/r/aww/comments/i1xk6k/what_could_be_more_wholesome_than_this/,https://i.redd.it/aqd7ghh4vfe51.jpg,i.redd.it,0,16,,image,False,False,False,
y2j5rb,My Gramps turned 94 today. His only request was to come over and give my cat “rides.”,154981,0.94,2333,2022-10-13 05:05:22,aww,36719143,https://www.reddit.com/r/aww/comments/y2j5rb/my_gramps_turned_94_today_his_only_request_was_to/,https://v.redd.it/xoe3m6nzmgt91,v.redd.it,0,34,,video,False,False,False,
ixby19,Kissed my best friend to see what would happen,154972,0.96,836,2020-09-22 04:59:09,aww,36719143,https://www.reddit.com/r/aww/comments/ixby19/kissed_my_best_friend_to_see_what_would_happen/,https://v.redd.it/kmvzajae5lo51,v.redd.it,0,18,,video,False,False,False,
89inzk,This is Ben. He has a beard. And he is human sized. We get fun looks in traffic.,154520,0.96,2532,2018-04-04 02:40:49,aww,36719143,https://www.reddit.com/r/aww/comments/89inzk/this_is_ben_he_has_a_beard_and_he_is_human_sized/,https://i.redd.it/nfzix3rgerp01.jpg,i.redd.it,0,32,,image,False,False,False,
fl1n5h,"14 elephants broke into a village in Yunan province, looking for corn and other food. They ended up drinking 30kg of corn wine and got so drunk that they fell asleep in a nearby tea garden",154490,0.96,1902,2020-03-19 07:15:25,aww,36719143,https://www.reddit.com/r/aww/comments/fl1n5h/14_elephants_broke_into_a_village_in_yunan/,https://imgur.com/UZTzNHa,imgur.com,0,41,,image,False,False,False,
ah0kx9,"Our cat is obsessed with blanket forts, so we made him this. He has wares, if you have coin.",154347,0.96,1267,2019-01-17 23:39:43,aww,36719143,https://www.reddit.com/r/aww/comments/ah0kx9/our_cat_is_obsessed_with_blanket_forts_so_we_made/,http://i.imgur.com/6hO5eIu.jpg,i.imgur.com,0,107,,link,False,False,False,
n5oacm,rescued baby seal's first swim lesson,154259,0.98,2213,2021-05-06 00:56:53,aww,36719143,https://www.reddit.com/r/aww/comments/n5oacm/rescued_baby_seals_first_swim_lesson/,https://v.redd.it/hs3ij1n2scx61,v.redd.it,0,38,,video,False,False,False,
wadjx5,Man greeted by Otter Pup in the water,153505,0.97,1795,2022-07-28 21:26:29,aww,36719143,https://www.reddit.com/r/aww/comments/wadjx5/man_greeted_by_otter_pup_in_the_water/,https://v.redd.it/u1bxswwyzbe91,v.redd.it,0,67,,video,False,False,False,
i479wl,"Meet Sydney, a male umbrella cockatoo socializing with Vet Hospital Staff",153472,0.98,1444,2020-08-05 20:52:48,aww,36719143,https://www.reddit.com/r/aww/comments/i479wl/meet_sydney_a_male_umbrella_cockatoo_socializing/,https://v.redd.it/7s6r89vab7f51,v.redd.it,0,55,,video,False,False,False,
ly995f,The magical moment he realizes the hand belongs to friend not foe,153441,0.97,1240,2021-03-05 16:13:43,aww,36719143,https://www.reddit.com/r/aww/comments/ly995f/the_magical_moment_he_realizes_the_hand_belongs/,https://v.redd.it/3na0u4h3v6l61,v.redd.it,0,43,,video,False,False,False,
jhx0z2,A variety of wild animals visiting a water fountain,152627,0.98,1341,2020-10-25 22:45:21,aww,36719143,https://www.reddit.com/r/aww/comments/jhx0z2/a_variety_of_wild_animals_visiting_a_water/,https://v.redd.it/v8pvd99yw9v51,v.redd.it,0,53,,video,False,False,False,
axc9w9,My cat likes to walk on her wheel while I’m on my exercise bike. The way she looks at me makes my heart melt 😻😭,152316,0.96,1404,2019-03-05 02:28:39,aww,36719143,https://www.reddit.com/r/aww/comments/axc9w9/my_cat_likes_to_walk_on_her_wheel_while_im_on_my/,https://v.redd.it/jgq1978y06k21,v.redd.it,0,24,,video,False,False,False,
fvmngf,"Quarantine, day 14. Me and my boyfriend spent the whole day setting up an art gallery for our gerbil.",152314,0.97,977,2020-04-06 03:48:25,aww,36719143,https://www.reddit.com/r/aww/comments/fvmngf/quarantine_day_14_me_and_my_boyfriend_spent_the/,https://i.redd.it/y6cbqbhrq2r41.jpg,i.redd.it,0,32,,image,False,False,False,
k9pemt,Prison Break,151746,0.93,2372,2020-12-09 15:46:39,aww,36719143,https://www.reddit.com/r/aww/comments/k9pemt/prison_break/,https://v.redd.it/9lsuhzn105461,v.redd.it,0,59,,video,False,False,False,
jizbpp,Father's reaction to his son's first goal,151723,0.93,1553,2020-10-27 16:55:37,aww,36719143,https://www.reddit.com/r/aww/comments/jizbpp/fathers_reaction_to_his_sons_first_goal/,https://i.redd.it/0s2diiclgmv51.gif,i.redd.it,0,36,,image,False,False,False,
8narht,My landlord was replacing our sink and sent me this.,151677,0.97,1631,2018-05-30 23:34:29,aww,36719143,https://www.reddit.com/r/aww/comments/8narht/my_landlord_was_replacing_our_sink_and_sent_me/,https://i.redd.it/p71x6eh891111.jpg,i.redd.it,0,17,,image,False,False,False,
846vfm,When you get to bring your dog to work and she reminds you that you’re her favorite person.,151557,0.97,981,2018-03-14 00:46:45,aww,36719143,https://www.reddit.com/r/aww/comments/846vfm/when_you_get_to_bring_your_dog_to_work_and_she/,https://i.redd.it/b7s8awb1zkl01.jpg,i.redd.it,0,21,,image,False,False,False,
ix6bkl,A skater rescuing a wild bun from a pool,151176,0.97,2226,2020-09-22 00:06:09,aww,36719143,https://www.reddit.com/r/aww/comments/ix6bkl/a_skater_rescuing_a_wild_bun_from_a_pool/,https://gfycat.com/mildzanyhawaiianmonkseal,gfycat.com,0,40,,link,False,False,False,
8ylvef,Nervous cadet reporting for duty.,151143,0.94,416,2018-07-13 22:50:11,aww,36719143,https://www.reddit.com/r/aww/comments/8ylvef/nervous_cadet_reporting_for_duty/,https://i.imgur.com/VrtK5zP.jpg,i.imgur.com,0,31,,link,False,False,False,
g33xj3,Lynx which fell asleep on a porch is woken up by its tiny counterpart,150751,0.96,1391,2020-04-17 20:46:21,aww,36719143,https://www.reddit.com/r/aww/comments/g33xj3/lynx_which_fell_asleep_on_a_porch_is_woken_up_by/,https://gfycat.com/courageousshinyayeaye,gfycat.com,0,27,,link,False,False,False,
d9cqt8,Nobody has ever had as much fun at a party as these two are having at this party,150579,0.97,1597,2019-09-26 06:58:59,aww,36719143,https://www.reddit.com/r/aww/comments/d9cqt8/nobody_has_ever_had_as_much_fun_at_a_party_as/,https://v.redd.it/1ivd8adocuo31,v.redd.it,0,83,,video,False,False,False,
aa05uq,"Moose. My sidekick, my partner, my best friend. Thank you for being such an amazing creature.",150580,0.94,1586,2018-12-27 21:05:56,aww,36719143,https://www.reddit.com/r/aww/comments/aa05uq/moose_my_sidekick_my_partner_my_best_friend_thank/,https://i.redd.it/0uzalis2bu621.jpg,i.redd.it,0,7,,image,False,False,False,
g860tb,My dad didn’t know I was going to be on the news this morning so my mom recorded his reaction,150360,0.95,1609,2020-04-26 07:30:35,aww,36719143,https://www.reddit.com/r/aww/comments/g860tb/my_dad_didnt_know_i_was_going_to_be_on_the_news/,https://v.redd.it/ii1gl3ldk2v41,v.redd.it,0,15,,video,False,False,False,
hskd2w,Yes... this is me in the video!,150325,0.96,755,2020-07-17 04:28:07,aww,36719143,https://www.reddit.com/r/aww/comments/hskd2w/yes_this_is_me_in_the_video/,https://v.redd.it/9dvnmtkpuab51,v.redd.it,0,32,,video,False,False,False,
7n5yf5,Senior dog meets a puppy and starts to feel like a puppy himself.,149630,0.96,1485,2017-12-31 08:08:54,aww,36719143,https://www.reddit.com/r/aww/comments/7n5yf5/senior_dog_meets_a_puppy_and_starts_to_feel_like/,https://i.imgur.com/lWAYMnS.gifv,i.imgur.com,0,14,,link,False,False,False,
hf1fv2,"Meet August, officially the oldest living Golden Retriever! She turned 20 years old!",148698,0.97,1438,2020-06-24 19:26:04,aww,36719143,https://www.reddit.com/r/aww/comments/hf1fv2/meet_august_officially_the_oldest_living_golden/,https://i.redd.it/pcyjh7bw5v651.png,i.redd.it,0,14,,image,False,False,False,
