id,title,score,upvote_ratio,num_comments,created_utc,subreddit,subscribers,permalink,url,domain,num_awards,num_crossposts,crosspost_subreddits,post_type,is_nsfw,is_bot,is_megathread,body
gollww,"Deer and cherry blossoms in Nara Park, Japan",113404,0.97,1012,2020-05-22 21:09:20,aww,36719143,https://www.reddit.com/r/aww/comments/gollww/deer_and_cherry_blossoms_in_nara_park_japan/,https://v.redd.it/xowxguac6c051,v.redd.it,0,38,,video,False,False,False,
lmpsfd,He did a great job with that strawberry🍓,113222,0.8,1970,2021-02-18 21:22:40,aww,36719143,https://www.reddit.com/r/aww/comments/lmpsfd/he_did_a_great_job_with_that_strawberry/,https://v.redd.it/to5qd4lkc9i61,v.redd.it,0,23,,video,False,False,False,
gawspf,Luna has apparently bonded or is just obsessed with my daughter. This is the 2nd cat we’ve had that is like this with her.,113212,0.96,2051,2020-04-30 20:05:33,aww,36719143,https://www.reddit.com/r/aww/comments/gawspf/luna_has_apparently_bonded_or_is_just_obsessed/,https://v.redd.it/qzerb33luyv41,v.redd.it,0,21,,video,False,False,False,
f3c3wb,before and after playdate 😍,113193,0.91,1021,2020-02-13 21:34:17,aww,36719143,https://www.reddit.com/r/aww/comments/f3c3wb/before_and_after_playdate/,https://i.redd.it/bm2oaq7bspg41.jpg,i.redd.it,0,23,,image,False,False,False,
mwyvr3,Everyone tryna steal my girl.,113191,0.92,1677,2021-04-23 21:46:44,aww,36719143,https://www.reddit.com/r/aww/comments/mwyvr3/everyone_tryna_steal_my_girl/,https://v.redd.it/kfdkj7797yu61,v.redd.it,0,12,,video,False,False,False,
mceekj,"Kitty got caught creepin' so he totally nonchalantly ducks out with ""the elevator"" move.",113166,0.95,632,2021-03-25 01:01:01,aww,36719143,https://www.reddit.com/r/aww/comments/mceekj/kitty_got_caught_creepin_so_he_totally/,https://v.redd.it/yp0uxarc21p61,v.redd.it,0,33,,video,False,False,False,
hku9gg,This surveillance camera catch the moment a dog took his owner shoe and sleep beside this showing how much he miss his owner meanwhile he was at work.,113143,0.91,1187,2020-07-04 06:06:18,aww,36719143,https://www.reddit.com/r/aww/comments/hku9gg/this_surveillance_camera_catch_the_moment_a_dog/,https://v.redd.it/rpzquxitjq851,v.redd.it,0,21,,video,False,False,False,
7i2z6g,Little boy just wants to hug the police officer,113031,0.84,2255,2017-12-07 07:11:21,aww,36719143,https://www.reddit.com/r/aww/comments/7i2z6g/little_boy_just_wants_to_hug_the_police_officer/,https://i.imgur.com/5U3A49u.gifv,i.imgur.com,0,2,,link,False,False,False,
6x1vht,pupper of darkness,112912,0.92,2129,2017-08-31 01:43:14,aww,36719143,https://www.reddit.com/r/aww/comments/6x1vht/pupper_of_darkness/,https://gfycat.com/RepulsiveIdolizedDassie,gfycat.com,0,0,,link,False,False,False,
aba0xg,He thinks we're playing hide and seek.,112879,0.92,884,2019-01-01 00:25:22,aww,36719143,https://www.reddit.com/r/aww/comments/aba0xg/he_thinks_were_playing_hide_and_seek/,https://i.imgur.com/5mDoUct.gifv,i.imgur.com,0,41,,link,False,False,False,
hilmwr,"My 70 y/o grandpa and I browse this sub regularly when I visit him, to brighten his day. He asked if I could share a picture of his dog. Reddit, meet Tok. (Pronounced took)",112859,0.89,1014,2020-06-30 17:03:03,aww,36719143,https://www.reddit.com/r/aww/comments/hilmwr/my_70_yo_grandpa_and_i_browse_this_sub_regularly/,https://i.redd.it/3qcwtdi0a1851.jpg,i.redd.it,0,1,,image,False,False,False,
hd6xtp,"Bonnie put her favourite toy on my packed suitcase... oh man, the feels",112829,0.92,1020,2020-06-21 18:58:41,aww,36719143,https://www.reddit.com/r/aww/comments/hd6xtp/bonnie_put_her_favourite_toy_on_my_packed/,https://i.redd.it/oyit41vem9651.jpg,i.redd.it,0,12,,image,False,False,False,
uuvn7x,Guess who's snoozing behind our wall?,112744,0.96,797,2022-05-22 02:16:23,aww,36719143,https://www.reddit.com/r/aww/comments/uuvn7x/guess_whos_snoozing_behind_our_wall/,https://v.redd.it/ua0arlkp5w091,v.redd.it,0,19,,video,False,False,False,
gqcxds,Four year old beekeeper distracted by a roly-poly.,112665,0.93,691,2020-05-25 20:56:52,aww,36719143,https://www.reddit.com/r/aww/comments/gqcxds/four_year_old_beekeeper_distracted_by_a_rolypoly/,https://i.redd.it/v57m2x0xix051.jpg,i.redd.it,0,26,,image,False,False,False,
flisy6,The shelter was clearing out for COVID-19 and I needed a social distancing buddy. Meet my new foster Vader!,112632,0.95,1267,2020-03-20 03:32:12,aww,36719143,https://www.reddit.com/r/aww/comments/flisy6/the_shelter_was_clearing_out_for_covid19_and_i/,https://i.redd.it/4fjwbezccpn41.jpg,i.redd.it,0,10,,image,False,False,False,
7a84nk,"My daughter volunteering at our local shelter, helping feed the puppies. She was taken down and overpowered by adorableness.",112638,0.93,1118,2017-11-02 06:35:57,aww,36719143,https://www.reddit.com/r/aww/comments/7a84nk/my_daughter_volunteering_at_our_local_shelter/,https://i.redd.it/qb8d1ln0pgvz.jpg,i.redd.it,0,3,,image,False,,False,
hw2mqb,A Disney movie come true (credit to u/Noomie90),112602,0.94,1759,2020-07-23 03:01:39,aww,36719143,https://www.reddit.com/r/aww/comments/hw2mqb/a_disney_movie_come_true_credit_to_unoomie90/,https://v.redd.it/vz5y7om0lfc51,v.redd.it,0,0,harp,link,False,False,False,
oz2vog,If you fell sad remember this dog owns a shop in Tokyo🙂,112596,0.88,1360,2021-08-06 14:26:10,aww,36719143,https://www.reddit.com/r/aww/comments/oz2vog/if_you_fell_sad_remember_this_dog_owns_a_shop_in/,https://v.redd.it/lwivolvecpf71,v.redd.it,0,36,,video,False,False,False,
h0g9td,The Only Transformation Pic I Will Allow,112580,0.94,1059,2020-06-10 23:30:33,aww,36719143,https://www.reddit.com/r/aww/comments/h0g9td/the_only_transformation_pic_i_will_allow/,https://i.redd.it/mkybnnqwg4451.jpg,i.redd.it,0,13,,image,False,False,False,
82nygg,"The homeowner said that the buck shows up everyday, so they gave him a bed too.",112558,0.95,1506,2018-03-07 18:09:47,aww,36719143,https://www.reddit.com/r/aww/comments/82nygg/the_homeowner_said_that_the_buck_shows_up/,https://i.redd.it/7ie0fewk6ck01.png,i.redd.it,0,9,,image,False,False,False,
ho0bas,Beautiful grey wolf becomes a good boy when visited by woman who helped raise his pack,112540,0.94,1914,2020-07-09 15:17:01,aww,36719143,https://www.reddit.com/r/aww/comments/ho0bas/beautiful_grey_wolf_becomes_a_good_boy_when/,https://v.redd.it/dosnaev7zs951,v.redd.it,0,52,,video,False,False,False,
irak7e,My cat absolutely adores my boyfriend,112536,0.95,793,2020-09-12 16:26:54,aww,36719143,https://www.reddit.com/r/aww/comments/irak7e/my_cat_absolutely_adores_my_boyfriend/,https://i.redd.it/6xku33oz6pm51.png,i.redd.it,0,5,,image,False,False,False,
r9euit,It's not unusual for Silverbacks to be affectionate father figures. Shabani just takes that up to 11,112497,0.95,1774,2021-12-05 18:05:56,aww,36719143,https://www.reddit.com/r/aww/comments/r9euit/its_not_unusual_for_silverbacks_to_be/,https://v.redd.it/5d8hvv5yxp381,v.redd.it,0,27,,video,False,,False,
nud4d7,The rescue said to take pictures that capture my foster kitten’s personality to help her get adopted. I just sent them these.,112471,0.94,1412,2021-06-07 19:24:57,aww,36719143,https://www.reddit.com/r/aww/comments/nud4d7/the_rescue_said_to_take_pictures_that_capture_my/,https://i.redd.it/0710ph23nu371.jpg,i.redd.it,0,22,,image,False,False,False,
7cvs0v,"Daughter teaches dad how to take selfies, this is what happens",112461,0.93,1387,2017-11-14 19:33:38,aww,36719143,https://www.reddit.com/r/aww/comments/7cvs0v/daughter_teaches_dad_how_to_take_selfies_this_is/,https://i.redd.it/qkz2c77p6yxz.jpg,i.redd.it,0,2,,image,False,False,False,
9qh93s,"I'm not allowed a dog, so my neighbors built a window into my yard so I can pet theirs!",112452,0.96,862,2018-10-23 01:12:16,aww,36719143,https://www.reddit.com/r/aww/comments/9qh93s/im_not_allowed_a_dog_so_my_neighbors_built_a/,https://v.redd.it/sa7xhw2oist11,v.redd.it,0,13,,video,False,False,False,
fihxl7,"My gf wanted to adopt a kitten, I said not now. As compromise here's the kitten",112370,0.92,1048,2020-03-14 18:25:29,aww,36719143,https://www.reddit.com/r/aww/comments/fihxl7/my_gf_wanted_to_adopt_a_kitten_i_said_not_now_as/,https://i.redd.it/w6x21to8ymm41.jpg,i.redd.it,0,7,,image,False,False,False,
lie5pk,The Rock’s mom crashes his interview and it is so adorable,112332,0.87,1718,2021-02-12 21:39:16,aww,36719143,https://www.reddit.com/r/aww/comments/lie5pk/the_rocks_mom_crashes_his_interview_and_it_is_so/,https://v.redd.it/dx9mgp9zl2h61,v.redd.it,0,16,,video,False,False,False,
fvzkbd,Lost dog immediately recognizes it’s owner,112191,0.87,2099,2020-04-06 19:50:19,aww,36719143,https://www.reddit.com/r/aww/comments/fvzkbd/lost_dog_immediately_recognizes_its_owner/,https://v.redd.it/77eus8tci7r41,v.redd.it,0,23,,video,False,,False,
eslvef,Terrible towel. Very scratchy. Does not dry well. 4/10,112087,0.93,619,2020-01-23 07:03:12,aww,36719143,https://www.reddit.com/r/aww/comments/eslvef/terrible_towel_very_scratchy_does_not_dry_well_410/,https://i.redd.it/aszs2192mfc41.jpg,i.redd.it,0,37,,image,False,False,False,
pl5d6d,“Having a luck dragon with you is the only way to go on a quest” -Falcore,112079,0.86,3317,2021-09-10 01:29:40,aww,36719143,https://www.reddit.com/r/aww/comments/pl5d6d/having_a_luck_dragon_with_you_is_the_only_way_to/,https://v.redd.it/tqor4oyt9jm71,v.redd.it,0,60,,video,False,False,False,
a7gaob,This is our daughter... She is 4 and has cerebral palsy. Her birthday was today and got this cool toy. It took her literally about 5 minutes to scoot to it and climb up like this. She has never done this before. Just a personal aww that I'm proud of.,112052,0.78,1786,2018-12-19 04:26:39,aww,36719143,https://www.reddit.com/r/aww/comments/a7gaob/this_is_our_daughter_she_is_4_and_has_cerebral/,https://i.imgur.com/BUg4m3E.jpg,i.imgur.com,0,6,,link,False,,False,
kl30e9,Same cat eyes: Day vs Night,112011,0.89,838,2020-12-27 18:07:56,aww,36719143,https://www.reddit.com/r/aww/comments/kl30e9/same_cat_eyes_day_vs_night/,https://i.redd.it/rfbjcijk5q761.jpg,i.redd.it,0,12,,image,False,False,False,
hunysb,perfect day to sunbathe,111951,0.96,554,2020-07-20 21:38:17,aww,36719143,https://www.reddit.com/r/aww/comments/hunysb/perfect_day_to_sunbathe/,https://v.redd.it/xy4tbegbd1c51,v.redd.it,0,18,,video,False,False,False,
aoxark,His signature move when he sleeps (my heart melts every time),111899,0.92,916,2019-02-10 03:33:02,aww,36719143,https://www.reddit.com/r/aww/comments/aoxark/his_signature_move_when_he_sleeps_my_heart_melts/,https://v.redd.it/bhgdyo148mf21,v.redd.it,0,25,,video,False,False,False,
fnt617,Not using the heater during quarantine to save $$. Thought the cat was missing 🙃,111847,0.96,688,2020-03-24 03:43:25,aww,36719143,https://www.reddit.com/r/aww/comments/fnt617/not_using_the_heater_during_quarantine_to_save/,https://v.redd.it/gj6s505wxho41,v.redd.it,0,12,,video,False,False,False,
htdh26,Just eating a little snacky snack,111850,0.97,857,2020-07-18 14:16:43,aww,36719143,https://www.reddit.com/r/aww/comments/htdh26/just_eating_a_little_snacky_snack/,https://v.redd.it/ci7hwf57wkb51,v.redd.it,0,34,,video,False,False,False,
loobut,We fed our backyard squirrel ONCE... meet Frankie at our backyard door waiting for more nuts.,111822,0.95,1434,2021-02-21 09:22:10,aww,36719143,https://www.reddit.com/r/aww/comments/loobut/we_fed_our_backyard_squirrel_once_meet_frankie_at/,https://i.redd.it/22ffy0qw6ri61.jpg,i.redd.it,0,15,,image,False,False,False,
ar5rc4,This guy followed my wife and son home from the park. he had a chip and we found the owner lived 25 miles away from us. We returned him and the next day we received a call from the owner asking us if we wanted to keep him. Reddit meet Boomer. :),111806,0.9,1931,2019-02-16 11:00:40,aww,36719143,https://www.reddit.com/r/aww/comments/ar5rc4/this_guy_followed_my_wife_and_son_home_from_the/,https://i.redd.it/l6vv9azk9vg21.jpg,i.redd.it,0,4,,image,False,,False,
isngay,Oh to be a sheep lazily nibbling grass on a hill,111796,0.97,1029,2020-09-14 21:17:54,aww,36719143,https://www.reddit.com/r/aww/comments/isngay/oh_to_be_a_sheep_lazily_nibbling_grass_on_a_hill/,https://v.redd.it/h5pc73wiw4n51,v.redd.it,0,26,,video,False,False,False,
nv1vmj,Elephant herd siesta,111699,0.96,1105,2021-06-08 17:00:45,aww,36719143,https://www.reddit.com/r/aww/comments/nv1vmj/elephant_herd_siesta/,https://v.redd.it/2ob5qkjz11471,v.redd.it,0,25,,video,False,False,False,
cylw8e,They have learned rather quickly that I provide breakfast on a regular schedule. Was 5 mins late and got told for it.,111684,0.94,1336,2019-09-02 13:02:59,aww,36719143,https://www.reddit.com/r/aww/comments/cylw8e/they_have_learned_rather_quickly_that_i_provide/,https://i.redd.it/rbqm5m6wv4k31.jpg,i.redd.it,0,22,,image,False,False,False,
hoz1bj,My boy Gatsby working on his headshots,111679,0.96,1146,2020-07-11 04:21:46,aww,36719143,https://www.reddit.com/r/aww/comments/hoz1bj/my_boy_gatsby_working_on_his_headshots/,https://i.redd.it/1r0mn43804a51.jpg,i.redd.it,0,14,,image,False,False,False,
g3lz8f,"Old Lady Smudge took a while to warm up to us. She now politely asks us to stroke her, but only lets us do it for five seconds before she’s had enough.",111613,0.95,291,2020-04-18 16:52:24,aww,36719143,https://www.reddit.com/r/aww/comments/g3lz8f/old_lady_smudge_took_a_while_to_warm_up_to_us_she/,https://v.redd.it/q1gkd57g9kt41,v.redd.it,0,13,,video,False,False,False,
atge52,"This is Pixar, she seems to know when I’m down and does something silly to make me laugh.",111594,0.9,936,2019-02-22 16:50:05,aww,36719143,https://www.reddit.com/r/aww/comments/atge52/this_is_pixar_she_seems_to_know_when_im_down_and/,https://i.redd.it/tbbfry7dt3i21.jpg,i.redd.it,0,20,,image,False,False,False,
gsk3d0,Little girl teaching her cats how to draw a flower,111569,0.94,1694,2020-05-29 07:49:24,aww,36719143,https://www.reddit.com/r/aww/comments/gsk3d0/little_girl_teaching_her_cats_how_to_draw_a_flower/,https://v.redd.it/sm6wu9816m151,v.redd.it,0,63,,video,False,False,False,
he079o,First time scratching post lesson for kitten,111572,0.96,655,2020-06-23 02:02:11,aww,36719143,https://www.reddit.com/r/aww/comments/he079o/first_time_scratching_post_lesson_for_kitten/,https://v.redd.it/qnubdnzpui651,v.redd.it,0,12,,video,False,False,False,
10tdpun,Watching the whole family grow up together,111549,0.9,825,2023-02-04 16:22:40,aww,36719143,https://www.reddit.com/r/aww/comments/10tdpun/watching_the_whole_family_grow_up_together/,https://v.redd.it/1v91rx4e17ga1,v.redd.it,0,13,,video,False,False,False,
fnwuiu,My sister is a Ballet teacher and with the remote schooling due to Coronavirus she now has to record her lessons. A certain somebody is adapting to this very enthusiastically!,111533,0.94,969,2020-03-24 07:33:25,aww,36719143,https://www.reddit.com/r/aww/comments/fnwuiu/my_sister_is_a_ballet_teacher_and_with_the_remote/,https://v.redd.it/dzne7hp12jo41,v.redd.it,0,33,,video,False,False,False,
mmyqjw,"A Family portrait during the Spanish Flu, 1918",111530,0.89,1780,2021-04-09 00:25:17,aww,36719143,https://www.reddit.com/r/aww/comments/mmyqjw/a_family_portrait_during_the_spanish_flu_1918/,https://i.redd.it/nylc0duyxzr61.jpg,i.redd.it,0,21,,image,False,,False,
gwt2h1,Guy finds a baby possum having trouble keeping up with their mom and returns the little fella to her,111519,0.95,2038,2020-06-05 05:06:46,aww,36719143,https://www.reddit.com/r/aww/comments/gwt2h1/guy_finds_a_baby_possum_having_trouble_keeping_up/,https://gfycat.com/babyishbowedalligatorgar,gfycat.com,0,15,,link,False,False,False,
8b4s6p,I decided to go back to college in my 30's and my grandma sends me a card every month for support.,111497,0.93,1551,2018-04-10 09:27:28,aww,36719143,https://www.reddit.com/r/aww/comments/8b4s6p/i_decided_to_go_back_to_college_in_my_30s_and_my/,https://i.imgur.com/dTJkvkn.jpg,i.imgur.com,0,3,,link,False,False,False,
a01rl2,22 years and counting.,111446,0.92,1260,2018-11-25 01:40:41,aww,36719143,https://www.reddit.com/r/aww/comments/a01rl2/22_years_and_counting/,https://i.redd.it/ucxkcql06c021.jpg,i.redd.it,0,3,,image,False,False,False,
bh3ynf,Update: The baby fox at my grandmother's house has a friend and they are chasing each other,111442,0.97,612,2019-04-25 09:01:43,aww,36719143,https://www.reddit.com/r/aww/comments/bh3ynf/update_the_baby_fox_at_my_grandmothers_house_has/,https://i.redd.it/ejt1spncybu21.jpg,i.redd.it,0,9,,image,False,False,False,
kv81je,This shy girl just arrived at the shelter I volunteer at,111413,0.95,1512,2021-01-11 23:30:25,aww,36719143,https://www.reddit.com/r/aww/comments/kv81je/this_shy_girl_just_arrived_at_the_shelter_i/,https://v.redd.it/sge9ty0ssqa61,v.redd.it,0,4,,video,False,False,False,
gvkd6o,Man bringing two wiggly puppers into the vets,111405,0.95,514,2020-06-03 06:54:58,aww,36719143,https://www.reddit.com/r/aww/comments/gvkd6o/man_bringing_two_wiggly_puppers_into_the_vets/,https://gfycat.com/wideeyedbrightkinglet,gfycat.com,0,15,,link,False,False,False,
i6mhwx,Moose taking an afternoon nap in my Dad's garden.,111407,0.98,1351,2020-08-09 22:16:39,aww,36719143,https://www.reddit.com/r/aww/comments/i6mhwx/moose_taking_an_afternoon_nap_in_my_dads_garden/,https://i.redd.it/4tz8iouaa0g51.jpg,i.redd.it,0,20,,image,False,False,False,
aizrei,We built a catio so our indoor cats could enjoy fresh air and nature. The dogs are jealous...,111363,0.95,1661,2019-01-23 19:07:00,aww,36719143,https://www.reddit.com/r/aww/comments/aizrei/we_built_a_catio_so_our_indoor_cats_could_enjoy/,https://v.redd.it/3gldokxyb6c21,v.redd.it,0,27,,video,False,False,False,
mgksyp,Baby Goats’ morning routine,111348,0.94,2103,2021-03-30 22:37:48,aww,36719143,https://www.reddit.com/r/aww/comments/mgksyp/baby_goats_morning_routine/,https://v.redd.it/8ywvlwdi67q61,v.redd.it,0,31,,video,False,False,False,
9kse7t,Look what I caught my contractor doing!!!,111325,0.94,2454,2018-10-02 22:28:37,aww,36719143,https://www.reddit.com/r/aww/comments/9kse7t/look_what_i_caught_my_contractor_doing/,https://v.redd.it/mpqx7i9bzsp11,v.redd.it,0,11,,video,False,,False,
emklv2,Baby kangaroos saved from the Australia fires,111197,0.97,1173,2020-01-10 08:14:49,aww,36719143,https://www.reddit.com/r/aww/comments/emklv2/baby_kangaroos_saved_from_the_australia_fires/,https://v.redd.it/c7b02tbz6v941,v.redd.it,0,40,,video,False,,False,
yft8ad,My dog and I dressed as Scooby and Velma this year! 🎃 (OC),111097,0.88,1266,2022-10-28 22:02:20,aww,36719143,https://www.reddit.com/r/aww/comments/yft8ad/my_dog_and_i_dressed_as_scooby_and_velma_this/,https://i.redd.it/tw0i9kq3qkw91.png,i.redd.it,0,7,,image,False,False,False,
8gu33z,This is what cat engagement photos would look like.,111078,0.94,687,2018-05-04 03:16:46,aww,36719143,https://www.reddit.com/r/aww/comments/8gu33z/this_is_what_cat_engagement_photos_would_look_like/,https://i.redd.it/6azy3rjaopv01.jpg,i.redd.it,0,12,,image,False,False,False,
x89ujl,Puppy is one with nature,110978,0.95,728,2022-09-07 22:09:12,aww,36719143,https://www.reddit.com/r/aww/comments/x89ujl/puppy_is_one_with_nature/,https://v.redd.it/gs4y23hysgm91,v.redd.it,0,42,,video,False,False,False,
8io64x,"Last year, while setting up lights for some glamour shots, Kodiak decided he would sit to help me test.",110951,0.94,751,2018-05-11 19:58:28,aww,36719143,https://www.reddit.com/r/aww/comments/8io64x/last_year_while_setting_up_lights_for_some/,https://i.redd.it/m8uuk578l8x01.jpg,i.redd.it,0,11,,image,False,False,False,
7xr2xw,Business professor brought in his dog to class to help calm nerves before the big exam.,110901,0.95,1524,2018-02-15 21:00:12,aww,36719143,https://www.reddit.com/r/aww/comments/7xr2xw/business_professor_brought_in_his_dog_to_class_to/,https://i.imgur.com/gHQPrWp.gifv,i.imgur.com,0,10,,link,False,False,False,
eq4asy,Guy recorded all the arm flops his cat made over the span of a year,110827,0.95,1122,2020-01-18 00:00:01,aww,36719143,https://www.reddit.com/r/aww/comments/eq4asy/guy_recorded_all_the_arm_flops_his_cat_made_over/,https://gfycat.com/entireuntidybarebirdbat,gfycat.com,0,30,,link,False,False,False,
gfiiit,His reaction when he realizes the bird loves him back,110786,0.95,1012,2020-05-08 05:43:09,aww,36719143,https://www.reddit.com/r/aww/comments/gfiiit/his_reaction_when_he_realizes_the_bird_loves_him/,https://i.imgur.com/lJRwlNU.gifv,i.imgur.com,0,32,,link,False,False,False,
ibkotu,He is very curious.,110737,0.97,1206,2020-08-18 00:41:50,aww,36719143,https://www.reddit.com/r/aww/comments/ibkotu/he_is_very_curious/,https://v.redd.it/fu6iks3l3mh51,v.redd.it,0,29,,video,False,False,False,
lp6unu,My dad filmed our cats for hours when we were growing up,110732,0.95,853,2021-02-22 02:46:37,aww,36719143,https://www.reddit.com/r/aww/comments/lp6unu/my_dad_filmed_our_cats_for_hours_when_we_were/,https://v.redd.it/cy4kbvl2dwi61,v.redd.it,0,8,,video,False,False,False,
gumqnh,The perfect spot,110731,0.97,507,2020-06-01 21:06:48,aww,36719143,https://www.reddit.com/r/aww/comments/gumqnh/the_perfect_spot/,https://i.redd.it/0gjdui02jb251.jpg,i.redd.it,0,16,,image,False,False,False,
homgeh,Desk buddy,110720,0.96,356,2020-07-10 15:47:43,aww,36719143,https://www.reddit.com/r/aww/comments/homgeh/desk_buddy/,https://i.redd.it/8gb8lgdo90a51.png,i.redd.it,0,12,,image,False,False,False,
85f2fe,"This is my new dog, Blu. His tongue sticks out like this all the time.",110653,0.9,1446,2018-03-19 04:47:21,aww,36719143,https://www.reddit.com/r/aww/comments/85f2fe/this_is_my_new_dog_blu_his_tongue_sticks_out_like/,https://i.imgur.com/1gRUTwr.jpg,i.imgur.com,0,11,,link,False,False,False,
g6uzvv,Master of the Sneak attack,110630,0.96,585,2020-04-24 02:39:01,aww,36719143,https://www.reddit.com/r/aww/comments/g6uzvv/master_of_the_sneak_attack/,https://gfycat.com/unrulygrandkudu,gfycat.com,0,38,,link,False,False,False,
ff49gg,Apparently bear cubs sound like a flooded engine when they purr,110624,0.96,1300,2020-03-08 05:48:11,aww,36719143,https://www.reddit.com/r/aww/comments/ff49gg/apparently_bear_cubs_sound_like_a_flooded_engine/,https://v.redd.it/ireumx5idcl41,v.redd.it,0,44,,video,False,False,False,
gzxxdh,A mother cat bringing her kittens to her owner's bed as a sign of trust,110618,0.95,1066,2020-06-10 04:00:41,aww,36719143,https://www.reddit.com/r/aww/comments/gzxxdh/a_mother_cat_bringing_her_kittens_to_her_owners/,https://gfycat.com/disgustingamusingdingo,gfycat.com,0,23,,link,False,False,False,
91t6t2,"When you partied too hard last night, now you gotta clean up the litter the next morning",110616,0.96,465,2018-07-25 21:40:32,aww,36719143,https://www.reddit.com/r/aww/comments/91t6t2/when_you_partied_too_hard_last_night_now_you/,https://i.redd.it/yb5j9b6yb4c11.jpg,i.redd.it,0,19,,image,False,,False,
7r4xqb,My attempt at a banana for scale picture of my mini dachshund Rusty. It seems like he had other plans,110564,0.91,921,2018-01-18 04:03:09,aww,36719143,https://www.reddit.com/r/aww/comments/7r4xqb/my_attempt_at_a_banana_for_scale_picture_of_my/,http://imgur.com/kPfiwIG,imgur.com,0,2,,image,False,False,False,
qpr15h,I recently moved to a rural location this year. This is my cat seeing a deer for the first time!,110521,0.92,1914,2021-11-09 05:40:26,aww,36719143,https://www.reddit.com/r/aww/comments/qpr15h/i_recently_moved_to_a_rural_location_this_year/,https://v.redd.it/dcoduz54pgy71,v.redd.it,0,17,,video,False,False,False,
ams8w4,Moist owlette,110512,0.93,729,2019-02-03 23:52:16,aww,36719143,https://www.reddit.com/r/aww/comments/ams8w4/moist_owlette/,https://v.redd.it/qforwg1dbee21,v.redd.it,0,46,,video,False,False,False,
ux4ydn,my dog was sleeping backstage and wandered out during the encore to sing with the band,110456,0.94,834,2022-05-25 05:49:22,aww,36719143,https://www.reddit.com/r/aww/comments/ux4ydn/my_dog_was_sleeping_backstage_and_wandered_out/,https://v.redd.it/a7cagxofmi191,v.redd.it,0,27,,video,False,False,False,
9ccmyo,"First photo of us, six years later",110406,0.9,1606,2018-09-02 20:28:48,aww,36719143,https://www.reddit.com/r/aww/comments/9ccmyo/first_photo_of_us_six_years_later/,https://i.redd.it/dv6odhqpauj11.jpg,i.redd.it,0,6,,image,False,False,False,
m7tjp7,Puppy playing with a butterfly,110387,0.95,1787,2021-03-18 21:10:05,aww,36719143,https://www.reddit.com/r/aww/comments/m7tjp7/puppy_playing_with_a_butterfly/,https://v.redd.it/au96ylvm3tn61,v.redd.it,0,45,,video,False,False,False,
ndu3uo,Finally earned his trust and now he waits for me every morning like this,110293,0.96,913,2021-05-16 23:38:30,aww,36719143,https://www.reddit.com/r/aww/comments/ndu3uo/finally_earned_his_trust_and_now_he_waits_for_me/,https://v.redd.it/lvnmo7uzviz61,v.redd.it,0,9,,video,False,False,False,
7dmckn,Kitty trying his best to pet gently,110145,0.94,1586,2017-11-17 22:33:03,aww,36719143,https://www.reddit.com/r/aww/comments/7dmckn/kitty_trying_his_best_to_pet_gently/,https://v.redd.it/xthx1xm8hkyz,v.redd.it,0,17,,video,False,False,False,
kn949c,"After a recent move into our first house, she’s finally found her new favorite spot!",110144,0.95,781,2020-12-31 01:09:58,aww,36719143,https://www.reddit.com/r/aww/comments/kn949c/after_a_recent_move_into_our_first_house_shes/,https://v.redd.it/ehjbnkbhnd861,v.redd.it,0,8,,video,False,False,False,
n53rq7,"This is Kabosu, she's 15 years old and was the original face of the doge meme in 2013",110094,0.95,1438,2021-05-05 06:50:50,aww,36719143,https://www.reddit.com/r/aww/comments/n53rq7/this_is_kabosu_shes_15_years_old_and_was_the/,https://i.imgur.com/xBfUgB7.jpg,i.imgur.com,0,59,,link,False,False,False,
gypjwf,My Dad got married yesterday and turned 80 today!,109995,0.91,1305,2020-06-08 07:18:17,aww,36719143,https://www.reddit.com/r/aww/comments/gypjwf/my_dad_got_married_yesterday_and_turned_80_today/,https://i.redd.it/p27s1urmdl351.jpg,i.redd.it,0,7,,image,False,False,False,
k121ir,Nimbus leveled up from Crinkled Tissue to Supermodel,109980,0.93,725,2020-11-26 03:34:52,aww,36719143,https://www.reddit.com/r/aww/comments/k121ir/nimbus_leveled_up_from_crinkled_tissue_to/,https://i.redd.it/8alziaenlg161.jpg,i.redd.it,0,6,,image,False,False,False,
