id,title,score,upvote_ratio,num_comments,created_utc,subreddit,subscribers,permalink,url,domain,num_awards,num_crossposts,crosspost_subreddits,post_type,is_nsfw,is_bot,is_megathread,body
7t3odz,"Me for the last 20 years: Mum, can we get a cat? Mum: No. *Mum moves 900km away* 2 months later she sends me a text with: ”you should come visit” and this picture.",104171,0.93,2191,2018-01-26 15:51:38,aww,36719143,https://www.reddit.com/r/aww/comments/7t3odz/me_for_the_last_20_years_mum_can_we_get_a_cat_mum/,https://i.redd.it/zg2xo8wm1ec01.jpg,i.redd.it,0,2,,image,False,False,False,
gg1rsu,A baby has its first contact with a potential surrogate mother,104172,0.95,1151,2020-05-09 02:41:10,aww,36719143,https://www.reddit.com/r/aww/comments/gg1rsu/a_baby_has_its_first_contact_with_a_potential/,https://i.imgur.com/4iqd2uC.gifv,i.imgur.com,0,19,,link,False,False,False,
9jryxr,can we get another ball??,104161,0.9,924,2018-09-29 05:07:49,aww,36719143,https://www.reddit.com/r/aww/comments/9jryxr/can_we_get_another_ball/,https://i.redd.it/8byjfdoze2p11.jpg,i.redd.it,0,16,,image,False,False,False,
ko2qax,The shelter made a rule that these siblings had to be adopted together because they were inseparable. They sleep like this every night.,104135,0.95,641,2021-01-01 07:17:54,aww,36719143,https://www.reddit.com/r/aww/comments/ko2qax/the_shelter_made_a_rule_that_these_siblings_had/,https://i.redd.it/mxojja09mm861.jpg,i.redd.it,0,10,,image,False,False,False,
c45n6d,Staff at an assisted living facility made a slip and slide for their residents.,104047,0.94,1225,2019-06-23 20:08:23,aww,36719143,https://www.reddit.com/r/aww/comments/c45n6d/staff_at_an_assisted_living_facility_made_a_slip/,https://v.redd.it/hx7vnpd1b4631,v.redd.it,0,28,,video,False,False,False,
7rlj1h,Waiting for owner,104048,0.94,1282,2018-01-20 02:38:04,aww,36719143,https://www.reddit.com/r/aww/comments/7rlj1h/waiting_for_owner/,https://gfycat.com/ZanyGleefulJabiru,gfycat.com,0,18,,link,False,False,False,
gsu80t,"Well , heres what im gonna be thinking about all day!",104036,0.94,1384,2020-05-29 20:12:11,aww,36719143,https://www.reddit.com/r/aww/comments/gsu80t/well_heres_what_im_gonna_be_thinking_about_all_day/,https://v.redd.it/tqc8camjup151,v.redd.it,0,46,,video,False,,False,
v961hp,"“I don’t want the ball, I just want to feel included""",103998,0.92,431,2022-06-10 17:23:32,aww,36719143,https://www.reddit.com/r/aww/comments/v961hp/i_dont_want_the_ball_i_just_want_to_feel_included/,https://v.redd.it/g8dtrhll8s491,v.redd.it,0,27,,video,False,False,False,
g93awn,I've taken too many photos of my corgi's butt over the past few years.,103948,0.91,1529,2020-04-27 21:23:37,aww,36719143,https://www.reddit.com/r/aww/comments/g93awn/ive_taken_too_many_photos_of_my_corgis_butt_over/,https://v.redd.it/hiqninxztdv41,v.redd.it,0,27,,video,False,False,False,
ca2nvx,The happiest little story anyone could ever ask for,103833,0.94,1149,2019-07-07 09:24:51,aww,36719143,https://www.reddit.com/r/aww/comments/ca2nvx/the_happiest_little_story_anyone_could_ever_ask/,https://gfycat.com/majesticskeletalindigobunting,gfycat.com,0,40,,link,False,False,False,
p4uxox,Dog caught sneaking into an off limits room,103833,0.93,767,2021-08-15 20:24:21,aww,36719143,https://www.reddit.com/r/aww/comments/p4uxox/dog_caught_sneaking_into_an_off_limits_room/,https://v.redd.it/hhazwaj3cjh71,v.redd.it,0,19,,video,False,False,False,
a0x1om,Solved: why my pants always have a line of cat fur across the leg.,103815,0.95,574,2018-11-27 23:06:01,aww,36719143,https://www.reddit.com/r/aww/comments/a0x1om/solved_why_my_pants_always_have_a_line_of_cat_fur/,https://i.redd.it/ag1di2q5tw021.jpg,i.redd.it,0,8,,image,False,False,False,
dhgvg6,When you're sorting the tank filters and a big boye wants cuddles,103810,0.93,1453,2019-10-14 02:59:08,aww,36719143,https://www.reddit.com/r/aww/comments/dhgvg6/when_youre_sorting_the_tank_filters_and_a_big/,https://gfycat.com/cooperativethisamericanbulldog,gfycat.com,0,53,,link,False,False,False,
aw47qk,Alapacas' curiosity is piqued when they are visited by a hedgehog,103749,0.95,1212,2019-03-01 17:45:35,aww,36719143,https://www.reddit.com/r/aww/comments/aw47qk/alapacas_curiosity_is_piqued_when_they_are/,https://gfycat.com/ickyportlyhydatidtapeworm,gfycat.com,0,34,,link,False,False,False,
nyqcjr,Hey hooman! Take a look at ma babies.,103746,0.93,1168,2021-06-13 11:57:45,aww,36719143,https://www.reddit.com/r/aww/comments/nyqcjr/hey_hooman_take_a_look_at_ma_babies/,https://v.redd.it/8x1ztkip8z471,v.redd.it,0,19,,video,False,False,False,
qdeshw,Shelter pupper walked up to a reporter in the middle of his story and wouldn’t stop hugging him. The reporter adopted him.,103687,0.93,1385,2021-10-22 16:52:17,aww,36719143,https://www.reddit.com/r/aww/comments/qdeshw/shelter_pupper_walked_up_to_a_reporter_in_the/,https://v.redd.it/my2x1npokzu71,v.redd.it,0,5,,video,False,False,False,
7zbjis,My puppy and my baby girl fight over who's going to warm their butt on the vent in the morning. The baby won today. The puppy is pouting about it.😂,103673,0.85,931,2018-02-22 08:21:48,aww,36719143,https://www.reddit.com/r/aww/comments/7zbjis/my_puppy_and_my_baby_girl_fight_over_whos_going/,https://i.redd.it/n5f8vdqzhoh01.jpg,i.redd.it,0,4,,image,False,False,False,
i1u4ms,This is Lola. She likes cheese.,103640,0.96,1024,2020-08-01 21:06:05,aww,36719143,https://www.reddit.com/r/aww/comments/i1u4ms/this_is_lola_she_likes_cheese/,https://v.redd.it/3clcmokiuee51,v.redd.it,0,46,,video,False,,False,
879b4q,This is the life we should all aspire to.,103591,0.94,861,2018-03-26 19:32:08,aww,36719143,https://www.reddit.com/r/aww/comments/879b4q/this_is_the_life_we_should_all_aspire_to/,https://i.imgur.com/cEmmQV8.gifv,i.imgur.com,0,15,,link,False,False,False,
wkj6vx,Motion activated home security camera working as intended,103589,0.93,699,2022-08-10 05:54:22,aww,36719143,https://www.reddit.com/r/aww/comments/wkj6vx/motion_activated_home_security_camera_working_as/,https://v.redd.it/4ty4ffzn4sg91,v.redd.it,0,20,,video,False,False,False,
9gnntc,"Abbey, The Dog From 'I Am Legend', Is Now 13 And Living Her Best Life",103557,0.93,1315,2018-09-18 01:21:39,aww,36719143,https://www.reddit.com/r/aww/comments/9gnntc/abbey_the_dog_from_i_am_legend_is_now_13_and/,https://i.redd.it/8usyhuwlsum11.png,i.redd.it,0,10,,image,False,False,False,
u6l09u,What...? Never seen a jacked train conductor lift 450 lbs. with a corgi on his back?,103526,0.88,1637,2022-04-19 00:45:05,aww,36719143,https://www.reddit.com/r/aww/comments/u6l09u/what_never_seen_a_jacked_train_conductor_lift_450/,https://v.redd.it/51vwz2eqpbu81,v.redd.it,0,43,,video,False,False,False,
mp9vss,The perfect selfie doesnt exis-,103506,0.83,885,2021-04-12 14:24:52,aww,36719143,https://www.reddit.com/r/aww/comments/mp9vss/the_perfect_selfie_doesnt_exis/,https://i.redd.it/0ky2z00iips61.jpg,i.redd.it,0,24,,image,False,False,False,
nx31us,"Someday in the not too distant future my son will realize I don't actually have Jedi powers; until then, I'm milking it for all it's worth!",103476,0.88,843,2021-06-11 06:07:09,aww,36719143,https://www.reddit.com/r/aww/comments/nx31us/someday_in_the_not_too_distant_future_my_son_will/,https://v.redd.it/dlwgbunc8j471,v.redd.it,0,10,,video,False,False,False,
gmcm74,"Taught Chloe to stand on my wheelchair’s feet rests, now all she wants to do is give me kisses.",103462,0.9,869,2020-05-19 04:42:32,aww,36719143,https://www.reddit.com/r/aww/comments/gmcm74/taught_chloe_to_stand_on_my_wheelchairs_feet/,https://i.redd.it/6s20w4wcvlz41.jpg,i.redd.it,0,7,,image,False,False,False,
7ba69h,Dad is given tickets to his first ever Mexican soccer game,103439,0.86,831,2017-11-07 07:55:52,aww,36719143,https://www.reddit.com/r/aww/comments/7ba69h/dad_is_given_tickets_to_his_first_ever_mexican/,https://i.imgur.com/znojgvv.gifv,i.imgur.com,0,0,,link,False,False,False,
luw2wp,Anxiously awaiting toy retrieval,103432,0.96,514,2021-03-01 06:46:24,aww,36719143,https://www.reddit.com/r/aww/comments/luw2wp/anxiously_awaiting_toy_retrieval/,https://imgur.com/mscxSDG.jpg,imgur.com,0,14,,image,False,False,False,
7nyui9,Going over to the neighbor's home to see if her best friend can come out to play.,103422,0.94,736,2018-01-04 05:19:54,aww,36719143,https://www.reddit.com/r/aww/comments/7nyui9/going_over_to_the_neighbors_home_to_see_if_her/,https://i.imgur.com/UgilTgS.gifv,i.imgur.com,0,2,,link,False,False,False,
bafg7l,I think that siren is broken,103400,0.97,666,2019-04-07 17:15:27,aww,36719143,https://www.reddit.com/r/aww/comments/bafg7l/i_think_that_siren_is_broken/,https://v.redd.it/m60xsbgyxtq21,v.redd.it,0,48,,video,False,,False,
kg6c67,His smile has made my day better! :),103383,0.9,474,2020-12-19 17:10:56,aww,36719143,https://www.reddit.com/r/aww/comments/kg6c67/his_smile_has_made_my_day_better/,https://v.redd.it/grtv23o4s4661,v.redd.it,0,8,,video,False,False,False,
8ld430,my boyfriend managed to sneak our floofer through a 30 minute trail behind the stadium so she could be at my graduation,103366,0.84,1621,2018-05-23 01:33:19,aww,36719143,https://www.reddit.com/r/aww/comments/8ld430/my_boyfriend_managed_to_sneak_our_floofer_through/,https://i.redd.it/u3pqnoh5rgz01.jpg,i.redd.it,0,7,,image,False,False,False,
9cyeo5,Toddler shows his buddy that a sprinkler is nothing to be afraid of,103369,0.94,781,2018-09-05 00:04:05,aww,36719143,https://www.reddit.com/r/aww/comments/9cyeo5/toddler_shows_his_buddy_that_a_sprinkler_is/,https://v.redd.it/ff4u3jysm9k11,v.redd.it,0,31,,video,False,False,False,
f7r2o5,Always wave back to a cat who is waving to you.,103338,0.95,463,2020-02-22 16:19:48,aww,36719143,https://www.reddit.com/r/aww/comments/f7r2o5/always_wave_back_to_a_cat_who_is_waving_to_you/,https://v.redd.it/8dk9jqglggi41,v.redd.it,0,47,,video,False,False,False,
8acu23,Got this little guy yesterday,103341,0.93,836,2018-04-07 02:00:54,aww,36719143,https://www.reddit.com/r/aww/comments/8acu23/got_this_little_guy_yesterday/,https://imgur.com/TRiXZJL,imgur.com,0,2,,image,False,False,False,
ktusoc,She brought her 8 babies a ball to play but they're still too little,103254,0.95,811,2021-01-09 22:41:47,aww,36719143,https://www.reddit.com/r/aww/comments/ktusoc/she_brought_her_8_babies_a_ball_to_play_but/,https://v.redd.it/wdz6kwdaaca61,v.redd.it,0,20,,video,False,False,False,
o8e3li,Cat does trust falls.,103188,0.96,566,2021-06-26 22:00:33,aww,36719143,https://www.reddit.com/r/aww/comments/o8e3li/cat_does_trust_falls/,https://v.redd.it/jc0ukjv30n771,v.redd.it,0,18,,video,False,False,False,
mfejdo,I’ve heard this owl for years and tonight is the first time I’ve seen it.,103121,0.96,1767,2021-03-29 06:43:19,aww,36719143,https://www.reddit.com/r/aww/comments/mfejdo/ive_heard_this_owl_for_years_and_tonight_is_the/,https://i.redd.it/60o0ts1ebvp61.jpg,i.redd.it,0,17,,image,False,False,False,
10fjmrl,"It's a new day, he is getting bolder in his attempts to be my cat",103100,0.93,2008,2023-01-19 03:28:43,aww,36719143,https://www.reddit.com/r/aww/comments/10fjmrl/its_a_new_day_he_is_getting_bolder_in_his/,https://i.redd.it/wp6ssk9q0xca1.jpg,i.redd.it,0,9,,image,False,False,False,
hvx4lr,maned wolf in Brazil,103069,0.96,1870,2020-07-22 22:11:24,aww,36719143,https://www.reddit.com/r/aww/comments/hvx4lr/maned_wolf_in_brazil/,https://v.redd.it/jlf9b8owsfc51,v.redd.it,0,30,,video,False,False,False,
a1di1s,Bummer wants to thank everyone who upvoted his puppy vaccination video today!!,102999,0.84,770,2018-11-29 08:45:45,aww,36719143,https://www.reddit.com/r/aww/comments/a1di1s/bummer_wants_to_thank_everyone_who_upvoted_his/,https://v.redd.it/ypdcfo70t6121,v.redd.it,0,8,,video,False,,False,
10nniw8,I'm currently in the early stages of labour and I think they all know it...,102964,0.94,1520,2023-01-29 01:09:09,aww,36719143,https://www.reddit.com/r/aww/comments/10nniw8/im_currently_in_the_early_stages_of_labour_and_i/,https://i.redd.it/m8fmzk1yovea1.png,i.redd.it,0,10,,image,False,False,False,
9b3iz2,Overprotective mama cat,102903,0.93,1130,2018-08-29 04:03:45,aww,36719143,https://www.reddit.com/r/aww/comments/9b3iz2/overprotective_mama_cat/,https://v.redd.it/nrpffih9vwi11,v.redd.it,0,47,,video,False,False,False,
c68du7,Grandpa makes an amazing cradle for his grandson.,102900,0.94,1224,2019-06-27 23:00:20,aww,36719143,https://www.reddit.com/r/aww/comments/c68du7/grandpa_makes_an_amazing_cradle_for_his_grandson/,https://i.redd.it/nwcrfh8epx631.jpg,i.redd.it,0,19,,image,False,False,False,
k01uec,new leg,102890,0.95,878,2020-11-24 14:53:52,aww,36719143,https://www.reddit.com/r/aww/comments/k01uec/new_leg/,https://v.redd.it/e9zym5kyo5161,v.redd.it,0,25,,video,False,False,False,
dgpdaq,I think I know what she wants for Christmas.,102885,0.9,816,2019-10-12 08:19:28,aww,36719143,https://www.reddit.com/r/aww/comments/dgpdaq/i_think_i_know_what_she_wants_for_christmas/,https://v.redd.it/4cgl5cqlx0s31,v.redd.it,0,22,,video,False,False,False,
i8e6rh,Today my Oma turns 100!!,102875,0.91,1215,2020-08-12 19:26:51,aww,36719143,https://www.reddit.com/r/aww/comments/i8e6rh/today_my_oma_turns_100/,https://i.redd.it/la6gh2duukg51.jpg,i.redd.it,0,3,,image,False,False,False,
hzonoy,My grandma had a 10th birthday party for her dog.,102826,0.93,958,2020-07-29 04:04:01,aww,36719143,https://www.reddit.com/r/aww/comments/hzonoy/my_grandma_had_a_10th_birthday_party_for_her_dog/,https://i.redd.it/tpz8ymlgdod51.jpg,i.redd.it,0,7,,image,False,False,False,
a09afw,"My kitten bringing his new toy to his older, incredibly fearful and shy older brother to check out. Probably the cutest thing I’ve ever recorded.",102811,0.93,1045,2018-11-25 20:55:43,aww,36719143,https://www.reddit.com/r/aww/comments/a09afw/my_kitten_bringing_his_new_toy_to_his_older/,https://gfycat.com/cookeddistinctboilweevil,gfycat.com,0,14,,link,False,False,False,
fy5q15,'They hired a photographer just for me!',102772,0.94,417,2020-04-10 07:25:13,aww,36719143,https://www.reddit.com/r/aww/comments/fy5q15/they_hired_a_photographer_just_for_me/,https://i.redd.it/3fzf19c1dwr41.jpg,i.redd.it,0,18,,image,False,False,False,
g7zz5g,(Update)I posted a video about 2 weeks ago about two ducks. who have chosen my dad‘s pond to nest and raise their ducklings over the last two years. You’ll be happy to know that there are now seven happy healthy ducklings,102731,0.97,1218,2020-04-26 01:15:48,aww,36719143,https://www.reddit.com/r/aww/comments/g7zz5g/updatei_posted_a_video_about_2_weeks_ago_about/,https://v.redd.it/0twn3en4p0v41,v.redd.it,0,18,,video,False,False,False,
ar8ecv,Late night study partner,102729,0.91,734,2019-02-16 18:01:08,aww,36719143,https://www.reddit.com/r/aww/comments/ar8ecv/late_night_study_partner/,https://i.imgur.com/9Hs0vt8.gifv,i.imgur.com,0,19,,link,False,False,False,
g4f5mi,My cat ripped open his favorite toy. This is my grandma sewing it back together.,102717,0.96,655,2020-04-20 02:19:03,aww,36719143,https://www.reddit.com/r/aww/comments/g4f5mi/my_cat_ripped_open_his_favorite_toy_this_is_my/,https://i.redd.it/opg7dpfk7ut41.jpg,i.redd.it,0,14,,image,False,,False,
bzj6rl,"I'm a bee keeper and think my bees are the cutest, I hope you like them too!",102634,0.94,2102,2019-06-12 04:04:26,aww,36719143,https://www.reddit.com/r/aww/comments/bzj6rl/im_a_bee_keeper_and_think_my_bees_are_the_cutest/,https://imgur.com/6XM5joR.jpg,imgur.com,0,17,,image,False,False,False,
hzejrd,A caretaker comforting his cheetah companions when they get nervous during the night,102557,0.96,1319,2020-07-28 18:52:01,aww,36719143,https://www.reddit.com/r/aww/comments/hzejrd/a_caretaker_comforting_his_cheetah_companions/,https://gfycat.com/deadlygravecavy,gfycat.com,0,38,,link,False,False,False,
fe5p8n,Never thought about what a baby peacock looked like and they don’t disappoint,102498,0.96,960,2020-03-06 06:46:37,aww,36719143,https://www.reddit.com/r/aww/comments/fe5p8n/never_thought_about_what_a_baby_peacock_looked/,https://gfycat.com/shrillselfreliantirrawaddydolphin,gfycat.com,0,46,,link,False,False,False,
fhr15j,My dentist brings his dog to work with him everyday to help with anxious patients.,102474,0.96,953,2020-03-13 06:15:06,aww,36719143,https://www.reddit.com/r/aww/comments/fhr15j/my_dentist_brings_his_dog_to_work_with_him/,https://v.redd.it/v9j8ln5m6cm41,v.redd.it,0,12,,video,False,False,False,
ogck55,Gentle giant wants to play with kitten,102454,0.95,1489,2021-07-08 23:24:46,aww,36719143,https://www.reddit.com/r/aww/comments/ogck55/gentle_giant_wants_to_play_with_kitten/,https://v.redd.it/0qqqog9s11a71,v.redd.it,0,20,,video,False,False,False,
aedwqh,My chicken just hatched out three healthy chicks! 🐣,102426,0.94,772,2019-01-10 06:57:58,aww,36719143,https://www.reddit.com/r/aww/comments/aedwqh/my_chicken_just_hatched_out_three_healthy_chicks/,https://v.redd.it/uheyq9w80i921,v.redd.it,0,15,,video,False,,False,
hfck37,A rather unexpected outcome,102401,0.96,548,2020-06-25 05:56:23,aww,36719143,https://www.reddit.com/r/aww/comments/hfck37/a_rather_unexpected_outcome/,https://v.redd.it/enaqloahay651,v.redd.it,0,22,,video,False,False,False,
17wvk46,Cozy kittens in my backyard,102380,0.92,988,2023-11-17 01:13:50,aww,36719143,https://www.reddit.com/r/aww/comments/17wvk46/cozy_kittens_in_my_backyard/,https://i.redd.it/jn0uluiyjr0c1.jpg,i.redd.it,0,7,,image,False,False,False,
ifgm9b,My foster mama Ellie had her babies yesterday - apparently she came with a whole lab sampler pack!,102360,0.96,822,2020-08-24 08:01:10,aww,36719143,https://www.reddit.com/r/aww/comments/ifgm9b/my_foster_mama_ellie_had_her_babies_yesterday/,https://i.redd.it/2un1rizg3vi51.jpg,i.redd.it,0,6,,image,False,False,False,
aekc5f,Let’s spend all nine lives together.,102333,0.94,507,2019-01-10 21:32:32,aww,36719143,https://www.reddit.com/r/aww/comments/aekc5f/lets_spend_all_nine_lives_together/,https://i.redd.it/ntzy69alcm921.jpg,i.redd.it,0,27,,image,False,False,False,
kkn0op,I've never seen a puppy pranking his nosey siblings,102320,0.95,589,2020-12-26 23:46:45,aww,36719143,https://www.reddit.com/r/aww/comments/kkn0op/ive_never_seen_a_puppy_pranking_his_nosey_siblings/,https://v.redd.it/0e00dst0pk761,v.redd.it,0,31,,video,False,False,False,
egisn6,My dog likes to check on me to make sure I’m still having a good time on our walk,102329,0.96,837,2019-12-28 05:04:09,aww,36719143,https://www.reddit.com/r/aww/comments/egisn6/my_dog_likes_to_check_on_me_to_make_sure_im_still/,https://v.redd.it/uqqzh76wg9741,v.redd.it,0,11,,video,False,False,False,
adez03,Chicken completes tiny agility course (Wait for the hop),102316,0.92,924,2019-01-07 12:01:38,aww,36719143,https://www.reddit.com/r/aww/comments/adez03/chicken_completes_tiny_agility_course_wait_for/,https://v.redd.it/ebzygq4x3y821,v.redd.it,0,27,,video,False,,False,
bvyz80,My boy got neutered yesterday. The vet office took a photo for me after he woke up.,102316,0.96,1356,2019-06-02 21:41:20,aww,36719143,https://www.reddit.com/r/aww/comments/bvyz80/my_boy_got_neutered_yesterday_the_vet_office_took/,https://i.redd.it/nqonlxkiwy131.jpg,i.redd.it,0,27,,image,False,False,False,
w4sfo2,She’s only brave when the cat’s not looking at her…,102312,0.94,922,2022-07-22 03:03:22,aww,36719143,https://www.reddit.com/r/aww/comments/w4sfo2/shes_only_brave_when_the_cats_not_looking_at_her/,https://v.redd.it/tpo0iid271d91,v.redd.it,0,29,,video,False,False,False,
9l24wi,My boss brought her Labrador into the office today. He came and said hello.,102274,0.94,797,2018-10-03 20:53:53,aww,36719143,https://www.reddit.com/r/aww/comments/9l24wi/my_boss_brought_her_labrador_into_the_office/,https://i.redd.it/vgpyu95fnzp11.jpg,i.redd.it,0,9,,image,False,False,False,
k1g0m7,Didn't you drop it?,102275,0.95,696,2020-11-26 19:51:53,aww,36719143,https://www.reddit.com/r/aww/comments/k1g0m7/didnt_you_drop_it/,https://v.redd.it/letowdjvfl161,v.redd.it,0,26,,video,False,False,False,
k4nlln,He fits perfectly.,102231,0.87,1065,2020-12-01 21:28:48,aww,36719143,https://www.reddit.com/r/aww/comments/k4nlln/he_fits_perfectly/,https://v.redd.it/10vi5hbsll261,v.redd.it,0,21,,video,False,False,False,
avcsb7,My husband was downstairs making tacos. He sent our dog upstairs to let me know they're ready.,102219,0.91,616,2019-02-27 17:37:57,aww,36719143,https://www.reddit.com/r/aww/comments/avcsb7/my_husband_was_downstairs_making_tacos_he_sent/,https://i.redd.it/ytpv75qhq3j21.jpg,i.redd.it,0,17,,image,False,False,False,
fmnw41,My dog Ghost is veryyyy suspicious why I'm home on a work day.,102170,0.96,891,2020-03-22 03:34:45,aww,36719143,https://www.reddit.com/r/aww/comments/fmnw41/my_dog_ghost_is_veryyyy_suspicious_why_im_home_on/,https://i.redd.it/9xdwiijsl3o41.jpg,i.redd.it,0,12,,image,False,False,False,
9vo2e1,Look at this asshole using up two seats like he owns the train or something,102152,0.93,991,2018-11-10 02:10:12,aww,36719143,https://www.reddit.com/r/aww/comments/9vo2e1/look_at_this_asshole_using_up_two_seats_like_he/,https://i.redd.it/iw3oektl9dx11.jpg,i.redd.it,0,20,,image,False,False,False,
jdfp2r,Head scritches = Instant golden smiles,102153,0.94,354,2020-10-18 18:13:09,aww,36719143,https://www.reddit.com/r/aww/comments/jdfp2r/head_scritches_instant_golden_smiles/,https://v.redd.it/d7fiue9bmut51,v.redd.it,0,12,,video,False,False,False,
n6rxef,My Cat is a very proud mom.,102122,0.93,881,2021-05-07 11:46:57,aww,36719143,https://www.reddit.com/r/aww/comments/n6rxef/my_cat_is_a_very_proud_mom/,https://i.redd.it/le7gv2u35nx61.jpg,i.redd.it,0,8,,image,False,False,False,
70efy1,Snow leopards are no longer endangered <3,102087,0.95,1243,2017-09-16 07:53:31,aww,36719143,https://www.reddit.com/r/aww/comments/70efy1/snow_leopards_are_no_longer_endangered_3/,https://i.imgur.com/54hPKgp.jpg,i.imgur.com,0,1,,link,False,False,False,
aalwih,A tiger checking the depth of the water before relaxing,102087,0.96,685,2018-12-29 20:40:54,aww,36719143,https://www.reddit.com/r/aww/comments/aalwih/a_tiger_checking_the_depth_of_the_water_before/,https://v.redd.it/vax25rz6g8721,v.redd.it,0,27,,video,False,False,False,
ajjlz1,"My Dad is afraid to fly, so when I was 5 yrs old I made him a doll to hold on the plane. Mom just sent me this picture. He is packed to come visit me. The doll is 43 years old!",102086,0.93,1045,2019-01-25 06:36:50,aww,36719143,https://www.reddit.com/r/aww/comments/ajjlz1/my_dad_is_afraid_to_fly_so_when_i_was_5_yrs_old_i/,https://i.redd.it/by8myu3gygc21.jpg,i.redd.it,0,10,,image,False,False,False,
xlajkw,When you let your Jewish Grandfather babysit your dog...,102033,0.91,1648,2022-09-23 00:49:02,aww,36719143,https://www.reddit.com/r/aww/comments/xlajkw/when_you_let_your_jewish_grandfather_babysit_your/,https://v.redd.it/66qi0873ngp91,v.redd.it,0,24,,video,False,False,False,
1dioh21,"The best friend I've ever had when I was 15, 25 and 30",101984,0.95,1183,2024-06-18 17:05:10,aww,36719143,https://www.reddit.com/r/aww/comments/1dioh21/the_best_friend_ive_ever_had_when_i_was_15_25_and/,https://i.redd.it/larl989ngb7d1.jpeg,i.redd.it,0,11,,image,False,False,False,
issbqo,"Got a new kitten who has no fear, this is how I have to eat every meal now 😅",101937,0.94,1795,2020-09-15 01:10:50,aww,36719143,https://www.reddit.com/r/aww/comments/issbqo/got_a_new_kitten_who_has_no_fear_this_is_how_i/,https://i.redd.it/g25gg2ib26n51.jpg,i.redd.it,0,9,,image,False,False,False,
jbosu5,Pumpkin hates windy beach,101930,0.93,931,2020-10-15 20:11:08,aww,36719143,https://www.reddit.com/r/aww/comments/jbosu5/pumpkin_hates_windy_beach/,https://i.redd.it/8z7d0qt3t9t51.jpg,i.redd.it,0,23,,image,False,False,False,
cr90nb,Reverse card,101916,0.95,931,2019-08-16 22:15:48,aww,36719143,https://www.reddit.com/r/aww/comments/cr90nb/reverse_card/,https://i.redd.it/aey47321bug31.jpg,i.redd.it,0,23,,image,False,False,False,
teonq8,Meep,101876,0.96,1294,2022-03-15 18:40:42,aww,36719143,https://www.reddit.com/r/aww/comments/teonq8/meep/,https://v.redd.it/xc60ojnbrjn81,v.redd.it,0,55,,video,False,False,False,
z352lq,"This is the fattest polar bear in Alaska. His name is Fat Albert and he lives in a village named Katovik. He weights over 1,000lbs!",101858,0.94,2063,2022-11-24 05:45:25,aww,36719143,https://www.reddit.com/r/aww/comments/z352lq/this_is_the_fattest_polar_bear_in_alaska_his_name/,https://i.redd.it/wh36cqq22u1a1.jpg,i.redd.it,0,38,,image,False,False,False,
az5oa5,Chip and Dale are here to rock this city,101831,0.91,631,2019-03-09 22:46:18,aww,36719143,https://www.reddit.com/r/aww/comments/az5oa5/chip_and_dale_are_here_to_rock_this_city/,https://i.redd.it/wyhwf6r8m4l21.jpg,i.redd.it,0,8,,image,False,False,False,
c26dey,17 years later...,101807,0.96,753,2019-06-19 00:36:38,aww,36719143,https://www.reddit.com/r/aww/comments/c26dey/17_years_later/,https://v.redd.it/ef7w7wm7y5531,v.redd.it,0,21,,video,False,False,False,
ckuqjy,The way this talented groomer creates trust with this shibe in less than 60 seconds,101776,0.9,2194,2019-08-02 03:08:15,aww,36719143,https://www.reddit.com/r/aww/comments/ckuqjy/the_way_this_talented_groomer_creates_trust_with/,https://gfycat.com/frequentglasshammerheadbird,gfycat.com,0,47,,link,False,False,False,
j9gs7w,Her name is Pigeon and she gets excited when it's time to put on her chair,101777,0.93,990,2020-10-12 05:55:09,aww,36719143,https://www.reddit.com/r/aww/comments/j9gs7w/her_name_is_pigeon_and_she_gets_excited_when_its/,https://v.redd.it/k74dhnpj5ks51,v.redd.it,0,37,,video,False,False,False,
la5nvj,Close enough,101691,0.93,249,2021-02-01 20:58:59,aww,36719143,https://www.reddit.com/r/aww/comments/la5nvj/close_enough/,https://i.redd.it/x8e1wr60xve61.jpg,i.redd.it,0,9,,image,False,False,False,
8a5z0p,Peach wants to know who is responsible for this sign.,101671,0.93,726,2018-04-06 08:05:02,aww,36719143,https://www.reddit.com/r/aww/comments/8a5z0p/peach_wants_to_know_who_is_responsible_for_this/,https://i.redd.it/gb8oag56a7q01.jpg,i.redd.it,0,6,,image,False,False,False,
