id,title,score,upvote_ratio,num_comments,created_utc,subreddit,subscribers,permalink,url,domain,num_awards,num_crossposts,crosspost_subreddits,post_type,is_nsfw,is_bot,is_megathread,body
l8xbbh,This excellent home security camera that picks up every movement,132436,0.94,870,2021-01-31 03:51:08,aww,36719143,https://www.reddit.com/r/aww/comments/l8xbbh/this_excellent_home_security_camera_that_picks_up/,https://v.redd.it/l0lkci8moje61,v.redd.it,0,31,,video,False,False,False,
kvej0q,Heard crying in our backyard Friday night and we found her,132343,0.95,1413,2021-01-12 04:33:34,aww,36719143,https://www.reddit.com/r/aww/comments/kvej0q/heard_crying_in_our_backyard_friday_night_and_we/,https://i.redd.it/nqhj11qyasa61.jpg,i.redd.it,0,7,,image,False,False,False,
axslaq,Her reaction at the end :’),132047,0.88,1356,2019-03-06 06:17:27,aww,36719143,https://www.reddit.com/r/aww/comments/axslaq/her_reaction_at_the_end/,https://v.redd.it/s9vj6q51bek21,v.redd.it,0,57,,video,False,False,False,
g0w7e8,Now THAT’S how you quarantine,131909,0.94,865,2020-04-14 07:00:11,aww,36719143,https://www.reddit.com/r/aww/comments/g0w7e8/now_thats_how_you_quarantine/,https://v.redd.it/q44nef17sos41,v.redd.it,0,32,,video,False,False,False,
9iu6qw,"My autistic son hates his photo taken, so I let him wear a t-rex suit for family photos.",131906,0.88,1778,2018-09-25 22:58:10,aww,36719143,https://www.reddit.com/r/aww/comments/9iu6qw/my_autistic_son_hates_his_photo_taken_so_i_let/,https://i.redd.it/7no42lz96fo11.jpg,i.redd.it,0,26,,image,False,False,False,
dmlzcj,Cinderblock's first time on the treadmill trying to lose weight,131790,0.95,2522,2019-10-25 01:40:19,aww,36719143,https://www.reddit.com/r/aww/comments/dmlzcj/cinderblocks_first_time_on_the_treadmill_trying/,https://v.redd.it/2mywtwm8qju31,v.redd.it,0,80,,video,False,False,False,
71eyzu,"This is ""Frida"", she has saved 52 people so far in Mexico's Earthquake",131672,0.94,1531,2017-09-21 04:29:30,aww,36719143,https://www.reddit.com/r/aww/comments/71eyzu/this_is_frida_she_has_saved_52_people_so_far_in/,https://i.imgur.com/kPkQTic.jpg,i.imgur.com,0,12,,link,False,False,False,
91380g,Proud boy finding best stick,131644,0.92,1483,2018-07-23 07:47:36,aww,36719143,https://www.reddit.com/r/aww/comments/91380g/proud_boy_finding_best_stick/,https://i.imgur.com/YD7woOr.gifv,i.imgur.com,0,41,,link,False,,False,
o2bp8n,Lemme just *blob* for u,131462,0.96,2152,2021-06-18 05:35:10,aww,36719143,https://www.reddit.com/r/aww/comments/o2bp8n/lemme_just_blob_for_u/,https://v.redd.it/l31szusx0x571,v.redd.it,0,53,,video,False,False,False,
6vmv8d,My sister's husky ran out of ink while giving birth,131370,0.93,2315,2017-08-24 04:51:01,aww,36719143,https://www.reddit.com/r/aww/comments/6vmv8d/my_sisters_husky_ran_out_of_ink_while_giving_birth/,https://i.redd.it/bqjvrehhmkhz.jpg,i.redd.it,0,3,,image,False,False,False,
7ojx5y,Puppy wants to nap with his friend,131342,0.96,783,2018-01-06 21:16:44,aww,36719143,https://www.reddit.com/r/aww/comments/7ojx5y/puppy_wants_to_nap_with_his_friend/,https://i.imgur.com/TAAsLjN.gifv,i.imgur.com,0,9,,link,False,False,False,
avxq37,This is Phil.,131248,0.93,2101,2019-03-01 05:08:37,aww,36719143,https://www.reddit.com/r/aww/comments/avxq37/this_is_phil/,https://i.redd.it/1lz2ulmmaej21.jpg,i.redd.it,0,39,,image,False,,False,
a5pfv8,"Not many farm cats make it to 18, but Carrot has",131120,0.95,1411,2018-12-13 08:34:50,aww,36719143,https://www.reddit.com/r/aww/comments/a5pfv8/not_many_farm_cats_make_it_to_18_but_carrot_has/,https://i.redd.it/a9606qaboy321.jpg,i.redd.it,0,9,,image,False,False,False,
rshwp0,A goat followed my friend home from work!,131053,0.94,2462,2021-12-31 07:00:04,aww,36719143,https://www.reddit.com/r/aww/comments/rshwp0/a_goat_followed_my_friend_home_from_work/,https://i.redd.it/mxkpzviv6s881.jpg,i.redd.it,0,23,,image,False,False,False,
jvt6x2,The best transition of all,130955,0.89,602,2020-11-17 19:14:13,aww,36719143,https://www.reddit.com/r/aww/comments/jvt6x2/the_best_transition_of_all/,https://v.redd.it/6646pzcw0tz51,v.redd.it,0,28,,video,False,False,False,
ivz83r,"Just turned 21 years. He has accompanied me through teenage years, college, marriage, and was still able to meet my 4 month old baby. Thank you for a lifetime of companionship...I love you with all my 💓.",130832,0.95,1138,2020-09-20 01:06:05,aww,36719143,https://www.reddit.com/r/aww/comments/ivz83r/just_turned_21_years_he_has_accompanied_me/,https://i.redd.it/5lgis5jzp5o51.jpg,i.redd.it,0,5,,image,False,False,False,
hxtf6l,Owls are the cats of the air,130785,0.96,1495,2020-07-26 01:46:01,aww,36719143,https://www.reddit.com/r/aww/comments/hxtf6l/owls_are_the_cats_of_the_air/,https://gfycat.com/politicaljealousappaloosa,gfycat.com,0,53,,link,False,False,False,
cyv97r,Scared cat gets saved by two French guys,130771,0.97,1903,2019-09-03 02:51:49,aww,36719143,https://www.reddit.com/r/aww/comments/cyv97r/scared_cat_gets_saved_by_two_french_guys/,https://v.redd.it/f6joj5rpz8k31,v.redd.it,0,43,,video,False,False,False,
lo9s58,"when no one is around to boop his snoot,he boops it himself.",130512,0.96,680,2021-02-20 21:17:44,aww,36719143,https://www.reddit.com/r/aww/comments/lo9s58/when_no_one_is_around_to_boop_his_snoothe_boops/,https://v.redd.it/9sr9mcrklni61,v.redd.it,0,40,,video,False,False,False,
8z3t32,"I haven’t met my new neighbor yet, but her dogs love me",130495,0.96,825,2018-07-15 23:56:41,aww,36719143,https://www.reddit.com/r/aww/comments/8z3t32/i_havent_met_my_new_neighbor_yet_but_her_dogs/,https://i.redd.it/5rbdwrt4n5a11.jpg,i.redd.it,0,10,,image,False,False,False,
eoumv3,This is Jubilee. She just happens to look like bad taxidermy.,130423,0.96,1562,2020-01-15 06:18:04,aww,36719143,https://www.reddit.com/r/aww/comments/eoumv3/this_is_jubilee_she_just_happens_to_look_like_bad/,https://i.redd.it/5n567vtpaua41.jpg,i.redd.it,0,31,,image,False,,False,
7bwtiu,I haven't found what they broke yet,130238,0.96,2032,2017-11-10 03:49:24,aww,36719143,https://www.reddit.com/r/aww/comments/7bwtiu/i_havent_found_what_they_broke_yet/,https://imgur.com/Ke8Uxel,imgur.com,0,1,,image,False,False,False,
d1199o,"Reddit was mad last year when the puppy pool party video I posted was only 15 seconds. It’s been 365 days, and I present: splash dance 2019, a much longer video.",130233,0.95,1768,2019-09-08 02:04:02,aww,36719143,https://www.reddit.com/r/aww/comments/d1199o/reddit_was_mad_last_year_when_the_puppy_pool/,https://v.redd.it/8tk7sqt6f8l31,v.redd.it,0,30,,video,False,False,False,
uqywl2,Puppy’s first bath,130011,0.95,804,2022-05-16 21:14:52,aww,36719143,https://www.reddit.com/r/aww/comments/uqywl2/puppys_first_bath/,https://v.redd.it/hl70e0nczuz81,v.redd.it,0,32,,video,False,False,False,
i165mu,My cat thought I was lost so she was leading me home,129889,0.95,1312,2020-07-31 17:19:47,aww,36719143,https://www.reddit.com/r/aww/comments/i165mu/my_cat_thought_i_was_lost_so_she_was_leading_me/,https://gfycat.com/densenegativechrysomelid,gfycat.com,0,19,,link,False,False,False,
gh5ift,My daughter playing Pokémon the first time and catching her first Pokémon,129694,0.9,2069,2020-05-10 22:53:43,aww,36719143,https://www.reddit.com/r/aww/comments/gh5ift/my_daughter_playing_pokémon_the_first_time_and/,https://v.redd.it/nx1i5gvx1zx41,v.redd.it,0,23,,video,False,False,False,
7sweit,Falling asleep.,129428,0.96,1326,2018-01-25 19:58:54,aww,36719143,https://www.reddit.com/r/aww/comments/7sweit/falling_asleep/,https://i.imgur.com/8srChE2.gifv,i.imgur.com,0,15,,link,False,False,False,
satblv,"Holding him is the only way I can get some peace in the morning. Can’t believe he did this today, I’m melting.",129317,0.9,1326,2022-01-23 18:40:14,aww,36719143,https://www.reddit.com/r/aww/comments/satblv/holding_him_is_the_only_way_i_can_get_some_peace/,https://v.redd.it/kn0t77ersfd81,v.redd.it,0,10,,video,False,False,False,
hbdi8f,Explosive detection canine TTirado got an awesome reward after his final bag search before retirement!,129275,0.95,979,2020-06-18 17:47:29,aww,36719143,https://www.reddit.com/r/aww/comments/hbdi8f/explosive_detection_canine_ttirado_got_an_awesome/,https://v.redd.it/b3mhyhlhun551,v.redd.it,0,23,,video,False,False,False,
c8v7cm,"Too hot to play fetch outside, so how about a game of lazy fetch inside?",129161,0.98,601,2019-07-04 04:51:06,aww,36719143,https://www.reddit.com/r/aww/comments/c8v7cm/too_hot_to_play_fetch_outside_so_how_about_a_game/,https://gfycat.com/fluffyjadedbrocketdeer,gfycat.com,0,43,,link,False,False,False,
irysf6,"Oh lawd, he comin'",129079,0.95,584,2020-09-13 19:31:59,aww,36719143,https://www.reddit.com/r/aww/comments/irysf6/oh_lawd_he_comin/,https://i.redd.it/0dvp0ucx8xm51.png,i.redd.it,0,12,,image,False,False,False,
k27qyd,"We don’t deserve dogs. And I’m not crying, you’re crying.",128946,0.88,1387,2020-11-28 00:53:46,aww,36719143,https://www.reddit.com/r/aww/comments/k27qyd/we_dont_deserve_dogs_and_im_not_crying_youre/,https://v.redd.it/f4qh5kvn2u161,v.redd.it,0,18,,video,False,False,False,
jcfdnp,"I recently rescued Dudeson, he hated getting into my truck. figured out he’s a visual learner",128809,0.89,917,2020-10-17 00:00:54,aww,36719143,https://www.reddit.com/r/aww/comments/jcfdnp/i_recently_rescued_dudeson_he_hated_getting_into/,https://v.redd.it/37nrk6lh0it51,v.redd.it,0,19,,video,False,False,False,
mw9sex,Truly a Good Samaritan.,128486,0.93,1670,2021-04-22 22:50:16,aww,36719143,https://www.reddit.com/r/aww/comments/mw9sex/truly_a_good_samaritan/,https://i.redd.it/o5h7embsdru61.jpg,i.redd.it,0,9,,image,False,False,False,
a60j7b,Waiting for food,128374,0.95,874,2018-12-14 08:01:13,aww,36719143,https://www.reddit.com/r/aww/comments/a60j7b/waiting_for_food/,https://i.redd.it/47dnvj48n5421.jpg,i.redd.it,0,19,,image,False,False,False,
bm8bx1,"My dad is retired now and helped with rehabilitating a squirrel he found. The squirrel comes back daily for snacks, pets, and fights.",128278,0.97,1870,2019-05-08 23:16:01,aww,36719143,https://www.reddit.com/r/aww/comments/bm8bx1/my_dad_is_retired_now_and_helped_with/,https://v.redd.it/dggiwywfy0x21,v.redd.it,0,42,,video,False,False,False,
cghmlc,A man said he couldn’t breathe when sleeping so he installed a camera to see why,128092,0.93,1795,2019-07-23 00:48:15,aww,36719143,https://www.reddit.com/r/aww/comments/cghmlc/a_man_said_he_couldnt_breathe_when_sleeping_so_he/,https://i.redd.it/ru9npjtfnwb31.jpg,i.redd.it,0,47,,image,False,False,False,
dawcul,My girlfriend and I introduced our cats recently ♥️♥️♥️,128068,0.96,1741,2019-09-29 20:40:01,aww,36719143,https://www.reddit.com/r/aww/comments/dawcul/my_girlfriend_and_i_introduced_our_cats_recently/,https://v.redd.it/cbuxltxxtjp31,v.redd.it,0,31,,video,False,False,False,
akigik,Finally found where he’s been disappearing to 🐶,128041,0.95,796,2019-01-28 07:13:10,aww,36719143,https://www.reddit.com/r/aww/comments/akigik/finally_found_where_hes_been_disappearing_to/,https://v.redd.it/hvge7yjfj2d21,v.redd.it,0,17,,video,False,False,False,
b0qyrv,You are never too old to be a kid,128041,0.92,619,2019-03-14 02:03:50,aww,36719143,https://www.reddit.com/r/aww/comments/b0qyrv/you_are_never_too_old_to_be_a_kid/,https://i.redd.it/rdykruwh5yl21.gif,i.redd.it,0,26,,image,False,,False,
k3u5j5,"Hello world, 15 minutes old",127760,0.96,842,2020-11-30 17:00:42,aww,36719143,https://www.reddit.com/r/aww/comments/k3u5j5/hello_world_15_minutes_old/,https://i.redd.it/gmlzbh625d261.jpg,i.redd.it,0,29,,image,False,False,False,
8utezc,Loves getting his haircut.,127603,0.94,1683,2018-06-29 19:40:07,aww,36719143,https://www.reddit.com/r/aww/comments/8utezc/loves_getting_his_haircut/,https://i.imgur.com/qPvlc91.gifv,i.imgur.com,0,66,,link,False,False,False,
8vlk3h,Power Up.,127450,0.9,1321,2018-07-03 01:06:44,aww,36719143,https://www.reddit.com/r/aww/comments/8vlk3h/power_up/,https://i.imgur.com/JOjEiQ6.gifv,i.imgur.com,0,31,,link,False,False,False,
808yeq,I take my dog to my store every day. One older Italian woman liked Bentley so much she came back and gave him a hat she knitted!,127368,0.95,879,2018-02-26 06:15:25,aww,36719143,https://www.reddit.com/r/aww/comments/808yeq/i_take_my_dog_to_my_store_every_day_one_older/,https://i.imgur.com/5v8u8GP.jpg,i.imgur.com,0,9,,link,False,False,False,
7qte3u,Give her back!!!,127331,0.96,1160,2018-01-16 21:51:16,aww,36719143,https://www.reddit.com/r/aww/comments/7qte3u/give_her_back/,https://i.redd.it/9py51x3jgga01.gif,i.redd.it,0,8,,image,False,False,False,
dqby7k,This dad did not want a puppy,127302,0.95,1603,2019-11-02 04:33:13,aww,36719143,https://www.reddit.com/r/aww/comments/dqby7k/this_dad_did_not_want_a_puppy/,https://v.redd.it/nurnsclgo5w31,v.redd.it,0,17,,video,False,False,False,
hfiday,Walked out of my house to find a deer licking my cat,127281,0.97,1256,2020-06-25 13:44:17,aww,36719143,https://www.reddit.com/r/aww/comments/hfiday/walked_out_of_my_house_to_find_a_deer_licking_my/,https://v.redd.it/h2wu7dcxl0751,v.redd.it,0,33,,video,False,False,False,
h8wetb,"After getting to know each other for the last few months throughout the lockdown in France and spending some time trying matching outfits for our future first dates, we finally were able to meet and are officially together now!",127237,0.87,2087,2020-06-14 21:31:29,aww,36719143,https://www.reddit.com/r/aww/comments/h8wetb/after_getting_to_know_each_other_for_the_last_few/,https://i.redd.it/5peslfg7fw451.jpg,i.redd.it,0,8,,image,False,False,False,
qii9cf,Someone bought this costume for their dog and let him loose,127215,0.89,1648,2021-10-29 23:14:49,aww,36719143,https://www.reddit.com/r/aww/comments/qii9cf/someone_bought_this_costume_for_their_dog_and_let/,https://v.redd.it/o2lzlcz7ffw71,v.redd.it,0,43,,video,False,False,False,
hgto6c,His human writes: This is Cariad. We bottle fed her from 2 hours old. She’s always pleased to see us...,127182,0.96,1326,2020-06-27 19:09:47,aww,36719143,https://www.reddit.com/r/aww/comments/hgto6c/his_human_writes_this_is_cariad_we_bottle_fed_her/,https://v.redd.it/41lz313nhg751,v.redd.it,0,24,,video,False,False,False,
a8rhh5,The boss said it's ok to bring your cat to work today.,127097,0.95,676,2018-12-23 09:06:35,aww,36719143,https://www.reddit.com/r/aww/comments/a8rhh5/the_boss_said_its_ok_to_bring_your_cat_to_work/,https://i.imgur.com/rRblvAl.gifv,i.imgur.com,0,26,,link,False,False,False,
l2a4js,"Doesn't matter how badass you are, sometimes ya just need your pooh bear",127051,0.93,874,2021-01-22 04:32:10,aww,36719143,https://www.reddit.com/r/aww/comments/l2a4js/doesnt_matter_how_badass_you_are_sometimes_ya/,https://i.redd.it/2r5llqutnrc61.jpg,i.redd.it,0,13,,image,False,False,False,
lg6o7u,He makes vet visit look easy,126958,0.95,1471,2021-02-09 21:42:04,aww,36719143,https://www.reddit.com/r/aww/comments/lg6o7u/he_makes_vet_visit_look_easy/,https://v.redd.it/pdpeaoq67hg61,v.redd.it,0,23,,video,False,False,False,
a970bo,Woke up to this gorgeous one above my front door.,126883,0.97,1279,2018-12-24 23:14:09,aww,36719143,https://www.reddit.com/r/aww/comments/a970bo/woke_up_to_this_gorgeous_one_above_my_front_door/,https://imgur.com/uUOwoQU,imgur.com,0,22,,image,False,False,False,
c1hnhy,"I like to put hats on my grandparents dog, and she likes to wear them",126703,0.97,926,2019-06-17 07:01:38,aww,36719143,https://www.reddit.com/r/aww/comments/c1hnhy/i_like_to_put_hats_on_my_grandparents_dog_and_she/,https://imgur.com/XvOZn5K,imgur.com,0,43,,image,False,False,False,
aotk7n,"""Time for bed kids!""",126692,0.94,838,2019-02-09 21:32:57,aww,36719143,https://www.reddit.com/r/aww/comments/aotk7n/time_for_bed_kids/,https://i.imgur.com/pQB1FXn.gifv,i.imgur.com,0,39,,link,False,False,False,
k9fz89,"Within 2 seconds of meeting the cat I was adopting, she climbed onto my shoulders.",126559,0.94,1466,2020-12-09 05:10:15,aww,36719143,https://www.reddit.com/r/aww/comments/k9fz89/within_2_seconds_of_meeting_the_cat_i_was/,https://v.redd.it/lnuvgglfu1461,v.redd.it,0,11,,video,False,False,False,
afwoqq,"Every day I point the camera at the couch when I leave for work, so I can capture their snuggles.",126515,0.96,1587,2019-01-14 20:41:07,aww,36719143,https://www.reddit.com/r/aww/comments/afwoqq/every_day_i_point_the_camera_at_the_couch_when_i/,https://v.redd.it/pog03tbtmea21,v.redd.it,0,26,,video,False,False,False,
a7husl,My Dad (79) went from “I don’t want that dang cat” to carrying her to “her room” for bed each night.,126312,0.93,1477,2018-12-19 07:27:42,aww,36719143,https://www.reddit.com/r/aww/comments/a7husl/my_dad_79_went_from_i_dont_want_that_dang_cat_to/,https://i.redd.it/mlda6fvs55521.jpg,i.redd.it,0,8,,image,False,False,False,
7d45lj,My roommate FaceTimes his little sister every week to help her with Algebra.,126283,0.91,2127,2017-11-15 19:12:18,aww,36719143,https://www.reddit.com/r/aww/comments/7d45lj/my_roommate_facetimes_his_little_sister_every/,https://i.redd.it/17dnad8s75yz.jpg,i.redd.it,0,5,,image,False,False,False,
n1a56r,This good girl found and brought home a kitten.,126212,0.96,2082,2021-04-29 23:29:00,aww,36719143,https://www.reddit.com/r/aww/comments/n1a56r/this_good_girl_found_and_brought_home_a_kitten/,https://gfycat.com/madeupsoupyant,gfycat.com,0,31,,link,False,False,False,
788hn0,We don’t deserve dogs,126195,0.92,1318,2017-10-23 21:01:06,aww,36719143,https://www.reddit.com/r/aww/comments/788hn0/we_dont_deserve_dogs/,https://i.redd.it/uwvjph19mltz.jpg,i.redd.it,0,8,,image,False,False,False,
v3ktii,[OC] My cat has emerged from my weighted blanket and doesn't know when or where she is.,126093,0.96,1041,2022-06-03 04:04:46,aww,36719143,https://www.reddit.com/r/aww/comments/v3ktii/oc_my_cat_has_emerged_from_my_weighted_blanket/,https://i.imgur.com/K75VvjU.jpg,i.imgur.com,0,13,,link,False,False,False,
ps11c3,This old boy thinks we adopted the new kitten just for him.,126007,0.95,1165,2021-09-21 00:14:59,aww,36719143,https://www.reddit.com/r/aww/comments/ps11c3/this_old_boy_thinks_we_adopted_the_new_kitten/,https://v.redd.it/1a06bi3bepo71,v.redd.it,0,16,,video,False,False,False,
al0ax5,"I’ve spent the last several months telling him NOT to lick the baby’s face, but it turns out that’s all she really wants.",126015,0.95,1533,2019-01-29 19:36:17,aww,36719143,https://www.reddit.com/r/aww/comments/al0ax5/ive_spent_the_last_several_months_telling_him_not/,https://v.redd.it/ykb06z5ccdd21,v.redd.it,0,15,,video,False,False,False,
b8d1vm,Best thing I’ve seen all day,125938,0.95,1200,2019-04-02 07:41:33,aww,36719143,https://www.reddit.com/r/aww/comments/b8d1vm/best_thing_ive_seen_all_day/,https://v.redd.it/xe62casxerp21,v.redd.it,0,102,,video,False,False,False,
azg2f6,Ever wondered how this subreddit is powered ?,125933,0.93,713,2019-03-10 19:49:29,aww,36719143,https://www.reddit.com/r/aww/comments/azg2f6/ever_wondered_how_this_subreddit_is_powered/,https://i.imgur.com/fEQfE3t.gifv,i.imgur.com,0,15,,link,False,False,False,
lwy8vz,"“Sure he’s cute, but can he do this??”",125830,0.96,753,2021-03-03 22:12:13,aww,36719143,https://www.reddit.com/r/aww/comments/lwy8vz/sure_hes_cute_but_can_he_do_this/,https://v.redd.it/0jx9167dduk61,v.redd.it,0,31,,video,False,False,False,
84nz9p,"My cat Pepe loved my roomie, and she recently moved out. I’m not crying, you’re crying...",125614,0.93,2291,2018-03-15 22:22:37,aww,36719143,https://www.reddit.com/r/aww/comments/84nz9p/my_cat_pepe_loved_my_roomie_and_she_recently/,https://i.redd.it/hfu8j7j4jyl01.jpg,i.redd.it,0,5,,image,False,False,False,
7fb0ww,I had to babysit my daughters kitten and she requested proof that he was okay so I sent her this,125612,0.91,1249,2017-11-25 04:19:50,aww,36719143,https://www.reddit.com/r/aww/comments/7fb0ww/i_had_to_babysit_my_daughters_kitten_and_she/,https://imgur.com/DOxAmKE,imgur.com,0,1,,image,False,False,False,
gz8gkt,This pupper absolutely adores the old man living next door and will constantly wait at the window to see if he's around,125550,0.96,733,2020-06-09 02:50:27,aww,36719143,https://www.reddit.com/r/aww/comments/gz8gkt/this_pupper_absolutely_adores_the_old_man_living/,https://gfycat.com/nauticalinfiniteamericansaddlebred,gfycat.com,0,11,,link,False,False,False,
c06pv6,Woman realizing the captain of her flight is her Granddaughter,125486,0.96,1865,2019-06-13 20:17:26,aww,36719143,https://www.reddit.com/r/aww/comments/c06pv6/woman_realizing_the_captain_of_her_flight_is_her/,https://i.imgur.com/Imox74B.gifv,i.imgur.com,0,18,,link,False,False,False,
k4bl7f,A camel greeting his herder who was absent for a few days.,125356,0.96,1423,2020-12-01 08:01:47,aww,36719143,https://www.reddit.com/r/aww/comments/k4bl7f/a_camel_greeting_his_herder_who_was_absent_for_a/,https://v.redd.it/sowe6latlh261,v.redd.it,0,35,,video,False,False,False,
78yhv9,"When you're shy, but you also have a crush on someone",125359,0.93,998,2017-10-27 02:21:05,aww,36719143,https://www.reddit.com/r/aww/comments/78yhv9/when_youre_shy_but_you_also_have_a_crush_on/,https://i.imgur.com/GnStjlN.gifv,i.imgur.com,0,8,,link,False,False,False,
c2purz,Dog's favorite view,125237,0.97,792,2019-06-20 07:16:37,aww,36719143,https://www.reddit.com/r/aww/comments/c2purz/dogs_favorite_view/,https://gfycat.com/joyouspeskycolt,gfycat.com,0,35,,link,False,False,False,
8cjiuv,My daughter does this every time she wakes up and sees me,124951,0.87,2009,2018-04-16 05:51:08,aww,36719143,https://www.reddit.com/r/aww/comments/8cjiuv/my_daughter_does_this_every_time_she_wakes_up_and/,https://v.redd.it/fyi7xa37z5s01,v.redd.it,0,15,,video,False,False,False,
ae1c7n,Moose looks like he belongs on a wanted poster,124800,0.93,1427,2019-01-09 06:35:13,aww,36719143,https://www.reddit.com/r/aww/comments/ae1c7n/moose_looks_like_he_belongs_on_a_wanted_poster/,https://i.redd.it/a95u2ykcra921.jpg,i.redd.it,0,24,,image,False,False,False,
hxm963,My little kitten is having the time of his life inside of this fishbowl,124737,0.96,830,2020-07-25 18:24:38,aww,36719143,https://www.reddit.com/r/aww/comments/hxm963/my_little_kitten_is_having_the_time_of_his_life/,https://v.redd.it/ef9ctmzs20d51,v.redd.it,0,33,,video,False,False,False,
iq66mt,Meet my co-worker,124706,0.96,1574,2020-09-10 21:32:23,aww,36719143,https://www.reddit.com/r/aww/comments/iq66mt/meet_my_coworker/,https://v.redd.it/xziyjttmfcm51,v.redd.it,0,15,,video,False,False,False,
h0r0q7,He’s given me 19 years of love,124662,0.95,849,2020-06-11 08:49:40,aww,36719143,https://www.reddit.com/r/aww/comments/h0r0q7/hes_given_me_19_years_of_love/,https://i.redd.it/y55z4c1o87451.jpg,i.redd.it,0,11,,image,False,False,False,
mzpmbd,Heartwarming ❤️,124566,0.94,1154,2021-04-27 19:55:25,aww,36719143,https://www.reddit.com/r/aww/comments/mzpmbd/heartwarming/,https://i.redd.it/t7fhci857qv61.jpg,i.redd.it,0,16,,image,False,False,False,
8rz6uk,I will not let go,124191,0.97,1671,2018-06-18 18:11:37,aww,36719143,https://www.reddit.com/r/aww/comments/8rz6uk/i_will_not_let_go/,https://v.redd.it/53ad3jtw8r411,v.redd.it,0,49,,video,False,False,False,
7j70nu,Licks vs. noms,124166,0.95,404,2017-12-12 06:43:40,aww,36719143,https://www.reddit.com/r/aww/comments/7j70nu/licks_vs_noms/,https://i.imgur.com/9y2mDXc.gifv,i.imgur.com,0,9,,link,False,False,False,
vrxuu1,Dog's adorable reaction on owner laying on her bed,124070,0.94,967,2022-07-05 18:57:14,aww,36719143,https://www.reddit.com/r/aww/comments/vrxuu1/dogs_adorable_reaction_on_owner_laying_on_her_bed/,https://v.redd.it/x6ufvgcd4r991,v.redd.it,0,18,,video,False,False,False,
i4simq,Hogwarts letter finally arrived,124070,0.92,1080,2020-08-06 19:42:46,aww,36719143,https://www.reddit.com/r/aww/comments/i4simq/hogwarts_letter_finally_arrived/,https://v.redd.it/p2m15wb64ef51,v.redd.it,0,47,,video,False,False,False,
jfof7u,We Had a Baby Llama Born This Morning! She's About Five Hours Old in This Video.,124060,0.96,1478,2020-10-22 05:09:10,aww,36719143,https://www.reddit.com/r/aww/comments/jfof7u/we_had_a_baby_llama_born_this_morning_shes_about/,https://v.redd.it/i6ji5zmeaju51,v.redd.it,0,33,,video,False,False,False,
ob147n,Framing our best picture,124053,0.97,620,2021-06-30 22:10:14,aww,36719143,https://www.reddit.com/r/aww/comments/ob147n/framing_our_best_picture/,https://i.redd.it/en28e0bjlf871.jpg,i.redd.it,0,22,,image,False,False,False,
hv7a8b,Every day this good boy brings a carrot to his best buddy,123979,0.97,782,2020-07-21 18:55:31,aww,36719143,https://www.reddit.com/r/aww/comments/hv7a8b/every_day_this_good_boy_brings_a_carrot_to_his/,https://i.imgur.com/prh3K6d.gifv,i.imgur.com,0,16,,link,False,False,False,
thtl3c,Young Ukrainian refugee boy reunited with his kitty that he had lost while waiting to cross the Polish-Ukrainian border,123950,0.91,1094,2022-03-19 17:21:07,aww,36719143,https://www.reddit.com/r/aww/comments/thtl3c/young_ukrainian_refugee_boy_reunited_with_his/,https://i.redd.it/p2yqyazewbo81.jpg,i.redd.it,0,18,,image,False,False,False,
8zcc8b,Adopting a Kitten,123888,0.95,1018,2018-07-16 21:58:54,aww,36719143,https://www.reddit.com/r/aww/comments/8zcc8b/adopting_a_kitten/,https://i.imgur.com/a2b9sWJ.gifv,i.imgur.com,0,23,,link,False,False,False,
9znyf2,Today is my 18th birthday everyone.,123819,0.93,1828,2018-11-23 18:11:03,aww,36719143,https://www.reddit.com/r/aww/comments/9znyf2/today_is_my_18th_birthday_everyone/,https://i.redd.it/9kbicinus2021.jpg,i.redd.it,0,5,,image,False,False,False,
hboak0,Im happy for him.,123774,0.87,1151,2020-06-19 03:46:56,aww,36719143,https://www.reddit.com/r/aww/comments/hboak0/im_happy_for_him/,https://i.redd.it/131mlmbytq551.jpg,i.redd.it,0,6,,image,False,False,False,
fxwszs,Winnie the Golden loves her mailman,123755,0.96,1373,2020-04-09 23:08:27,aww,36719143,https://www.reddit.com/r/aww/comments/fxwszs/winnie_the_golden_loves_her_mailman/,https://v.redd.it/ghuladpewtr41,v.redd.it,0,23,,video,False,False,False,
