id,title,score,upvote_ratio,num_comments,created_utc,subreddit,subscribers,permalink,url,domain,num_awards,num_crossposts,crosspost_subreddits,post_type,is_nsfw,is_bot,is_megathread,body
gtziph,"A‌‌n America‌‌n soldier‌‌, servin‌‌g i‌‌n Worl‌‌d Wa‌‌r I‌‌I ha‌‌d jus‌‌t returne‌‌d fro‌‌m severa‌‌l week‌‌s o‌‌f battl‌‌e o‌‌n th‌‌e Germa‌‌n fron‌‌t lines.",34164,0.9,1046,2020-05-31 19:34:00,Jokes,29634874,https://www.reddit.com/r/Jokes/comments/gtziph/an_american_soldier_serving_in_world_war_ii_had/,https://www.reddit.com/r/Jokes/comments/gtziph/an_american_soldier_serving_in_world_war_ii_had/,self.Jokes,0,1,,text,True,,False,"Th‌‌e soldie‌‌r ha‌‌d bee‌‌n grante‌‌d res‌‌t an‌‌d relaxatio‌‌n an‌‌d wa‌‌s o‌‌n ‌‌a trai‌‌n tha‌‌t wa‌‌s boun‌‌d fo‌‌r London.

Th‌‌e trai‌‌n wa‌‌s ver‌‌y crowded‌‌, s‌‌o th‌‌e soldie‌‌r walke‌‌d th‌‌e lengt‌‌h o‌‌f th‌‌e trai‌‌n i‌‌n hope‌‌s o‌‌f findin‌‌g a‌‌n empt‌‌y seat.

Th‌‌e onl‌‌y empt‌‌y sea‌‌t wa‌‌s directl‌‌y adjacen‌‌t t‌‌o ‌‌a wel‌‌l dresse‌‌d middl‌‌e age‌‌d Englis‌‌h lad‌‌y an‌‌d wa‌‌s bein‌‌g use‌‌d b‌‌y he‌‌r littl‌‌e dog.

Th‌‌e wear‌‌y soldie‌‌r asked‌‌, ""Pleas‌‌e ma'am‌‌, ma‌‌y ‌‌I si‌‌t i‌‌n tha‌‌t seat?""

Th‌‌e Englis‌‌h woma‌‌n looke‌‌d dow‌‌n he‌‌r nos‌‌e a‌‌t th‌‌e solide‌‌r an‌‌d sniffe‌‌d the‌‌n said‌‌, ""Yo‌‌u Americans‌‌. Yo‌‌u ar‌‌e suc‌‌h ‌‌a rud‌‌e clas‌‌s o‌‌f people‌‌. Can'‌‌t yo‌‌u se‌‌e tha‌‌t m‌‌y littl‌‌e pooc‌‌h i‌‌s usin‌‌g tha‌‌t seat?""

Th‌‌e soldie‌‌r walke‌‌d away‌‌, lookin‌‌g i‌‌f ther‌‌e wer‌‌e an‌‌y othe‌‌r unoccupie‌‌d seat‌‌s t‌‌o use‌‌, bu‌‌t afte‌‌r anothe‌‌r tri‌‌p dow‌‌n t‌‌o th‌‌e en‌‌d o‌‌f th‌‌e train‌‌, h‌‌e foun‌‌d himsel‌‌f facin‌‌g th‌‌e woma‌‌n wit‌‌h th‌‌e do‌‌g again.

Again‌‌, th‌‌e soldie‌‌r asked‌‌, ""Pleas‌‌e lady‌‌. Ma‌‌y ‌‌I si‌‌t there‌‌? I'‌‌m ver‌‌y tired.""

Th‌‌e Englis‌‌h woma‌‌n wrinkle‌‌d he‌‌r nos‌‌e an‌‌d snorte‌‌d ou‌‌t loud‌‌, ""Yo‌‌u Americans‌‌! No‌‌t onl‌‌y ar‌‌e yo‌‌u rude‌‌, yo‌‌u ar‌‌e als‌‌o extremel‌‌y arrogant!""

Th‌‌e soldie‌‌r didn'‌‌t sa‌‌y anythin‌‌g else‌‌; h‌‌e leane‌‌d over‌‌, picke‌‌d u‌‌p th‌‌e littl‌‌e do‌‌g an‌‌d tosse‌‌d i‌‌t ou‌‌t th‌‌e windo‌‌w o‌‌f th‌‌e trai‌‌n an‌‌d sa‌‌t dow‌‌n i‌‌n th‌‌e empt‌‌y seat.

Th‌‌e Woman‌‌, a‌‌t ‌‌a los‌‌s fo‌‌r words‌‌; shrieked‌‌, raile‌‌d an‌‌d demande‌‌d tha‌‌t someon‌‌e defen‌‌d he‌‌r an‌‌d chastis‌‌e th‌‌e soldier.

A‌‌n Englis‌‌h gentleme‌‌n sittin‌‌g acros‌‌s th‌‌e aisl‌‌e spok‌‌e u‌‌p an‌‌d said‌‌, ""Yo‌‌u know‌‌, sir‌‌, yo‌‌u American‌‌s d‌‌o see‌‌m t‌‌o hav‌‌e ‌‌a penchan‌‌t fo‌‌r doin‌‌g th‌‌e wron‌‌g thing‌‌. Yo‌‌u ea‌‌t holdin‌‌g th‌‌e for‌‌k i‌‌n th‌‌e wron‌‌g hand‌‌, yo‌‌u driv‌‌e you‌‌r auto‌‌s o‌‌n th‌‌e wron‌‌g sid‌‌e o‌‌f th‌‌e roa‌‌d an‌‌d now‌‌, sir‌‌, you'v‌‌e throw‌‌n th‌‌e wron‌‌g bitc‌‌h ou‌‌t th‌‌e window!."""
9dgti7,"A man who just died is delivered to the mortuary wearing an expensive, expertly tailored black suit...",34168,0.92,586,2018-09-06 15:10:27,Jokes,29634874,https://www.reddit.com/r/Jokes/comments/9dgti7/a_man_who_just_died_is_delivered_to_the_mortuary/,https://www.reddit.com/r/Jokes/comments/9dgti7/a_man_who_just_died_is_delivered_to_the_mortuary/,self.Jokes,0,2,,text,False,,False,"
.... The mortician asks the deceased's wife how she would like the body dressed. He points out that the man does look good in the black suit he is already wearing.
The widow, however, says that she always thought her husband looked his best in blue, and that she wants him in a blue suit. 
She gives the mortician a blank check and says, ""I don't care what it costs, but please have my husband in a blue suit for the viewing.""
The woman returns the next day for the wake. To her delight, she finds her husband dressed in a gorgeous blue suit with a subtle chalk stripe; the suit fits him perfectly.
She says to the mortician, ""Whatever this cost, I'm very satisfied. You did an excellent job and I'm very grateful. How much did you spend?""
To her astonishment, the mortician presents her with the blank check.
""There's no charge,"" he says.
""No, really, I must compensate you for the cost of that exquisite blue suit!"" she says.
""Honestly, ma'am,"" the mortician says, ""it cost nothing. You see, a deceased gentleman of about your husband's size was brought in shortly after you left yesterday, and he was wearing an attractive blue suit. I asked his wife if she minded him going to his grave wearing a black suit instead, and she said it made no difference as long as he looked nice.
""Then it was just a matter of switching the heads"""
7tc8vw,"A man is walking through a graveyard when he sees another man squatting next to a grave. ""Morning!"" he calls out.",34119,0.85,399,2018-01-27 17:06:56,Jokes,29634874,https://www.reddit.com/r/Jokes/comments/7tc8vw/a_man_is_walking_through_a_graveyard_when_he_sees/,https://www.reddit.com/r/Jokes/comments/7tc8vw/a_man_is_walking_through_a_graveyard_when_he_sees/,self.Jokes,0,0,,text,False,False,False,"""No, just having a shit!"""
91nmyb,The only thing Flat-Earthers fear,34102,0.84,555,2018-07-25 07:25:50,Jokes,29634874,https://www.reddit.com/r/Jokes/comments/91nmyb/the_only_thing_flatearthers_fear/,https://www.reddit.com/r/Jokes/comments/91nmyb/the_only_thing_flatearthers_fear/,self.Jokes,0,3,,text,False,False,False,Is sphere itself. 
gq6qzd,An engineer dies and goes to hell.,34093,0.87,548,2020-05-25 13:12:25,Jokes,29634874,https://www.reddit.com/r/Jokes/comments/gq6qzd/an_engineer_dies_and_goes_to_hell/,https://www.reddit.com/r/Jokes/comments/gq6qzd/an_engineer_dies_and_goes_to_hell/,self.Jokes,0,4,,text,False,False,False,"He's hot and miserable, so he decides to take action. The A/C has been busted for a long time, so he fixes it. Things cool down quickly. The moving walkway motor is jammed, so he unjams it. People can get from place to place more easily. The TV was grainy and unclear, so he fixes the connection to the satellite dish, and now they get hundreds of high def channels.

One day, God decides to look down on Hell to see how his grand design is working out and notices that everyone is happy and enjoying umbrella drinks. He asks the Devil what's up? The Devil says, ""Things are great down here since you sent us an engineer."" ""What?"" says God. ""An engineer? I didn't send you one of those. That must have been a mistake. Send him upstairs immediately."" The Devil responds, ""No way. We want to keep our engineer. We like him."" God demands, ""If you don't send him to me immediately, I'll sue!"" The Devil laughs. ""Where are you going to get a lawyer?"""
8977ym,How many introverts does it take to change a lightbulb?,34076,0.88,442,2018-04-03 06:59:43,Jokes,29634874,https://www.reddit.com/r/Jokes/comments/8977ym/how_many_introverts_does_it_take_to_change_a/,https://www.reddit.com/r/Jokes/comments/8977ym/how_many_introverts_does_it_take_to_change_a/,self.Jokes,0,2,,text,False,False,False,Why does it have to be a group activity?
ihzbr0,My girlfriend is mad because I could only last 2 minutes in bed,34034,0.91,456,2020-08-28 08:31:13,Jokes,29634874,https://www.reddit.com/r/Jokes/comments/ihzbr0/my_girlfriend_is_mad_because_i_could_only_last_2/,https://www.reddit.com/r/Jokes/comments/ihzbr0/my_girlfriend_is_mad_because_i_could_only_last_2/,self.Jokes,0,0,,text,False,False,False,In my defense it was doggy style so it's more like 14 minutes.
82j2du,Man wakes up in a slum with no memory of how he got there.,34020,0.81,1097,2018-03-07 03:38:10,Jokes,29634874,https://www.reddit.com/r/Jokes/comments/82j2du/man_wakes_up_in_a_slum_with_no_memory_of_how_he/,https://www.reddit.com/r/Jokes/comments/82j2du/man_wakes_up_in_a_slum_with_no_memory_of_how_he/,self.Jokes,0,5,,text,False,False,False,"He wanders around aimlessly before he finds even one person who will talk to him. Some ratty beggar on the street turns out to be nice enough to explain where he is.

""You're in the afterlife!"" he tells the man, ""But you must have been a real shithead when you were alive, because this is the fourth ring, and only the worst people come here.""

All of a sudden, a siren goes off, one of those air-raid things. The man is terrified but the beggar gets up calmly and leads him to a big, dilapidated warehouse where thousands of other similarly unkempt souls are gathering. When the man asks why they're all here, the beggar points to a line of folding tables against the wall. Each table has some moldy bread, cups of dingy water, and some bowls of broth so thin they could have just run out of cups. Only then does the man realize how hungry he is. A guard in heavy body armor blows a whistle and all the people arrange themselves into three lines.

The beggar is helpful enough to explain them for the man. ""That one's the bread line, that's the broth line, and that's the water line. All the food here is free, but if you want to get out of this maggot hole, you've got to work, because the gate guards into the third ring ask five hundred dollars to get through. I've heard the food is better there.""

So the man gets his food. It's abominable, and right then and there, he vows to make five hundred dollars and get into the third ring. Unfortunately for him, very few people need work in the afterlife, especially when all of them are saving up to emigrate. Even still, after ten years of hard work, eating the moldy bread and indistinguishable soup and water, he finally saves up enough money. The guards let him through and he finds himself in the third ring. It's nothing too fancy, if anything, it's a bit below average for a real city, but to his eyes it is paradise. All the guards look much friendlier, and the houses and buildings, while not spacious or lavish, are at least up to code. And to his surprise, he runs right into a familiar former beggar as he crosses the street.

""What are the odds?"" they both ask and they get to conversing. The beggar, it turns out, only managed to make it in himself a few months back. Their conversation is interrupted, however, by what sounds like a school bell. When the man seems confused, the beggar leads him to what looks like a giant gymnasium. Here, people are gathering once again, and the man begins to understand. On a line of folding tables against one wall are stacks of hot dogs, big bowls of salad, and solo cups full of fresh lemonade. A cop shouts for everyone's attention and directs them all to stand in three lines. The beggar smiles at the man's wonder and points to each line in turn. ""That's the hot dog line, that's the salad line, and that's the lemonade line."" The man gets in each line in turn and gets himself his lunch.

While he's eating, basking in joy at not being stuck with old bread and water, the beggar encourages him, ""The best part is, halfway through the year, they switch from hot dogs, salad, and lemonade to chicken, chili, and hot chocolate. You can never get tired of it!""

Sadly, this proved not to be true. After only a few days, the man did again get tired of the same meal every day. But he knew firsthand that he could change his lot, so one day he went up to the wall of the second circle. This time the guards were asking for ten thousand dollars. Well, the man didn't like it, but he figured he had his whole afterlife ahead of him now that he was out of the fourth circle, and he could certainly take some time to save up. After ten years of hard work, it wasn't too difficult for him to keep up the work ethic, and only twenty years later, he went back to the guards of the second ring with the money in hand. He went through the gate and found himself in a glittering, clean city full of glass and steel.

And wouldn't you know it, but there, standing across the street was the same beggar, only now he was wearing a well-fitted suit. The man greeted the beggar as an old friend and they started talking again. Once again, their conversation was interrupted, only this time it was by beautiful church bells. ""Come,"" the beggar told him, ""I'll take you to the evening meal."" So the man followed and they entered a glamorous ballroom filled with beautiful attendees. Even the cops here looked good, dressed in suits and sunglasses like bodyguards. And sure enough, piled onto platters on huge mahogany tables against the far wall were plates of steak, bowls of the most delicious seafood soups, and glasses of champagne. One of the bodyguards cleared his throat loudly and politely requested that the attendees line up. Three lines were formed and the beggar pointed each line out in turn. ""That's the steak line, that's the soup line, and that's the champagne line,"" and then he added, ""and apparently here, they change the meals FOUR times a year!""

The man rejoiced, ate, and was happy, and for once felt that nothing was lacking. Four changes a year was enough for him. But one day, out of curiosity, he went up to the bodyguards that guarded the gate into the first and final ring of the afterlife and found they were asking for a million dollars to pass. Well the man was a bit disturbed by this, after all, the second ring seemed perfect to him. ""What is it,"" he thought, ""that could possibly be more wonderful than what I have here?"" That question haunted him for weeks until he came to a conclusion. He was used to working hard and he had all of eternity to save up, so he wanted, just once to see what he could possibly be missing in the first ring.

Fifty years later, he returned to the guards with a million dollars. When he stepped into the first ring he fell to his knees. The architecture was glorious and inhuman, and the bodyguard had turned into shining angels. To his surprise, someone helped him up off the street and when he looked, he realized he recognized who it was--it was the beggar he met in the fourth ring, adorned in a golden robe and glowing, and when he looked down at himself he realized he looked much the same.

The beggar laughed jovially. ""I got here only three years ago myself, but somehow I knew you would be right here behind me. I've come back to this gate every day waiting for you to make it in!"" Suddenly, the air was filled with the sound of angelic choirs and the beggar led the man off to a gigantic palace made of crystal and cloud. The room was filled with radiant citizens of the first circle and angels prepared everything. Sure enough, there was a line of massive altars against one wall, spilling over with glistening golden dragon meat, a pudding refined from clouds and dew and silk, and an ice cold tub of ambrosia and nectar ladled out individually into blindingly beautiful crystalline chalices. An angel fluttered from the ceiling and bowed silently to the assembled mass, who bowed respectfully back and then broke themselves into their lines on their own.

Smiling at the tradition, the beggar pointed to the first line. ""That's the line for the dragon meat,"" he said before turning to the next line, ""and that's the line for angeldust stew,"" then he paused, confused.

""What is it?"" the man asked his old friend.

The beggar replied, ""There appears to be no punchline.""
"
f90hi5,Weinstein didn’t kill himself,34028,0.9,597,2020-02-25 05:03:49,Jokes,29634874,https://www.reddit.com/r/Jokes/comments/f90hi5/weinstein_didnt_kill_himself/,https://www.reddit.com/r/Jokes/comments/f90hi5/weinstein_didnt_kill_himself/,self.Jokes,0,1,,text,False,False,False,Sorry just practicing
cbt8ec,"Got home to find my wife had left a note on the fridge that said ""This isn't working I'm going to my mum's""",34006,0.89,515,2019-07-11 13:58:38,Jokes,29634874,https://www.reddit.com/r/Jokes/comments/cbt8ec/got_home_to_find_my_wife_had_left_a_note_on_the/,https://www.reddit.com/r/Jokes/comments/cbt8ec/got_home_to_find_my_wife_had_left_a_note_on_the/,self.Jokes,0,3,,text,False,False,False,"
I opened up the fridge. The light was on and the beer was cold. I'm not sure what she was talking about."
99cwo9,Jared from Subway ended his career the same way he began it,33999,0.81,797,2018-08-22 17:59:21,Jokes,29634874,https://www.reddit.com/r/Jokes/comments/99cwo9/jared_from_subway_ended_his_career_the_same_way/,https://www.reddit.com/r/Jokes/comments/99cwo9/jared_from_subway_ended_his_career_the_same_way/,self.Jokes,0,0,,text,True,False,False,Trying to get into smaller pants
c96dn8,"A teacher goes for a long walk on the beach. She finds a shiny magic lamb, picks it up, and rubs it.",33991,0.87,654,2019-07-05 00:35:51,Jokes,29634874,https://www.reddit.com/r/Jokes/comments/c96dn8/a_teacher_goes_for_a_long_walk_on_the_beach_she/,https://www.reddit.com/r/Jokes/comments/c96dn8/a_teacher_goes_for_a_long_walk_on_the_beach_she/,self.Jokes,0,3,,text,False,,False,"There is a puff of blue smoke and a genie pops out. “You have three wishes. I can give you anything in the world. If I fail, I must become your personal genie for eternity.”

The teacher thinks for a moment and says, “For my first wish, I want jewels. Silver, gold, platinum, whatever you have.”  Poof! The jewels appear. 

“For my second wish, I want karma. Lots of karma.” Poof! The karma appears. 

The genie stares at the teacher, waiting for the third wish. “I can give you anything in the world,” he says again. 

The teacher thinks for a long time. “As a teacher, I always hated careless mistakes from my students. I noticed that I accidentally wrote ‘lamb’ instead of ‘lamp.’ Please correct my mistake.”

The genie moaned in anguish. “This is Reddit,” he shouted. Once you post it, you can’t edit the title.

“In that case,” the teacher smiled, “It looks like I’ve got myself a genie for eternity.”"
7ja39l,My therapist told me that a great way to let go of your anger is to write letters to people you hate and then burn them...,33990,0.88,564,2017-12-12 16:44:38,Jokes,29634874,https://www.reddit.com/r/Jokes/comments/7ja39l/my_therapist_told_me_that_a_great_way_to_let_go/,https://www.reddit.com/r/Jokes/comments/7ja39l/my_therapist_told_me_that_a_great_way_to_let_go/,self.Jokes,0,0,,text,False,False,False,"
I did that and I feel much better but I'm wondering...do I keep the letters?"
732y6u,eBay is so useless,33971,0.83,408,2017-09-29 02:12:40,Jokes,29634874,https://www.reddit.com/r/Jokes/comments/732y6u/ebay_is_so_useless/,https://www.reddit.com/r/Jokes/comments/732y6u/ebay_is_so_useless/,self.Jokes,0,0,,text,False,False,False,"I tried to look up lighters and all they had was 18,061 matches"
jvg4r3,"If someone calls you Fat, just ignore them.",33966,0.93,304,2020-11-17 03:26:01,Jokes,29634874,https://www.reddit.com/r/Jokes/comments/jvg4r3/if_someone_calls_you_fat_just_ignore_them/,https://www.reddit.com/r/Jokes/comments/jvg4r3/if_someone_calls_you_fat_just_ignore_them/,self.Jokes,0,0,,text,False,False,False,You are bigger than that!
oxqeyy,"A man’s walking home late at night when he sees a woman in the shadows. “Twenty bucks,” she says. He’s never been with a prostitute before, but he decides what the hell.",33954,0.91,678,2021-08-04 16:40:39,Jokes,29634874,https://www.reddit.com/r/Jokes/comments/oxqeyy/a_mans_walking_home_late_at_night_when_he_sees_a/,https://www.reddit.com/r/Jokes/comments/oxqeyy/a_mans_walking_home_late_at_night_when_he_sees_a/,self.Jokes,0,1,,text,True,,False,"
They are going at it for a minute when all of a sudden a light flashes on them—it’s a policeman.

“What’s going on here?” asks the officer.

“I’m making love to my wife,” the man answers indignantly.

“Oh, I’m sorry,” says the cop, “I didn’t know.”

“Well,” said the man, “to tell the truth neither did I until you flashed that lighton her face.”"
g1dxse,Why are circumsized penises so popular among Jewish girls?,33936,0.77,920,2020-04-15 02:39:15,Jokes,29634874,https://www.reddit.com/r/Jokes/comments/g1dxse/why_are_circumsized_penises_so_popular_among/,https://www.reddit.com/r/Jokes/comments/g1dxse/why_are_circumsized_penises_so_popular_among/,self.Jokes,0,0,,text,False,False,False,"They love anything that's 15% off

Just a joke lol"
9pbugr,Why haven't Aliens visited our Solar System yet? ...,33917,0.85,498,2018-10-18 23:52:10,Jokes,29634874,https://www.reddit.com/r/Jokes/comments/9pbugr/why_havent_aliens_visited_our_solar_system_yet/,https://www.reddit.com/r/Jokes/comments/9pbugr/why_havent_aliens_visited_our_solar_system_yet/,self.Jokes,0,2,,text,False,False,False,"They looked at the reviews...
Only 1 star."
dz4wcr,"A Jewish man decides his son isn't religious enough, so pays for him to go visit Israel.",33890,0.92,561,2019-11-20 22:35:17,Jokes,29634874,https://www.reddit.com/r/Jokes/comments/dz4wcr/a_jewish_man_decides_his_son_isnt_religious/,https://www.reddit.com/r/Jokes/comments/dz4wcr/a_jewish_man_decides_his_son_isnt_religious/,self.Jokes,0,10,,text,False,False,False,"When the son comes back, however, he says he's a Christian now.

The father goes to his friend exasperated to explain the situation, and his friend says ""that's funny, I sent my son to Israel last year, and when he came back he also said he was Christian.""

The two men decide they should speak to their rabbi about this, but when they explain the situation, the rabbi says ""that's funny, two years ago I sent my son to Israel, and he also came back a Christian.""

The three men decide only God can have the answer, so they pray. The rabbi says aloud ""dear God, all three of us sent our sons to Israel, and all of them came back Christian.""

God's voice booms down ""that's funny…"""
a3d5l7,"When I was 5 years old, I got a coal from Santa...",33888,0.93,274,2018-12-05 20:44:32,Jokes,29634874,https://www.reddit.com/r/Jokes/comments/a3d5l7/when_i_was_5_years_old_i_got_a_coal_from_santa/,https://www.reddit.com/r/Jokes/comments/a3d5l7/when_i_was_5_years_old_i_got_a_coal_from_santa/,self.Jokes,0,0,,text,False,False,False,"The next year I decided to make him pay for it and poisoned his cookies. Somehow, the bastard found out and killed my dad"
bi8e6h,If I had a dollar for everytime someone over 40 told me my generation sucks....,33877,0.77,1792,2019-04-28 11:51:48,Jokes,29634874,https://www.reddit.com/r/Jokes/comments/bi8e6h/if_i_had_a_dollar_for_everytime_someone_over_40/,https://www.reddit.com/r/Jokes/comments/bi8e6h/if_i_had_a_dollar_for_everytime_someone_over_40/,self.Jokes,0,4,,text,False,False,False,Then I could afford a house in the economy they ruined.
nbgi1r,What did the Reddit user say after setting off a bomb in a bank?,33875,0.84,361,2021-05-13 18:51:32,Jokes,29634874,https://www.reddit.com/r/Jokes/comments/nbgi1r/what_did_the_reddit_user_say_after_setting_off_a/,https://www.reddit.com/r/Jokes/comments/nbgi1r/what_did_the_reddit_user_say_after_setting_off_a/,self.Jokes,0,0,,text,False,False,False,Edit: Wow this blew up! Thanks for the gold!
lg95fb,"While in China, an American man is sexually promiscuous and does not use a condom the entire time he is there.",33860,0.83,673,2021-02-09 23:29:16,Jokes,29634874,https://www.reddit.com/r/Jokes/comments/lg95fb/while_in_china_an_american_man_is_sexually/,https://www.reddit.com/r/Jokes/comments/lg95fb/while_in_china_an_american_man_is_sexually/,self.Jokes,0,4,,text,True,False,False,"A week after arriving back home in the States, he wakes one morning to find his penis covered with bright green and purple spots. Horrified, he immediately goes to see a doctor.

The doctor, never having seen anything like this before, orders some tests and tells the man to return in two days for the results. After two days, the doctor tells him, “I’ve got bad news for you, you have contracted Mongolian VD. It’s very rare and almost unheard of here in the US. We know very little about it.""

The man perplexed asks, ""Well, can’t you give me a shot or something to fix me up, Doc?""

The doctor answers, ""I’m sorry, there's no known cure. We are going to have to amputate your penis.""

The man screams in horror,  ""Absolutely not !! I want a second opinion... !!!""

The doctor replies, ""Well, it’s your choice. Go ahead, if you want, but surgery is your only option.”

The next day, the man seeks out a Chinese doctor, figuring that he’ll know more about the disease. The Chinese doctor examines his penis and proclaims, ""Ahh... yes, Mongolian VD. Very rare disease.""

The guy says to the doctor, ""Yeah, yeah, I already know that, but what can we do? My American doctor wants to cut off my penis!""

The Chinese doctor shakes his head and laughs, ""Stupid Amelican docttah, always want operate, make more money that way. No need amputate!""

""Oh, thank God!” the man exclaims.

""Yes,” says the Chinese doctor. ""Wait two weeks. Fall off by itself."""
