id,title,score,upvote_ratio,num_comments,created_utc,subreddit,subscribers,permalink,url,domain,num_awards,num_crossposts,crosspost_subreddits,post_type,is_nsfw,is_bot,is_megathread,body
at85s3,If I had a nickel for every time I didn’t know what was going on...,37815,0.89,415,2019-02-22 02:11:41,Jokes,29634874,https://www.reddit.com/r/Jokes/comments/at85s3/if_i_had_a_nickel_for_every_time_i_didnt_know/,https://www.reddit.com/r/Jokes/comments/at85s3/if_i_had_a_nickel_for_every_time_i_didnt_know/,self.Jokes,0,3,,text,False,False,False,...I’d be like “why do I keep getting all these fucking nickels?”
wpux9v,A burglar breaks into a home and holds the husband and wife in it hostage.,37799,0.94,465,2022-08-16 19:23:01,Jokes,29634874,https://www.reddit.com/r/Jokes/comments/wpux9v/a_burglar_breaks_into_a_home_and_holds_the/,https://www.reddit.com/r/Jokes/comments/wpux9v/a_burglar_breaks_into_a_home_and_holds_the/,self.Jokes,0,2,,text,False,False,False,"(Disclaimer: I believe this is OC because I heard it in Cantonese and I've translated it, so also, apologies for bad English)

A burglar breaks into a home and holds the husband and wife in it hostage. At gunpoint, he forces the two to sit on chairs facing the opposite way, back to each other, and ties them to the chairs. The burglar slowly and methodically begins stealing from the house.

When the burglar has taken everything of value, he gets ready to leave, the homeowners still bound to their chairs, when suddenly, the man yells at the burglar, 

""Please untie her, please, let her go!""

The thief responds with,

""No, I'm not untying either of you so that the authorities get notified as late as possible. Don't worry, your neighbours will soon wonder why your lights are still on throughout the night and check in on you long before you succumb to dehydration""

The man yet again pleads,

""Please, just untie her, I'll do anything!""

The burglar once again explains his reasoning,

""I need to get away with this crime, I'm sorry, I can't leave anything up to chance.""

The man shuffles his chair towards the burglar, in a state of mania, exclaims,

""I'm begging you man, just let her go, she won't call the cops, I promise!""

The burglar, still unwilling to budge, did find it quite touching how much his hostage cared about his wife.

""Wow,"" he said ""You must really love your wife to beg me to untie her so desperately""

""No,"" The man replied, in a state of frenzy ""My wife will be home in 15 minutes"""
7cre42,"If I had a dollar for every downvote EA""s comment gets....",37800,0.86,1347,2017-11-14 05:11:24,Jokes,29634874,https://www.reddit.com/r/Jokes/comments/7cre42/if_i_had_a_dollar_for_every_downvote_eas_comment/,https://www.reddit.com/r/Jokes/comments/7cre42/if_i_had_a_dollar_for_every_downvote_eas_comment/,self.Jokes,0,0,,text,False,False,False,I would have enough money to unlock half of the Battlefront 2 heroes without having to grind them.
j01ord,"My girlfriend borrowed $100 from me. After 3years, when we separated, she returned exactly $100.",37793,0.92,266,2020-09-26 12:59:03,Jokes,29634874,https://www.reddit.com/r/Jokes/comments/j01ord/my_girlfriend_borrowed_100_from_me_after_3years/,https://www.reddit.com/r/Jokes/comments/j01ord/my_girlfriend_borrowed_100_from_me_after_3years/,self.Jokes,0,1,,text,False,False,False,I lost Interest in that relationship.
98ke4u,"Astronaut 1: ""I can't find any milk for my coffee""",37769,0.78,877,2018-08-19 19:26:10,Jokes,29634874,https://www.reddit.com/r/Jokes/comments/98ke4u/astronaut_1_i_cant_find_any_milk_for_my_coffee/,https://www.reddit.com/r/Jokes/comments/98ke4u/astronaut_1_i_cant_find_any_milk_for_my_coffee/,self.Jokes,0,3,,text,False,False,False,"Astronaut 2:  ""In space no-one can. Here, use cream"""
hwz1r7,"At the parole hearing, the officer asked, ""Tell me, why should you be released early?"" The inmate responded, ""It’s bec...""",37758,0.92,493,2020-07-24 15:27:06,Jokes,29634874,https://www.reddit.com/r/Jokes/comments/hwz1r7/at_the_parole_hearing_the_officer_asked_tell_me/,https://www.reddit.com/r/Jokes/comments/hwz1r7/at_the_parole_hearing_the_officer_asked_tell_me/,self.Jokes,0,2,,text,False,False,False,"

Officer: Yes?

Inmate: I think I have..

Officer: Go on.

Inmate: Can I Please finish my sentence?

Officer: Sure. Parole denied."
hgiv8l,"A man walks into a library and says to the librarian, ""Do you have that book for men with small penises?""",37747,0.92,342,2020-06-27 05:15:21,Jokes,29634874,https://www.reddit.com/r/Jokes/comments/hgiv8l/a_man_walks_into_a_library_and_says_to_the/,https://www.reddit.com/r/Jokes/comments/hgiv8l/a_man_walks_into_a_library_and_says_to_the/,self.Jokes,0,1,,text,True,False,False,"The librarian looks on her computer and says, ""I don’t know if it's in yet.""

""Yeah, that's the one!"""
b2cgw8,New Teslas don't come with a new car smell,37743,0.88,344,2019-03-18 06:33:42,Jokes,29634874,https://www.reddit.com/r/Jokes/comments/b2cgw8/new_teslas_dont_come_with_a_new_car_smell/,https://www.reddit.com/r/Jokes/comments/b2cgw8/new_teslas_dont_come_with_a_new_car_smell/,self.Jokes,0,4,,text,False,False,False,They come with an Elon Musk.
gymv7m,"To the hacker who hacked into my reddit account, I will find you.",37723,0.85,443,2020-06-08 04:35:35,Jokes,29634874,https://www.reddit.com/r/Jokes/comments/gymv7m/to_the_hacker_who_hacked_into_my_reddit_account_i/,https://www.reddit.com/r/Jokes/comments/gymv7m/to_the_hacker_who_hacked_into_my_reddit_account_i/,self.Jokes,0,0,,text,False,False,False,"(Edit: no, you won’t)"
ed6wf0,I like my coffee how I like my slaves...,37616,0.86,881,2019-12-20 13:00:34,Jokes,29634874,https://www.reddit.com/r/Jokes/comments/ed6wf0/i_like_my_coffee_how_i_like_my_slaves/,https://www.reddit.com/r/Jokes/comments/ed6wf0/i_like_my_coffee_how_i_like_my_slaves/,self.Jokes,0,5,,text,False,False,False,Free
6b54r3,The best years of my life were spent in the arms of another man's wife...,37615,0.88,2283,2017-05-14 23:08:30,Jokes,29634874,https://www.reddit.com/r/Jokes/comments/6b54r3/the_best_years_of_my_life_were_spent_in_the_arms/,https://www.reddit.com/r/Jokes/comments/6b54r3/the_best_years_of_my_life_were_spent_in_the_arms/,self.Jokes,0,0,,text,False,,False,"Thank you, Mom. Happy Mother's Day!

Edit: At least $136 worth of Reddit Gold in this thread. You never cease to amaze me, Reddit."
an1ibo,"“I can’t believe that you’ve been visiting prostitutes for sex,” my wife screamed at me. “I’m really disappointed.”",37605,0.88,695,2019-02-04 18:39:20,Jokes,29634874,https://www.reddit.com/r/Jokes/comments/an1ibo/i_cant_believe_that_youve_been_visiting/,https://www.reddit.com/r/Jokes/comments/an1ibo/i_cant_believe_that_youve_been_visiting/,self.Jokes,0,1,,text,True,False,False,"“You can hardly blame me,” I answered. “It’s not like I was getting any from you.”


“Well, that’s your own fault,” she replied. “You never told me you were willing to pay for it.”"
b097f4,Cheating Wives,37587,0.87,450,2019-03-12 21:11:09,Jokes,29634874,https://www.reddit.com/r/Jokes/comments/b097f4/cheating_wives/,https://www.reddit.com/r/Jokes/comments/b097f4/cheating_wives/,self.Jokes,0,9,,text,False,False,False,"A guy thought his wife was cheating on him. He waited for her to leave that night and jumped in a cab to follow her. By following her, he found out she was working in a whore house.


The guy says to the cabbie, ""Wanna make a $100?""


The cabbie says, ""Sure, what do I have to do?""


The guy replies that all the cabbie has to do is go inside the whore house, grab his wife, put her in the back of the cab, and take them home.


The cabbie goes in. A couple of minutes later, the whore house door gets kicked open, and the cabbie starts dragging out this woman who is kicking, biting, punching, and fighting all the way to the cab.


The cabbie opens the door to the cab, throws the girl inside, and tells the man, ""Here! Hold her!""


The man looks down at the girl and yells to the cabbie, ""THIS AIN'T MY WIFE!""


The cabbie replied, ""I KNOW. IT'S MINE... I'M GOING BACK IN FOR YOURS!""

"
g7641o,"A child asks his father what ""gay"" means",37566,0.84,770,2020-04-24 16:03:21,Jokes,29634874,https://www.reddit.com/r/Jokes/comments/g7641o/a_child_asks_his_father_what_gay_means/,https://www.reddit.com/r/Jokes/comments/g7641o/a_child_asks_his_father_what_gay_means/,self.Jokes,0,5,,text,False,False,False,"The father says it means happy to his son, to which the son replies ""Dad are you gay?"" The father laughs and says ""no son I have a wife""."
5mnh66,Communism jokes are not funny,37566,0.87,782,2017-01-08 04:36:53,Jokes,29634874,https://www.reddit.com/r/Jokes/comments/5mnh66/communism_jokes_are_not_funny/,https://www.reddit.com/r/Jokes/comments/5mnh66/communism_jokes_are_not_funny/,self.Jokes,0,0,,text,False,False,False,Unless everyone gets them
wiuymg,"If you take the first two letters of the title of each the 7 Harry Potter books, it spells out a secret message",37562,0.9,722,2022-08-08 06:14:55,Jokes,29634874,https://www.reddit.com/r/Jokes/comments/wiuymg/if_you_take_the_first_two_letters_of_the_title_of/,https://www.reddit.com/r/Jokes/comments/wiuymg/if_you_take_the_first_two_letters_of_the_title_of/,self.Jokes,0,3,,text,False,False,False,HAHAHAHAHAHAHA
5nt6y1,White people don't shoot each other in the streets like black people do.,37523,0.8,905,2017-01-14 02:21:37,Jokes,29634874,https://www.reddit.com/r/Jokes/comments/5nt6y1/white_people_dont_shoot_each_other_in_the_streets/,https://www.reddit.com/r/Jokes/comments/5nt6y1/white_people_dont_shoot_each_other_in_the_streets/,self.Jokes,0,0,,text,False,False,False,"We do it in schools, because we have class."
7b4d2i,A teenage boy was delivering papers to an apartment house.,37508,0.87,638,2017-11-06 16:06:11,Jokes,29634874,https://www.reddit.com/r/Jokes/comments/7b4d2i/a_teenage_boy_was_delivering_papers_to_an/,https://www.reddit.com/r/Jokes/comments/7b4d2i/a_teenage_boy_was_delivering_papers_to_an/,self.Jokes,0,1,,text,True,False,False,"A teenage boy was delivering papers to an apartment house. While there, a stunning young woman came out of the apartment next to the mailboxes wearing only a robe. The boy smiled at the young woman and she started up a conversation with him. As they talked, her robe slipped open, and it was obvious that she had nothing else on. The poor kid broke into a sweat trying to maintain eye contact.

After a few minutes of flirting, she placed her hand on his arm and said, ""Let's go to my apartment, I hear someone coming.""

He followed her into her apartment; she closed the door and leaned against it, allowing her robe to fall off completely. Now nude, she purred at him, ""What would you say is my best feature?""

Flustered and embarrassed, he finally squeaked, ""It has to be your ears.""

Astounded, and a little hurt she asked, ""My ears? Look at these breasts; they are a full 38 inches and 100 percent natural. I work out every day and my ass is firm and solid. I have a 28 inch waist. Look at my skin, not a blemish anywhere. How can you think that the best part of my body is my ears?""

Clearing his throat, he stammered, ""Outside, when you said you heard someone coming...that was me.""
"
6q0kmk,"(NSFW) A priest has a heart attack, and is rushed to the hospital. He wakes up as he's being rushed through the hospital on a gurney by two nurses. ""Am I in heaven?"" asks the disoriented priest.",37484,0.83,922,2017-07-28 06:55:24,Jokes,29634874,https://www.reddit.com/r/Jokes/comments/6q0kmk/nsfw_a_priest_has_a_heart_attack_and_is_rushed_to/,https://www.reddit.com/r/Jokes/comments/6q0kmk/nsfw_a_priest_has_a_heart_attack_and_is_rushed_to/,self.Jokes,0,1,,text,True,False,False," ""No"" says one of the nurses. ""We're just taking a short cut through the children's ward""."
7r1hld,My attractive female neighbor is completely paranoid.,37476,0.77,502,2018-01-17 20:26:53,Jokes,29634874,https://www.reddit.com/r/Jokes/comments/7r1hld/my_attractive_female_neighbor_is_completely/,https://www.reddit.com/r/Jokes/comments/7r1hld/my_attractive_female_neighbor_is_completely/,self.Jokes,0,1,,text,False,False,False,"She thinks I'm following or even stalking her, she is worried that I may be obsessed with her and any time she hears a noise in her house she is...purified? Oh, wait: petrified. Sorry, it's not easy reading a diary through binoculars from a tree."
6os1ul,There's a little-known legend about Attila the Hun...,37468,0.8,589,2017-07-22 06:05:02,Jokes,29634874,https://www.reddit.com/r/Jokes/comments/6os1ul/theres_a_littleknown_legend_about_attila_the_hun/,https://www.reddit.com/r/Jokes/comments/6os1ul/theres_a_littleknown_legend_about_attila_the_hun/,self.Jokes,0,0,,text,False,False,False,"The story goes that Attila used to collect exotic animals that he found during his conquests. He particularly liked dangerous or fearsome animals, and his favourite was a giant snake. He was so fond of it, it was said that he brought it with him on every campaign.


But his snake lost its appetite, and soon stopped eating altogether; perhaps due to the stress of frequent travel and an irregular diet.


Wishing to save his prized pet, Attila sought help from the local chirurgeons and witch doctors. None of them could do anything for him, until a wizened sage suggested feeding the serpent only young female virgins.


Attila was pleased with this idea, and was delighted to find that a city he had raided just happened to have a Christian convent with a convenient supply of the recommended food for his pet.


But the snake refused to eat, or even touch any of the consecrated virgins from the convent. Enraged, Attila sent for the soothsayer who advised him to have him executed.


Standing before Attila, the old man calmly said, ""Before thou killest me, may thee first bring the snake and one of the women to me.""


Curious, Attila did as he asked.


Then the old man took some bread and gave it to Attila.


""Now hold these in both hands,"" he instructed.


Attila did so, and as soon as he did, the snake let out a terrifying hiss, and swallowed the virgin whole.


To an amazed Attila, the old man simply said,


""Thy anaconda don't want nun unless you've got buns, Hun."""
ebd7zt,Someone broke into my house and stole 20% of my couch,37429,0.87,458,2019-12-16 15:28:48,Jokes,29634874,https://www.reddit.com/r/Jokes/comments/ebd7zt/someone_broke_into_my_house_and_stole_20_of_my/,https://www.reddit.com/r/Jokes/comments/ebd7zt/someone_broke_into_my_house_and_stole_20_of_my/,self.Jokes,0,2,,text,False,False,False,"













Ouch"
7d2asp,What do you call it when two transgender midgets have sex?,37359,0.86,818,2017-11-15 12:08:49,Jokes,29634874,https://www.reddit.com/r/Jokes/comments/7d2asp/what_do_you_call_it_when_two_transgender_midgets/,https://www.reddit.com/r/Jokes/comments/7d2asp/what_do_you_call_it_when_two_transgender_midgets/,self.Jokes,0,3,,text,False,,False,Micro trans-action
6imgfq,Not for the easily offended - my favourite politically incorrect joke...,37354,0.75,1177,2017-06-21 20:46:13,Jokes,29634874,https://www.reddit.com/r/Jokes/comments/6imgfq/not_for_the_easily_offended_my_favourite/,https://www.reddit.com/r/Jokes/comments/6imgfq/not_for_the_easily_offended_my_favourite/,self.Jokes,0,0,,text,False,False,False,"Man is walking through park. He sees a girl in a wheelchair crying.   
""What's wrong?"" man asks.   
""Never been kissed before"" girl says.   
Man kisses her and she goes home happy.   
  
Next day man walking through same park. Sees girl in wheelchair again crying.   
""What's wrong?"" man asks.   
""Never been wined and dined before"" girl says.   
So man takes her out for a beautiful meal, gets her drunk and wheels her off home.   
  
Again man walks through park following day. Girl still in wheelchair crying. 
""What's wrong?"" Asks man.    
""Never been fucked before"" says girl.    
So man picks up girl and throws her in the river and says...  
""Well you're fucked now""    "
786v2d,A woman is having an affair during the day while her husband is at work,37337,0.83,572,2017-10-23 16:07:18,Jokes,29634874,https://www.reddit.com/r/Jokes/comments/786v2d/a_woman_is_having_an_affair_during_the_day_while/,https://www.reddit.com/r/Jokes/comments/786v2d/a_woman_is_having_an_affair_during_the_day_while/,self.Jokes,0,0,,text,False,False,False,"A woman is having an affair during the day while her husband is at work. Her 9 year old son comes home unexpectedly, sees them and hides in the bedroom closet to watch. The woman’s husband also comes home. She puts her lover in the closet, not realizing that the little boy is in there already.

The little boy says, “Its dark in here.”

The man says, “Yes, it is.”

Boy ~ “I have a baseball.”

Man ~ “That’s nice.”

Boy ~ “Want to buy it?”

Man ~ “No, thanks.”

Boy ~ “My dad’s outside.”

Man ~ “OK, how much?”

Boy ~ “$250?

In the next few weeks, it happens again that the boy and the lover are in the closet together.

Boy ~ “Its dark in here.”

Man ~ “Yes, it is.”

Boy ~ “I have a baseball glove.”

The lover remembering the last time, asks the boy, “How much?”

Boy ~ “$750?

Man ~ “Fine.”

A few days later, the father says to the boy, “Grab your glove, let’s go outside and have a game of catch.”

The boy says, “I can’t, I sold my baseball and my glove.”

The father asks, “How much did you sell them for?”

Boy ~ “$1,000?

The father says, “That’s terrible to overcharge your friends like that…that is way more than those two things cost. I’m going to take you to church and make you confess.”

They go to the church and the father makes the little boy sit in the confession booth and he closes the door.

The boy says, “Dark in here.”

The priest says, “Don’t start that crap again.”"
8xyg37,My friends laughed at me when I told them I had a hot date and they said she was imaginary...,37327,0.89,322,2018-07-11 16:01:02,Jokes,29634874,https://www.reddit.com/r/Jokes/comments/8xyg37/my_friends_laughed_at_me_when_i_told_them_i_had_a/,https://www.reddit.com/r/Jokes/comments/8xyg37/my_friends_laughed_at_me_when_i_told_them_i_had_a/,self.Jokes,0,4,,text,False,False,False,"

Well the jokes on them – they’re imaginary too..."
gu6ipj,Why do police get to protests early?,37319,0.89,364,2020-06-01 02:09:13,Jokes,29634874,https://www.reddit.com/r/Jokes/comments/gu6ipj/why_do_police_get_to_protests_early/,https://www.reddit.com/r/Jokes/comments/gu6ipj/why_do_police_get_to_protests_early/,self.Jokes,0,3,,text,False,False,False,To beat the crowd.
fw1bzj,I'm giving up masturbating for an entire month.,37320,0.9,413,2020-04-06 21:33:19,Jokes,29634874,https://www.reddit.com/r/Jokes/comments/fw1bzj/im_giving_up_masturbating_for_an_entire_month/,https://www.reddit.com/r/Jokes/comments/fw1bzj/im_giving_up_masturbating_for_an_entire_month/,self.Jokes,0,1,,text,True,False,False,"Sorry, bad punctuation. 

I'm giving up. Masturbating for an entire month."
i4grci,"If A is for Apple and B is for Banana, what is C for?",37303,0.86,1127,2020-08-06 05:19:30,Jokes,29634874,https://www.reddit.com/r/Jokes/comments/i4grci/if_a_is_for_apple_and_b_is_for_banana_what_is_c/,https://www.reddit.com/r/Jokes/comments/i4grci/if_a_is_for_apple_and_b_is_for_banana_what_is_c/,self.Jokes,0,3,,text,False,False,False,Plastic explosives.
8imj8h,"Remember, as a child, when air for your bike was free? Now it's $1.50! I asked the gas station attendant why.",37293,0.86,825,2018-05-11 15:23:10,Jokes,29634874,https://www.reddit.com/r/Jokes/comments/8imj8h/remember_as_a_child_when_air_for_your_bike_was/,https://www.reddit.com/r/Jokes/comments/8imj8h/remember_as_a_child_when_air_for_your_bike_was/,self.Jokes,0,2,,text,False,False,False,"He said ""inflation"""
gxx0j0,"A teacher told her young class to ask their parents for a family story with a moral at the end of it, and to return the next day to tell their stories.",37290,0.92,356,2020-06-07 00:40:01,Jokes,29634874,https://www.reddit.com/r/Jokes/comments/gxx0j0/a_teacher_told_her_young_class_to_ask_their/,https://www.reddit.com/r/Jokes/comments/gxx0j0/a_teacher_told_her_young_class_to_ask_their/,self.Jokes,0,4,,text,False,,False,"In the classroom the next day, Joe gave his example first, “My dad is a farmer and we have chickens. One day we were taking lots of eggs to the market in a basket on the front seat of the truck when we hit a big bump in the road. The basket fell off the seat and all the eggs broke.” The moral of the story is not to put all your eggs in one basket. “Very good,” said the teacher. Next, Mary said, “We are farmers too. We had twenty eggs waiting to hatch, but when they did we only got ten chicks.” The moral of this story is not to count your chickens before they’re hatched . “Very good,” said the teacher again, very pleased with the response so far.

Next it was Barney’s turn to tell his story: “My dad told me this story about my Aunt Karen. Aunt Karen was a flight engineer in the war and her plane got hit. She had to bail out over enemy territory and all she had was a bottle of whiskey, a machine gun and a machete.” “Go on,” said the teacher, intrigued.

“Aunt Karen drank the whiskey on the way down to prepare herself. Then she landed right in the middle of a hundred enemy soldiers. She killed seventy of them with the machine gun until she ran out of bullets. Then she killed twenty more with the machete till the blade broke. And then she killed the last ten with her bare hands.” “Good heavens,” said the horrified teacher, “What did your father say was the moral of that frightening Story?”

The child said: “Stay away from Aunt Karen when she’s been drinking.”"
6t3xxl,My local drug dealer started dressing up as a Jehovah's Witness so he wouldn't arouse suspicion.,37290,0.9,817,2017-08-12 02:00:33,Jokes,29634874,https://www.reddit.com/r/Jokes/comments/6t3xxl/my_local_drug_dealer_started_dressing_up_as_a/,https://www.reddit.com/r/Jokes/comments/6t3xxl/my_local_drug_dealer_started_dressing_up_as_a/,self.Jokes,0,0,,text,False,,False,He got arrested after the police saw people actually letting him in.
9w89gs,An infinite number of mathematicians walk into a bar,37271,0.76,1313,2018-11-12 04:11:28,Jokes,29634874,https://www.reddit.com/r/Jokes/comments/9w89gs/an_infinite_number_of_mathematicians_walk_into_a/,https://www.reddit.com/r/Jokes/comments/9w89gs/an_infinite_number_of_mathematicians_walk_into_a/,self.Jokes,0,10,,text,False,False,False,"The first mathematician orders a beer

The second orders half a beer

""I don't serve half-beers"" the bartender replies

""Excuse me?"" Asks mathematician #2

""What kind of bar serves half-beers?"" The bartender remarks. ""That's ridiculous.""

""Oh c'mon"" says mathematician #1 ""do you know how hard it is to collect an infinite number of us? Just play along""

""There are very strict laws on how I can serve drinks. I couldn't serve you half a beer even if I wanted to.""

""But that's not a problem"" mathematician #3 chimes in ""at the end of the joke you serve us a whole number of beers. You see, when you take the sum of a continuously halving function-""

""I know how limits work"" interjects the bartender

""Oh, alright then. I didn't want to assume a bartender would be familiar with such advanced mathematics""

""Are you kidding me?"" The bartender replies, ""you learn limits in like, 9th grade! What kind of mathematician thinks limits are advanced mathematics?""

""HE'S ON TO US"" mathematician #1 screeches

Simultaneously, every mathematician opens their mouth and out pours a cloud of multicolored mosquitoes. Each mathematician is bellowing insects of a different shade.

The mosquitoes form into a singular, polychromatic swarm. ""FOOLS"" it booms in unison, ""I WILL INFECT EVERY BEING ON THIS PATHETIC PLANET WITH MALARIA""

The bartender stands fearless against the technicolor hoard. ""But wait"" he inturrupts, thinking fast, ""if you do that, politicians will use the catastrophe as an excuse to implement free healthcare. Think of how much that will hurt the taxpayers!""

The mosquitoes fall silent for a brief moment. ""My God, you're right. We didn't think about the economy! Very well, we will not attack this dimension. FOR THE TAXPAYERS!"" and with that, they vanish.

A nearby barfly stumbles over to the bartender. ""How did you know that that would work?""

""It's simple really"" the bartender says. ""I saw that the vectors formed a gradient, and therefore must be conservative.""

"
