id,title,score,upvote_ratio,num_comments,created_utc,subreddit,subscribers,permalink,url,domain,num_awards,num_crossposts,crosspost_subreddits,post_type,is_nsfw,is_bot,is_megathread,body
f6lii3,Sad News: The founder of /r/jokes has passed away,165571,0.98,1879,2020-02-20 07:21:00,Jokes,29634874,https://www.reddit.com/r/Jokes/comments/f6lii3/sad_news_the_founder_of_rjokes_has_passed_away/,https://www.reddit.com/r/Jokes/comments/f6lii3/sad_news_the_founder_of_rjokes_has_passed_away/,self.Jokes,0,10,,text,False,False,False,"RIP Larry Tesler, the UI designer that created Cut, Copy and Paste, died age 74"
7ekt23,Calm down about the Net Neutrality thing...,142203,0.9,1616,2017-11-22 01:45:27,Jokes,29634874,https://www.reddit.com/r/Jokes/comments/7ekt23/calm_down_about_the_net_neutrality_thing/,https://www.reddit.com/r/Jokes/comments/7ekt23/calm_down_about_the_net_neutrality_thing/,self.Jokes,0,2,,text,False,False,False,Paying additional money to access certain sites will give you a sense of pride and accomplishment.
6lfqep,V,119401,0.93,1372,2017-07-05 23:31:05,Jokes,29634874,https://www.reddit.com/r/Jokes/comments/6lfqep/v/,https://www.reddit.com/r/Jokes/comments/6lfqep/v/,self.Jokes,0,1,,text,False,False,False,"V

*Edit: seems like the ctrl key on my keyboard is not working

"
9mf1cz,A new Navy recruit has his first day on the submarine...,113557,0.94,801,2018-10-08 19:23:47,Jokes,29634874,https://www.reddit.com/r/Jokes/comments/9mf1cz/a_new_navy_recruit_has_his_first_day_on_the/,https://www.reddit.com/r/Jokes/comments/9mf1cz/a_new_navy_recruit_has_his_first_day_on_the/,self.Jokes,0,6,,text,False,False,False,"He speaks with the officer, who assigns him his post.

""Go stand at the periscope entry-way, and make sure no unauthorized personnel touch the periscope.""

The recruit follows orders, and stands by the periscope. After 15 minutes, the officer stops by.

""Son I'm changing your post to the mess hall. Go in there and start washing some dishes.""

The recruit obeys, and heads to the mess hall. He's cleaned about 3 dishes when the officer walks up again.

""Listen here recruit, your new post is in the supply room. I need you to make sure everything is strapped down tight, in case of rough waters.""

The recruit again follows orders, and heads off to the supply room. There, he sees a crewman, moving some boxes.

""Hey there,"" says the recruit. ""is it normal to keep getting reassigned to new posts all day? I haven't kept one position for more than 15 minutes!""

The crewman says ""Oh yeah- this sub is full of reposts."" "
coj45m,If your surprised that Jeffrey Epstein commited suicide this morning,113174,0.94,2427,2019-08-10 20:33:25,Jokes,29634874,https://www.reddit.com/r/Jokes/comments/coj45m/if_your_surprised_that_jeffrey_epstein_commited/,https://www.reddit.com/r/Jokes/comments/coj45m/if_your_surprised_that_jeffrey_epstein_commited/,self.Jokes,0,7,,text,True,False,False,"Imagine how surprised he must have been.

Edit: Thank you to the Redditors that awarded this post. To everybody else I’m sorry I typed your instead of you’re."
dcuyha,What did the reddit user say after detonating a bomb inside a bank?,107896,0.96,671,2019-10-03 23:59:30,Jokes,29634874,https://www.reddit.com/r/Jokes/comments/dcuyha/what_did_the_reddit_user_say_after_detonating_a/,https://www.reddit.com/r/Jokes/comments/dcuyha/what_did_the_reddit_user_say_after_detonating_a/,self.Jokes,0,4,,text,False,False,False,EDIT: Wow! This blew up! Thanks for the gold!
7wtsuf,"The only two white actors in Black Panther are Martin Freeman, who played Bilbo Baggins, and Andy Serkis who played Gollum.",101564,0.91,1376,2018-02-11 22:13:04,Jokes,29634874,https://www.reddit.com/r/Jokes/comments/7wtsuf/the_only_two_white_actors_in_black_panther_are/,https://www.reddit.com/r/Jokes/comments/7wtsuf/the_only_two_white_actors_in_black_panther_are/,self.Jokes,0,1,,text,False,False,False,"They're the Tolkien white guys.

Edit: Apparently somebody posted this joke to Twitter in October and that makes me a piece of shit.

¯\\\_(ツ)_/¯"
7jtg65,Ajit Pai.,97788,0.84,1542,2017-12-14 23:47:47,Jokes,29634874,https://www.reddit.com/r/Jokes/comments/7jtg65/ajit_pai/,https://www.reddit.com/r/Jokes/comments/7jtg65/ajit_pai/,self.Jokes,0,1,,text,False,False,False,"That's it. That's the whole fucking joke.

EDIT: Removed edits, people don't like those. [](/rdcry)"
5by0qh,The 2016 US Presidential Election,95657,0.88,3650,2016-11-09 08:51:44,Jokes,29634874,https://www.reddit.com/r/Jokes/comments/5by0qh/the_2016_us_presidential_election/,https://www.reddit.com/r/Jokes/comments/5by0qh/the_2016_us_presidential_election/,self.Jokes,0,0,,text,False,False,False,"That's it. That's the entire fucking joke. 
"
jog7nf,How many Trump supporters does it take to change a lightbulb?,95127,0.83,2848,2020-11-05 15:28:43,Jokes,29634874,https://www.reddit.com/r/Jokes/comments/jog7nf/how_many_trump_supporters_does_it_take_to_change/,https://www.reddit.com/r/Jokes/comments/jog7nf/how_many_trump_supporters_does_it_take_to_change/,self.Jokes,0,12,,text,False,False,False,None. Trump says it’s done and they all cheer in the dark.
64k6iq,Did you hear about the Doctor on the United Flight?,91718,0.94,1150,2017-04-10 20:46:28,Jokes,29634874,https://www.reddit.com/r/Jokes/comments/64k6iq/did_you_hear_about_the_doctor_on_the_united_flight/,https://www.reddit.com/r/Jokes/comments/64k6iq/did_you_hear_about_the_doctor_on_the_united_flight/,self.Jokes,0,0,,text,False,False,False,[removed]
hy6v4c,Iris‌‌h daughte‌‌r ha‌‌d no‌‌t bee‌‌n hom‌‌e fo‌‌r ove‌‌r ‌‌5 years‌‌. Upo‌‌n he‌‌r retur‌‌n he‌‌r Fathe‌‌r curse‌‌d he‌‌r heavily‌‌.,89002,0.94,1398,2020-07-26 18:54:43,Jokes,29634874,https://www.reddit.com/r/Jokes/comments/hy6v4c/irish_daughter_had_not_been_home_for_over_5_years/,https://www.reddit.com/r/Jokes/comments/hy6v4c/irish_daughter_had_not_been_home_for_over_5_years/,self.Jokes,0,3,,text,True,,False,"""Wher‌‌e hav‌‌e y‌‌e bee‌‌n al‌‌l thi‌‌s time‌‌, child‌‌? Wh‌‌y di‌‌d y‌‌e no‌‌t writ‌‌e t‌‌o us‌‌, no‌‌t eve‌‌n ‌‌a line‌‌? Wh‌‌y didn'‌‌t y‌‌e call‌‌? Ca‌‌n y‌‌e no‌‌t understan‌‌d wha‌‌t y‌‌e pu‌‌t ye‌‌r ol‌‌d Mothe‌‌r through?‌‌""  
‌‌  
Th‌‌e girl‌‌, crying‌‌, replied‌‌, ""Dad..‌‌. ‌‌I becam‌‌e ‌‌a prostitute.‌‌""  
‌‌  
""Y‌‌e what!‌‌? Ge‌‌t ou‌‌t ‌‌a here‌‌, y‌‌e shameles‌‌s harlot‌‌! Sinner‌‌! You'r‌‌e ‌‌a disgrac‌‌e t‌‌o thi‌‌s Catholi‌‌c family.‌‌""  
‌‌  
""OK‌‌, Dad..‌‌. a‌‌s y‌‌e wish‌‌. ‌‌I onl‌‌y cam‌‌e bac‌‌k t‌‌o giv‌‌e mu‌‌m thi‌‌s luxuriou‌‌s fu‌‌r coat‌‌, titl‌‌e dee‌‌d t‌‌o ‌‌a te‌‌n bedroo‌‌m mansion‌‌, plu‌‌s ‌‌a ‌‌5 millio‌‌n saving‌‌s certificate‌‌. Fo‌‌r m‌‌e littl‌‌e brother‌‌, thi‌‌s gol‌‌d Rolex‌‌. An‌‌d fo‌‌r y‌‌e Daddy‌‌, th‌‌e sparklin‌‌g ne‌‌w Mercede‌‌s limite‌‌d editio‌‌n convertibl‌‌e that'‌‌s parke‌‌d outsid‌‌e plu‌‌s ‌‌a membershi‌‌p t‌‌o th‌‌e countr‌‌y clu‌‌b ..‌‌. (take‌‌s ‌‌a breath‌‌) ..‌‌. an‌‌d a‌‌n invitatio‌‌n fo‌‌r y‌‌e al‌‌l t‌‌o spen‌‌d Ne‌‌w Year'‌‌s Ev‌‌e o‌‌n boar‌‌d m‌‌y ne‌‌w yach‌‌t i‌‌n th‌‌e Riviera.‌‌""  
‌‌  
""Wha‌‌t wa‌‌s i‌‌t y‌‌e sai‌‌d y‌‌e ha‌‌d become?""‌‌, say‌‌s Dad‌‌.  
‌‌  
Girl‌‌, cryin‌‌g again‌‌, ""‌‌A prostitute‌‌, Daddy!‌‌""  
‌‌  
""Oh‌‌! M‌‌y Goodness‌‌! Y‌‌e scare‌‌d m‌‌e hal‌‌f t‌‌o death‌‌, girl‌‌! ‌‌I though‌‌t y‌‌e sai‌‌d ‌‌a Protestant‌‌! Com‌‌e her‌‌e an‌‌d giv‌‌e ye‌‌r ol‌‌d Da‌‌d ‌‌a hug!‌‌"""
gvhgvd,What’s the difference between a police officer and a bullet?,86353,0.92,1745,2020-06-03 04:01:07,Jokes,29634874,https://www.reddit.com/r/Jokes/comments/gvhgvd/whats_the_difference_between_a_police_officer_and/,https://www.reddit.com/r/Jokes/comments/gvhgvd/whats_the_difference_between_a_police_officer_and/,self.Jokes,0,6,,text,False,False,False,"When a bullet kills someone else, you know it’s been fired"
7esyjx,If I had a $ for every post I've seen today about Net Neutrality...,85788,0.89,836,2017-11-22 23:41:49,Jokes,29634874,https://www.reddit.com/r/Jokes/comments/7esyjx/if_i_had_a_for_every_post_ive_seen_today_about/,https://www.reddit.com/r/Jokes/comments/7esyjx/if_i_had_a_for_every_post_ive_seen_today_about/,self.Jokes,0,2,,text,False,,False,I'd have enough money to view a post next year about Net Neutrality.
a593r0,"Twenty years from now, kids are gonna think ""Baby it's cold outside"" is really weird, and we're gonna have to explain that it has to be understood as a product of its time.",83004,0.86,2283,2018-12-11 23:21:28,Jokes,29634874,https://www.reddit.com/r/Jokes/comments/a593r0/twenty_years_from_now_kids_are_gonna_think_baby/,https://www.reddit.com/r/Jokes/comments/a593r0/twenty_years_from_now_kids_are_gonna_think_baby/,self.Jokes,0,6,,text,False,False,False,"You see, it used to get cold outside"
5k9tgu,This is the dirty joke my 85yo grandad told to our whole family by memory,81402,0.95,621,2016-12-26 01:21:11,Jokes,29634874,https://www.reddit.com/r/Jokes/comments/5k9tgu/this_is_the_dirty_joke_my_85yo_grandad_told_to/,https://www.reddit.com/r/Jokes/comments/5k9tgu/this_is_the_dirty_joke_my_85yo_grandad_told_to/,self.Jokes,0,2,,text,True,False,False,"A male whale and a female whale were swimming off the coast of Japan when they noticed a whaling ship.  The male whale recognized it as the same ship that had harpooned his father many years earlier. He said to the female whale, ""Lets both swim under the ship and blow out of our air holes at the same time and it should cause the ship to turn over and sink."" They tried it and sure enough, the ship turned over and quickly sank. 

Soon however, the whales realized the sailors had jumped overboard and were swimming to the safety of shore. The male was enraged that they were going to get away and told the female, ""Let's swim after them and gobble them up before they reach the shore."" At this point, he realized the female was becoming reluctant to follow him. ""Look,"" she said, ""I went along with the blow job, but I absolutely refuse to swallow the seamen."" 

Edit: I think it's bad that I'm more excited watching this get ups that I was about the whole of Christmas "
hgr2ew,What is a Karen called in Europe?,81346,0.86,3763,2020-06-27 15:45:44,Jokes,29634874,https://www.reddit.com/r/Jokes/comments/hgr2ew/what_is_a_karen_called_in_europe/,https://www.reddit.com/r/Jokes/comments/hgr2ew/what_is_a_karen_called_in_europe/,self.Jokes,0,10,,text,False,False,False,An American.
77g7ub,"A Woman goes to buy a Parrot. The prices are $100, $200, and $15. She asks why the last one is so cheap?",80861,0.92,1035,2017-10-19 23:35:31,Jokes,29634874,https://www.reddit.com/r/Jokes/comments/77g7ub/a_woman_goes_to_buy_a_parrot_the_prices_are_100/,https://www.reddit.com/r/Jokes/comments/77g7ub/a_woman_goes_to_buy_a_parrot_the_prices_are_100/,self.Jokes,0,3,,text,True,False,False,"""Because he used to live in a brothel"" says the shopkeeper. She pays $15.

When she gets home the parrot says: ""Fuck me, a new brothel!"" The woman laughs.

When her daughters get home the parrot says: ""Fuck me, 2 new prozzies!"" The girls laughs too.

When the dad gets home the parrot says: ""Fuck me Pete, haven't seen you for weeks!"""
cf6h70,If America is storming Area 51 then the Europeans can storm the Vatican,80677,0.92,1350,2019-07-19 17:09:32,Jokes,29634874,https://www.reddit.com/r/Jokes/comments/cf6h70/if_america_is_storming_area_51_then_the_europeans/,https://www.reddit.com/r/Jokes/comments/cf6h70/if_america_is_storming_area_51_then_the_europeans/,self.Jokes,0,10,,text,False,False,False,"We’ll take the aliens, you get the predators"
7nbxbl,I hate when people ask how I see myself in 3 years,79362,0.86,1217,2018-01-01 05:26:57,Jokes,29634874,https://www.reddit.com/r/Jokes/comments/7nbxbl/i_hate_when_people_ask_how_i_see_myself_in_3_years/,https://www.reddit.com/r/Jokes/comments/7nbxbl/i_hate_when_people_ask_how_i_see_myself_in_3_years/,self.Jokes,0,5,,text,False,False,False,"I don’t have 2020 vision

This is the only day you can upvote this

EDIT: Thank you sm for r/all ! Happy New Years!"
eczclg,Do you want to know why the republicans won't impeach Trump?,76064,0.83,930,2019-12-20 02:31:09,Jokes,29634874,https://www.reddit.com/r/Jokes/comments/eczclg/do_you_want_to_know_why_the_republicans_wont/,https://www.reddit.com/r/Jokes/comments/eczclg/do_you_want_to_know_why_the_republicans_wont/,self.Jokes,0,5,,text,False,False,False,Because they believe in carrying a baby to full term.
81e02g,"Call me a racist if you want, but south of the border is a sea of violence, corruption and stupidity I wouldn't touch with a ten foot pole.",74966,0.84,3193,2018-03-02 18:25:00,Jokes,29634874,https://www.reddit.com/r/Jokes/comments/81e02g/call_me_a_racist_if_you_want_but_south_of_the/,https://www.reddit.com/r/Jokes/comments/81e02g/call_me_a_racist_if_you_want_but_south_of_the/,self.Jokes,0,3,,text,False,False,False,"I just thank my lucky stars I live in Canada.

Edit: Sorry."
krz283,Why did it take the police so long to show up to Capitol Hill today?,73599,0.86,1430,2021-01-07 04:08:30,Jokes,29634874,https://www.reddit.com/r/Jokes/comments/krz283/why_did_it_take_the_police_so_long_to_show_up_to/,https://www.reddit.com/r/Jokes/comments/krz283/why_did_it_take_the_police_so_long_to_show_up_to/,self.Jokes,0,2,,text,False,False,False,Because they had to go home and change first.
floyyn,"This shutdown is bad for everyone in the service industry, but it especially sucks for men",73545,0.89,1743,2020-03-20 10:17:30,Jokes,29634874,https://www.reddit.com/r/Jokes/comments/floyyn/this_shutdown_is_bad_for_everyone_in_the_service/,https://www.reddit.com/r/Jokes/comments/floyyn/this_shutdown_is_bad_for_everyone_in_the_service/,self.Jokes,0,8,,text,False,False,False,We're losing $1 for every $.79 women are losing
7ieoji,A boy asked his Bitcoin-investing dad...,73110,0.93,2243,2017-12-08 18:03:53,Jokes,29634874,https://www.reddit.com/r/Jokes/comments/7ieoji/a_boy_asked_his_bitcoininvesting_dad/,https://www.reddit.com/r/Jokes/comments/7ieoji/a_boy_asked_his_bitcoininvesting_dad/,self.Jokes,0,5,,text,False,False,False,"...for $10.00 worth of Bitcoin currency.

Dad: $9.67? What do you need $10.32 for?"
j6q49y,What is the most expensive video-streaming service at this time?,73100,0.96,737,2020-10-07 18:13:23,Jokes,29634874,https://www.reddit.com/r/Jokes/comments/j6q49y/what_is_the_most_expensive_videostreaming_service/,https://www.reddit.com/r/Jokes/comments/j6q49y/what_is_the_most_expensive_videostreaming_service/,self.Jokes,0,13,,text,False,False,False,College
hpdoul,"When I was growing up # was pound, not hashtag",72466,0.88,5639,2020-07-11 22:44:07,Jokes,29634874,https://www.reddit.com/r/Jokes/comments/hpdoul/when_i_was_growing_up_was_pound_not_hashtag/,https://www.reddit.com/r/Jokes/comments/hpdoul/when_i_was_growing_up_was_pound_not_hashtag/,self.Jokes,0,2,,text,False,False,False,"Good thing it changed, since ""pound metoo"" would've been sending the wrong message"
6caziq,The funniest /r/jokes has ever been,71094,0.8,3285,2017-05-20 21:11:28,Jokes,29634874,https://www.reddit.com/r/Jokes/comments/6caziq/the_funniest_rjokes_has_ever_been/,https://imgur.com/lw2a0bY,imgur.com,0,0,,image,False,False,False,
8fy9y1,Why was the anti-vaxxer‘s 4 year old child crying?,71066,0.93,916,2018-04-30 15:14:53,Jokes,29634874,https://www.reddit.com/r/Jokes/comments/8fy9y1/why_was_the_antivaxxers_4_year_old_child_crying/,https://www.reddit.com/r/Jokes/comments/8fy9y1/why_was_the_antivaxxers_4_year_old_child_crying/,self.Jokes,0,1,,text,False,False,False,Midlife crisis
jn0ig4,"If trump wins the election, I will leave the United States",68833,0.82,1423,2020-11-03 06:27:31,Jokes,29634874,https://www.reddit.com/r/Jokes/comments/jn0ig4/if_trump_wins_the_election_i_will_leave_the/,https://www.reddit.com/r/Jokes/comments/jn0ig4/if_trump_wins_the_election_i_will_leave_the/,self.Jokes,0,1,,text,False,False,False,"If Biden wins the election, I will leave the United States

This is not a political post, I just want to travel"
9xd4en,For anyone attending Stan Lee's funeral...,68837,0.9,710,2018-11-15 22:45:48,Jokes,29634874,https://www.reddit.com/r/Jokes/comments/9xd4en/for_anyone_attending_stan_lees_funeral/,https://www.reddit.com/r/Jokes/comments/9xd4en/for_anyone_attending_stan_lees_funeral/,self.Jokes,0,5,,text,False,False,False,Make sure you stay after the ceremony is finished.
jngf2f,Waiting for election results is like waiting for a grade on a group project.,68735,0.92,805,2020-11-04 00:29:42,Jokes,29634874,https://www.reddit.com/r/Jokes/comments/jngf2f/waiting_for_election_results_is_like_waiting_for/,https://www.reddit.com/r/Jokes/comments/jngf2f/waiting_for_election_results_is_like_waiting_for/,self.Jokes,0,1,,text,False,False,False,"I know I did my part right, but I am worried the rest of you screwed it up."
aime9b,North Koreans believe they live in the best country in the world because they’re brainwashed by the government and the media.,67296,0.85,3244,2019-01-22 18:02:26,Jokes,29634874,https://www.reddit.com/r/Jokes/comments/aime9b/north_koreans_believe_they_live_in_the_best/,https://www.reddit.com/r/Jokes/comments/aime9b/north_koreans_believe_they_live_in_the_best/,self.Jokes,0,6,,text,False,False,False,When every American knows that America is the best country in the world.
64oinr,The front page is filled with memes in reference to that guy being dragged off of a plane. I can't remember the last time the entire reddit user base was so...,67175,0.86,1008,2017-04-11 09:11:28,Jokes,29634874,https://www.reddit.com/r/Jokes/comments/64oinr/the_front_page_is_filled_with_memes_in_reference/,https://www.reddit.com/r/Jokes/comments/64oinr/the_front_page_is_filled_with_memes_in_reference/,self.Jokes,0,0,,text,False,False,False,... United.
7he12e,I hope Elon Musk never gets involved in a scandal,66563,0.91,1044,2017-12-04 07:03:35,Jokes,29634874,https://www.reddit.com/r/Jokes/comments/7he12e/i_hope_elon_musk_never_gets_involved_in_a_scandal/,https://www.reddit.com/r/Jokes/comments/7he12e/i_hope_elon_musk_never_gets_involved_in_a_scandal/,self.Jokes,0,0,,text,False,False,False,Elongate would be really drawn out.
6y81nc,Still my favorite joke I ever made up. :),65759,0.86,950,2017-09-05 19:12:37,Jokes,29634874,https://www.reddit.com/r/Jokes/comments/6y81nc/still_my_favorite_joke_i_ever_made_up/,https://www.reddit.com/r/Jokes/comments/6y81nc/still_my_favorite_joke_i_ever_made_up/,self.Jokes,0,1,,text,False,False,False,"A monocle walks into a bar. After a few drinks he starts to feel pretty good (and a little uncoordinated). He reaches for a cigarette, but the bartender stops him. ""Sorry, buddy, but due to city ordinances we don't allow smoking in here. You'll have to step outside to smoke.""

So the monocle hops off the bar stool and grabs his cigarettes to head outside. Meanwhile a second monocle emerges from the bathroom. They bump into each other as they cross paths and fall to the floor, hopelessly entangled. They try to get free but the more they struggle, the more tangled they become.

The bartender looks down on this travesty and shakes his head. ""Hey you two!"" he shouts. ""Stop making spectacles of yourselves!"""
6fl7jt,My girlfriend dressed up as a policewoman and told me I was under arrest on suspicion of being good in bed.,65559,0.91,698,2017-06-06 17:09:11,Jokes,29634874,https://www.reddit.com/r/Jokes/comments/6fl7jt/my_girlfriend_dressed_up_as_a_policewoman_and/,https://www.reddit.com/r/Jokes/comments/6fl7jt/my_girlfriend_dressed_up_as_a_policewoman_and/,self.Jokes,0,2,,text,False,False,False,After 2 minutes all charges were dropped due to a lack of evidence.
6e9s2j,"What has 4 letters, sometimes 9 letters, but never has 5 letters.",65410,0.86,2169,2017-05-31 01:29:03,Jokes,29634874,https://www.reddit.com/r/Jokes/comments/6e9s2j/what_has_4_letters_sometimes_9_letters_but_never/,https://www.reddit.com/r/Jokes/comments/6e9s2j/what_has_4_letters_sometimes_9_letters_but_never/,self.Jokes,0,2,,text,False,False,False,Just a hint: I didn't ask a question.
9zd1b9,So Tekashi69 could face life in prison,65409,0.88,1943,2018-11-22 16:03:15,Jokes,29634874,https://www.reddit.com/r/Jokes/comments/9zd1b9/so_tekashi69_could_face_life_in_prison/,https://www.reddit.com/r/Jokes/comments/9zd1b9/so_tekashi69_could_face_life_in_prison/,self.Jokes,0,3,,text,False,False,False,"Which is nice because we might finally get to see a mumble rapper completing a sentence

Edit: i am aware he isnt a mumble rapper"
gvrpau,The president of the US is threatening to send the military to suppress US citizens.,65282,0.84,1611,2020-06-03 16:16:44,Jokes,29634874,https://www.reddit.com/r/Jokes/comments/gvrpau/the_president_of_the_us_is_threatening_to_send/,https://www.reddit.com/r/Jokes/comments/gvrpau/the_president_of_the_us_is_threatening_to_send/,self.Jokes,0,2,,text,False,False,False,Looks like Americans are finally gonna get a taste of democracy and freedom.
g61jlw,"An attractive young woman on a flight from Ireland asked the priest beside her, ""Father, may I ask a favor?""",64807,0.91,986,2020-04-22 19:26:36,Jokes,29634874,https://www.reddit.com/r/Jokes/comments/g61jlw/an_attractive_young_woman_on_a_flight_from/,https://www.reddit.com/r/Jokes/comments/g61jlw/an_attractive_young_woman_on_a_flight_from/,self.Jokes,0,2,,text,True,False,False," ""Of course child. What may I do for you?""  


""Well, I bought my mother an expensive hair dryer for her birthday. It is unopened but well over the customs limits and I'm afraid they'll confiscate it. Is there any way you could carry it through Customs for me? Hide it under your robes perhaps?""  


""I would love to help you, dear, but I must warn you, I will not lie.""  


""With your honest face, Father, no one will question you,"" she replied.  
When they got to Customs, she let the priest go first. The official asked, ""Father, do you have anything to declare?""  


""From the top of my head down to my waist I have nothing to declare.""  
The official thought this answer strange, so asked, ""And what do you have to declare from your waist to the floor?""  


Father replied, ""I have a marvelous instrument designed to be used on a woman, which is, to date, unused.""  


Roaring with laughter, the official said, ""Go ahead, Father. Next please!"""
7g4kpk,Imagine if Americans switched from pounds to kilograms overnight...,64559,0.91,1262,2017-11-28 20:10:52,Jokes,29634874,https://www.reddit.com/r/Jokes/comments/7g4kpk/imagine_if_americans_switched_from_pounds_to/,https://www.reddit.com/r/Jokes/comments/7g4kpk/imagine_if_americans_switched_from_pounds_to/,self.Jokes,0,1,,text,False,False,False,There would be mass confusion.
8vx7ym,"A lost dog strays into a jungle. A lion sees this from a distance and says with caution ""this guy looks edible, never seen his kind before"".",64297,0.92,1151,2018-07-04 05:47:16,Jokes,29634874,https://www.reddit.com/r/Jokes/comments/8vx7ym/a_lost_dog_strays_into_a_jungle_a_lion_sees_this/,https://www.reddit.com/r/Jokes/comments/8vx7ym/a_lost_dog_strays_into_a_jungle_a_lion_sees_this/,self.Jokes,0,5,,text,False,False,False,"So the lion starts rushing towards the dog with menace. The dog notices and starts to panic but as he's about to run he sees some bones next to him and gets an idea and says loudly ""mmm...that was some good lion meat!"". 

The lion abruptly stops and says "" woah! This guy seems tougher then he looks, I better leave while I can"". 

Over by the tree top, a monkey witnessed everything. Evidently, the monkey realizes the he can benefit from this situation by telling the lion and getting something in return. So the monkey proceeds to tell the lion what really happened and the lion says angrily ""get on my back, we'll get him together"". 

So they start rushing back to the dog. The dog sees them and realized what happened and starts to panic even more. He then gets another idea and shouts ""where the hell is that monkey! I told him to bring me another lion an hour ago...""

Edit: OMG my first gold! Thank you!"
5nx0el,TIFU by accidentally cheating on my wife at a BDSM convention with a woman who was wearing the same leather mask,63244,0.85,932,2017-01-14 16:54:43,Jokes,29634874,https://www.reddit.com/r/Jokes/comments/5nx0el/tifu_by_accidentally_cheating_on_my_wife_at_a/,https://www.reddit.com/r/Jokes/comments/5nx0el/tifu_by_accidentally_cheating_on_my_wife_at_a/,self.Jokes,0,0,,text,False,False,False,"Whoops, wrong sub"
