id,title,score,upvote_ratio,num_comments,created_utc,subreddit,subscribers,permalink,url,domain,num_awards,num_crossposts,crosspost_subreddits,post_type,is_nsfw,is_bot,is_megathread,body
6xnszo,Stop trying to kill the headphone jack,51523,0.8,6937,2017-09-02 23:45:27,technology,17123051,https://www.reddit.com/r/technology/comments/6xnszo/stop_trying_to_kill_the_headphone_jack/,https://thenextweb.com/gadgets/2017/08/31/stop-trying-to-kill-the-headphone-jack/#.tnw_gg3ed6Xc,thenextweb.com,0,0,,link,False,False,False,
gz6qlm,You Have a First Amendment Right to Record the Police,51383,0.94,1171,2020-06-09 01:32:04,technology,17123051,https://www.reddit.com/r/technology/comments/gz6qlm/you_have_a_first_amendment_right_to_record_the/,https://www.eff.org/deeplinks/2020/06/you-have-first-amendment-right-record-police,eff.org,0,8,,link,False,False,False,
z1f46g,"Amazon Alexa is a “colossal failure,” on pace to lose $10 billion this year",51376,0.91,5826,2022-11-22 05:51:33,technology,17123051,https://www.reddit.com/r/technology/comments/z1f46g/amazon_alexa_is_a_colossal_failure_on_pace_to/,https://arstechnica.com/gadgets/2022/11/amazon-alexa-is-a-colossal-failure-on-pace-to-lose-10-billion-this-year/,arstechnica.com,0,13,,link,False,False,False,
m68gdc,Facebook found that a vast amount of its anti-vaxx content comes from a hard core of only 111 accounts,51381,0.92,1687,2021-03-16 18:27:26,technology,17123051,https://www.reddit.com/r/technology/comments/m68gdc/facebook_found_that_a_vast_amount_of_its_antivaxx/,https://www.businessinsider.com/facebook-identifies-111-accounts-behind-most-anti-vaxx-posts-2021-3?r=US&IR=T,businessinsider.com,0,10,,link,False,False,False,
ieqs8k,TikTok confirms it will sue the Trump administration,51378,0.79,2888,2020-08-23 02:55:42,technology,17123051,https://www.reddit.com/r/technology/comments/ieqs8k/tiktok_confirms_it_will_sue_the_trump/,https://www.theverge.com/2020/8/22/21397131/tiktok-lawsuit-president-trump-china-ban-executive-order,theverge.com,0,11,,link,False,False,False,
43fi39,I set up my Raspberry Pi to automatically tweet at Comcast Xfinity whenever my internet speeds drop significantly below what I pay for,51357,0.92,2979,2016-01-31 00:56:57,technology,17123051,https://www.reddit.com/r/technology/comments/43fi39/i_set_up_my_raspberry_pi_to_automatically_tweet/,https://www.reddit.com/r/technology/comments/43fi39/i_set_up_my_raspberry_pi_to_automatically_tweet/,self.technology,0,0,,text,False,False,False,"https://twitter.com/a_comcast_user

I pay for 150mbps down and 10mbps up. The raspberry pi runs a series of speedtests every hour and stores the data. Whenever the downspeed is below 50mbps the Pi uses a twitter API to send an automatic tweet to Comcast listing the speeds. 

I know some people might say I should not be complaining about 50mpbs down, but when they advertise 150 and I get 10-30 I am unsatisfied. I am aware that the Pi that I have is limited to ~100mbps on its Ethernet port (but seems to top out at 90) so when I get 90 I assume it is also higher and possibly up to 150.

Comcast has noticed and every time I tweet they will reply asking for my account number and address...usually hours after the speeds have returned to normal values. I have chosen not to provide them my account or address because I do not want to singled out as a customer; all their customers deserve the speeds they advertise, not just the ones who are able to call them out on their BS.

The Pi also runs a website server local to our network where with a graphing library I can [see the speeds over different periods of time](http://i.imgur.com/qdnnLzg.png).



EDIT: A lot of folks have pointed out that the results are possibly skewed by our own network usage. We do not torrent in our house; we use the network to mainly stream TV services and play PC and Xbone live games. I set the speedtest and graph portion of this up (without the tweeting part) earlier last year when the service was so constatly bad that Netflix wouldn't go above 480p and I would have >500ms latencies in CSGO. I service was constantly below 10mbps down. I only added the Twitter portion of it recently and yes, admittedly the service has been better.

Plenty of the drops were during hours when we were not home or everyone was asleep, and I  am able to download steam games or stream Netflix at 1080p and still have the speedtest registers its near its maximum of ~90mbps down, so when we gets speeds on the order of 10mpbs down and we are not heavily using the internet we know the problem is not on our end.

EDIT 2: People asked for the source code. PLEASE USE THE CLEANED UP CODE BELOW. I am by no means some fancy programmer so there is no need to point out that my code is ugly or could be better. http://pastebin.com/WMEh802V 

EDIT 3: Please consider using the code some folks put together to improve on mine (people who actually program.) One example: https://github.com/james-atkinson/speedcomplainer"
szy1pq,WATCH: NYPD Arrests Amazon Union Organizers at Staten Island Warehouse: The worker organizers were delivering lunch to Amazon warehouse associates during their break.,51269,0.89,2205,2022-02-24 07:00:28,technology,17123051,https://www.reddit.com/r/technology/comments/szy1pq/watch_nypd_arrests_amazon_union_organizers_at/,https://www.vice.com/en/article/3abjz3/watch-nypd-arrests-amazon-union-organizers-at-staten-island-warehouse,vice.com,0,21,,link,False,False,False,
wbrl24,U.S. Bank illegally used customer data to create sham accounts to inflate sales numbers for the last decade. Now they've been fined $37.5 million plus interest on unlawfully collected fees.,51249,0.95,1990,2022-07-30 12:46:18,technology,17123051,https://www.reddit.com/r/technology/comments/wbrl24/us_bank_illegally_used_customer_data_to_create/,https://www.businessinsider.com/us-bank-fined-375-million-for-illegally-using-customer-data-2022-7,businessinsider.com,0,13,,link,False,False,False,
x9tlda,"Brazil halts sales of charger-less iPhones, fines Apple $2.3 million",51127,0.92,2811,2022-09-09 17:29:00,technology,17123051,https://www.reddit.com/r/technology/comments/x9tlda/brazil_halts_sales_of_chargerless_iphones_fines/,https://arstechnica.com/gadgets/2022/09/brazil-halts-sales-of-charger-less-iphones-fines-apple-2-3-million/,arstechnica.com,0,8,,link,False,False,False,
68t1xl,"These 9 Senators proposed a bill to kill net neutrality called the ""Restoring Internet Freedom Act""",51120,0.89,3630,2017-05-02 18:47:15,technology,17123051,https://www.reddit.com/r/technology/comments/68t1xl/these_9_senators_proposed_a_bill_to_kill_net/,https://www.privateinternetaccess.com/blog/2017/05/9-senators-proposed-bill-kill-net-neutrality-called-restoring-internet-freedom-act/,privateinternetaccess.com,0,0,,link,False,False,False,
wqo29u,Does Mark Zuckerberg Not Understand How Bad His Metaverse Looks?,50971,0.9,5108,2022-08-17 18:14:54,technology,17123051,https://www.reddit.com/r/technology/comments/wqo29u/does_mark_zuckerberg_not_understand_how_bad_his/,https://www.forbes.com/sites/paultassi/2022/08/17/does-mark-zuckerberg-not-understand-how-bad-his-metaverse-looks/,forbes.com,0,13,,link,False,False,False,
p5hpfk,Afghanistan's All-Girls Robotics Team Tries to Escape Country,50949,0.92,1993,2021-08-16 20:26:47,technology,17123051,https://www.reddit.com/r/technology/comments/p5hpfk/afghanistans_allgirls_robotics_team_tries_to/,https://gizmodo.com/afghanistans-all-girls-robotics-team-desperate-to-escap-1847492243,gizmodo.com,0,12,,link,False,False,False,
lcc5dv,Two Google engineers resign over firing of AI ethics researcher Timnit Gebru,50874,0.89,2137,2021-02-04 15:03:18,technology,17123051,https://www.reddit.com/r/technology/comments/lcc5dv/two_google_engineers_resign_over_firing_of_ai/,https://www.reuters.com/article/us-alphabet-resignations/two-google-engineers-resign-over-firing-of-ai-ethics-researcher-timnit-gebru-idUSKBN2A4090,reuters.com,0,20,,link,False,False,False,
hm6cjb,WhatsApp stops processing police requests for Hong Kong users' data amid protests,50807,0.93,923,2020-07-06 17:31:04,technology,17123051,https://www.reddit.com/r/technology/comments/hm6cjb/whatsapp_stops_processing_police_requests_for/,https://www.independent.co.uk/life-style/gadgets-and-tech/news/hong-kong-whatsapp-data-privacy-protests-national-security-law-china-facebook-a9603661.html,independent.co.uk,0,6,,link,False,False,False,
6pgkd9,"Amazon jacked up Prime Day prices, misleading consumers, says vendor. We had an agreement that the suggested price of the product would be $9.99. On Amazon Prime Day the product was listed at $15.42 and then exed it out to put '$9.99 for Amazon Prime Day.'",50747,0.89,3104,2017-07-25 20:13:26,technology,17123051,https://www.reddit.com/r/technology/comments/6pgkd9/amazon_jacked_up_prime_day_prices_misleading/,http://www.foxbusiness.com/features/2017/07/24/amazon-jacked-up-prime-day-prices-misleading-consumers-says-vendor.html,foxbusiness.com,0,0,,link,False,False,False,
6iio0g,"Supreme Court Says You Can't Ban People From The Internet, No Matter What They've Done",50660,0.92,1859,2017-06-21 07:16:44,technology,17123051,https://www.reddit.com/r/technology/comments/6iio0g/supreme_court_says_you_cant_ban_people_from_the/,https://www.techdirt.com/articles/20170620/10455137631/supreme-court-says-you-cant-ban-people-internet-no-matter-what-theyve-done.shtml,techdirt.com,0,0,,link,False,False,False,
105ezdx,"A Professional Artist Spent 100 Hours Working On This Book Cover Image, Only To Be Accused Of Using AI",50584,0.87,4836,2023-01-07 09:21:55,technology,17123051,https://www.reddit.com/r/technology/comments/105ezdx/a_professional_artist_spent_100_hours_working_on/,https://www.buzzfeednews.com/article/chrisstokelwalker/art-subreddit-illustrator-ai-art-controversy,buzzfeednews.com,0,6,,link,False,,False,
7fat34,First Republican lawmaker to publicly oppose the FCC’s radical net neutrality repeal,50527,0.89,892,2017-11-25 03:45:34,technology,17123051,https://www.reddit.com/r/technology/comments/7fat34/first_republican_lawmaker_to_publicly_oppose_the/,https://www.fightforthefuture.org/news/2017-11-24-breaking-first-republican-lawmaker-to-publicly/,fightforthefuture.org,0,0,,link,False,False,False,
pbkxng,Reddit Moderators Demand The Platform Take Action Against Covid Disinformation,50419,0.73,636,2021-08-26 03:01:01,technology,17123051,https://www.reddit.com/r/technology/comments/pbkxng/reddit_moderators_demand_the_platform_take_action/,https://www.forbes.com/sites/carlieporterfield/2021/08/25/reddit-moderators-demand-the-platform-take-action-against-covid-disinformation/?sh=4fd86e2e73c8,forbes.com,0,9,,link,False,,False,
c9hzpi,"Netflix could lose almost a quarter of its subscribers if it started running ads, study shows",50380,0.92,3533,2019-07-05 22:02:05,technology,17123051,https://www.reddit.com/r/technology/comments/c9hzpi/netflix_could_lose_almost_a_quarter_of_its/,https://www.cnbc.com/2019/07/05/netflix-users-dont-want-ads-23percent-would-consider-canceling-report.html,cnbc.com,0,2,,link,False,False,False,
113ictt,Netflix’s desperate crackdown on password sharing shows it might fail like Blockbuster,50343,0.86,4235,2023-02-16 10:23:03,technology,17123051,https://www.reddit.com/r/technology/comments/113ictt/netflixs_desperate_crackdown_on_password_sharing/,https://www.theglobeandmail.com/business/commentary/article-netflix-crackdown-password-sharing-fail/,theglobeandmail.com,0,6,,link,False,False,False,
zla5lw,"Musk Shakes Up Twitter’s Legal Team as He Looks to Cut More Costs | Twitter has stopped paying rent on offices and is considering not paying severance packages to former employees, among other measures.",50227,0.85,5925,2022-12-14 04:39:27,technology,17123051,https://www.reddit.com/r/technology/comments/zla5lw/musk_shakes_up_twitters_legal_team_as_he_looks_to/,https://www.nytimes.com/2022/12/13/technology/elon-musk-twitter-shakeup.html,nytimes.com,0,14,,link,False,False,False,
sj2fj3,Facebook lost daily users for the first time ever last quarter,50144,0.94,2523,2022-02-03 04:18:08,technology,17123051,https://www.reddit.com/r/technology/comments/sj2fj3/facebook_lost_daily_users_for_the_first_time_ever/,https://www.theverge.com/2022/2/2/22914970/facebook-app-loses-daily-users-first-time-earnings,theverge.com,0,6,,link,False,False,False,
upf217,"Netflix to Employees: If You Don’t Like Our Content, You Can Quit",50129,0.87,4197,2022-05-14 16:42:20,technology,17123051,https://www.reddit.com/r/technology/comments/upf217/netflix_to_employees_if_you_dont_like_our_content/,https://www.wsj.com/articles/netflix-to-employees-if-you-dont-like-our-content-you-can-quit-11652478092,wsj.com,0,2,,link,False,False,False,
14mvcsm,Fidelity cuts Reddit valuation again,50109,0.93,3384,2023-06-30 14:44:34,technology,17123051,https://www.reddit.com/r/technology/comments/14mvcsm/fidelity_cuts_reddit_valuation_again/,https://techcrunch.com/2023/06/30/fidelity-deepens-valuation-cut-for-reddit-and-discord/,techcrunch.com,0,5,,link,False,False,False,
n6eybm,Biggest ISPs paid for 8.5 million fake FCC comments opposing net neutrality,50090,0.95,1435,2021-05-07 00:38:10,technology,17123051,https://www.reddit.com/r/technology/comments/n6eybm/biggest_isps_paid_for_85_million_fake_fcc/,https://arstechnica.com/tech-policy/2021/05/biggest-isps-paid-for-8-5-million-fake-fcc-comments-opposing-net-neutrality/,arstechnica.com,0,12,,link,False,False,False,
10cdg44,Wyoming wants to phase out sales of EVs by 2035 to “ensure the stability” of the oil & gas industry,50018,0.86,5963,2023-01-15 12:42:15,technology,17123051,https://www.reddit.com/r/technology/comments/10cdg44/wyoming_wants_to_phase_out_sales_of_evs_by_2035/,https://www.teslarati.com/wyoming-phase-out-evs-2035/,teslarati.com,0,34,,link,False,False,False,
2m6r7h,Columnists in the Wall Street Journal and TIME are publishing anti-Net Neutrality op-eds without disclosing that they're taking money from ISP's,49993,0.93,2220,2014-11-13 21:06:01,technology,17123051,https://www.reddit.com/r/technology/comments/2m6r7h/columnists_in_the_wall_street_journal_and_time/,http://www.dailydot.com/politics/anti-net-neutrality-op-eds-time-wall-street-journal/,dailydot.com,0,0,,link,False,False,False,
ww3of4,"Scanning students’ homes during remote testing is unconstitutional, judge says",49984,0.95,2455,2022-08-24 05:06:52,technology,17123051,https://www.reddit.com/r/technology/comments/ww3of4/scanning_students_homes_during_remote_testing_is/,https://arstechnica.com/tech-policy/2022/08/privacy-win-for-students-home-scans-during-remote-exams-deemed-unconstitutional/,arstechnica.com,0,26,,link,False,False,False,
jm1xib,Nearly 30 US states see renewables generate more power than either coal or nuclear,49963,0.87,2400,2020-11-01 18:37:19,technology,17123051,https://www.reddit.com/r/technology/comments/jm1xib/nearly_30_us_states_see_renewables_generate_more/,https://www.energylivenews.com/2020/10/30/nearly-30-us-states-see-renewables-generate-more-power-than-either-coal-or-nuclear/,energylivenews.com,0,7,,link,False,False,False,
14cljuq,Reddit CEO goes full dictator defiant as moderator strike shutters thousands of forums,49945,0.82,3656,2023-06-18 19:45:25,technology,17123051,https://www.reddit.com/r/technology/comments/14cljuq/reddit_ceo_goes_full_dictator_defiant_as/,https://fortune.com/2023/06/17/why-is-reddit-dark-subreddit-moderators-ceo-huffman-not-negotiating,fortune.com,0,7,,link,False,False,False,
w7mzk1,BMW’s heated seats as a service model has drivers seeking hacks,49842,0.93,4526,2022-07-25 17:24:27,technology,17123051,https://www.reddit.com/r/technology/comments/w7mzk1/bmws_heated_seats_as_a_service_model_has_drivers/,https://www.wired.com/story/bmw-heated-seats-as-a-service-model-has-drivers-seeking-hacks/,wired.com,0,9,,link,False,False,False,
12jo9qh,NPR to quit Twitter after being labelled ‘state-affiliated media’ | Radio network ‘officially de-emphasizing Twitter across the organization’ after platform refused to remove ‘inaccurate’ label,49837,0.88,5401,2023-04-12 20:09:05,technology,17123051,https://www.reddit.com/r/technology/comments/12jo9qh/npr_to_quit_twitter_after_being_labelled/,https://www.theguardian.com/media/2023/apr/12/npr-leaves-twitter-elon-musk-state-media,theguardian.com,0,11,,link,False,False,False,
4k86mu,"Fox dowloaded a game clip from YouTube, used it in Family Guy and DCMA'd the original.",49791,0.92,2897,2016-05-20 18:46:49,technology,17123051,https://www.reddit.com/r/technology/comments/4k86mu/fox_dowloaded_a_game_clip_from_youtube_used_it_in/,https://torrentfreak.com/fox-stole-a-game-clip-used-it-in-family-guy-dmcad-the-original-160520/,torrentfreak.com,0,0,,link,False,False,False,
hfllcb,Boston votes to ban government use of facial recognition,49775,0.95,755,2020-06-25 18:25:19,technology,17123051,https://www.reddit.com/r/technology/comments/hfllcb/boston_votes_to_ban_government_use_of_facial/,https://www.cnet.com/news/boston-votes-to-ban-government-use-of-facial-recognition/,cnet.com,0,8,,link,False,False,False,
zucyg6,TikTok admits to spying on U.S. users as effort to ban the app heats up,49765,0.91,2482,2022-12-24 21:46:22,technology,17123051,https://www.reddit.com/r/technology/comments/zucyg6/tiktok_admits_to_spying_on_us_users_as_effort_to/,https://mashable.com/article/tiktok-spying-internal-report-us-users,mashable.com,0,9,,link,False,False,False,
7h58cv,A New Bill Wants Jail Time for Execs Who Hide Data Breaches,49709,0.94,604,2017-12-03 02:29:06,technology,17123051,https://www.reddit.com/r/technology/comments/7h58cv/a_new_bill_wants_jail_time_for_execs_who_hide/,https://www.wired.com/story/a-new-bill-wants-jail-time-for-execs-who-hide-data-breaches/,wired.com,0,1,,link,False,False,False,
5w3whj,It Begins: Trump’s FCC Launches Attack on Net Neutrality Transparency Rules,49655,0.79,2997,2017-02-25 18:12:31,technology,17123051,https://www.reddit.com/r/technology/comments/5w3whj/it_begins_trumps_fcc_launches_attack_on_net/,https://motherboard.vice.com/en_us/article/it-begins-trumps-fcc-launches-attack-on-net-neutrality-transparency-rules,motherboard.vice.com,0,0,,link,False,False,False,
jpb7up,"SF imposes new tax on firms that pay CEOs 100X more than median workers — businesses can either pay tax, reduce top executive salary, or pay workers more",49653,0.91,2090,2020-11-07 00:37:20,technology,17123051,https://www.reddit.com/r/technology/comments/jpb7up/sf_imposes_new_tax_on_firms_that_pay_ceos_100x/,https://arstechnica.com/tech-policy/2020/11/overpaid-executive-tax-in-sf-hits-firms-that-pay-ceos-100x-more-than-workers/,arstechnica.com,0,9,,link,False,False,False,
a5hk0m,Last-Minute Push to Restore Net Neutrality Stymied by Democrats Flush With Telecom Cash.,49641,0.76,3013,2018-12-12 17:35:22,technology,17123051,https://www.reddit.com/r/technology/comments/a5hk0m/lastminute_push_to_restore_net_neutrality_stymied/,https://gizmodo.com/last-minute-push-to-restore-net-neutrality-stymied-by-d-1831023390,gizmodo.com,0,8,,link,False,False,False,
i5o08y,"Facebook repeatedly overruled fact checkers in favor of conservatives | Officials thought punishing conservatives would be a ""PR risk.""",49614,0.82,1210,2020-08-08 04:22:26,technology,17123051,https://www.reddit.com/r/technology/comments/i5o08y/facebook_repeatedly_overruled_fact_checkers_in/,https://www.engadget.com/facebook-overruled-fact-checkers-to-protect-conservatives-220229959.html,engadget.com,0,10,,link,False,False,False,
4vn52b,"Washington state to sue Comcast for $100M. A news release says the lawsuit accuses Comcast of ""engaging in a pattern of deceptive practices.""",49613,0.92,1831,2016-08-01 21:17:32,technology,17123051,https://www.reddit.com/r/technology/comments/4vn52b/washington_state_to_sue_comcast_for_100m_a_news/,http://komonews.com/news/local/washington-state-to-sue-comcast-for-100m,komonews.com,0,0,,link,False,False,False,
ze6ke8,Meta has threatened to pull all news from Facebook in the US if an 'ill-considered' bill that would compel it to pay publishers passes,49560,0.89,5287,2022-12-06 18:47:13,technology,17123051,https://www.reddit.com/r/technology/comments/ze6ke8/meta_has_threatened_to_pull_all_news_from/,https://www.businessinsider.com/facebook-may-axe-news-us-ill-considered-media-bill-passes-2022-12,businessinsider.com,0,10,,link,False,False,False,
vekp1h,Leaked Amazon memo warns the company is running out of people to hire,49553,0.93,4055,2022-06-17 22:30:58,technology,17123051,https://www.reddit.com/r/technology/comments/vekp1h/leaked_amazon_memo_warns_the_company_is_running/,https://www.vox.com/recode/23170900/leaked-amazon-memo-warehouses-hiring-shortage,vox.com,0,16,,link,False,False,False,
k9hkkk,COVID-19 data whistleblower could face up to 5 years in prison if charged with cybercrime,49542,0.89,3932,2020-12-09 06:38:38,technology,17123051,https://www.reddit.com/r/technology/comments/k9hkkk/covid19_data_whistleblower_could_face_up_to_5/,https://www.sun-sentinel.com/news/politics/fl-ne-rebekah-jones-raid-folo-20201209-wrmbt4r62rcnff5wr3kwogt24e-story.html,sun-sentinel.com,0,4,,link,False,False,False,
yof617,Elon Musk’s response to fake verified Elon Twitter accounts: a new permanent ban policy for impersonation,49541,0.87,5322,2022-11-07 12:17:30,technology,17123051,https://www.reddit.com/r/technology/comments/yof617/elon_musks_response_to_fake_verified_elon_twitter/,https://www.theverge.com/2022/11/6/23443871/elon-musk-twitter-permaban-impersonation-parody,theverge.com,0,8,,link,False,False,False,
iv4fob,TikTok to be banned from US app stores from. Sunday,49503,0.92,4842,2020-09-18 17:09:04,technology,17123051,https://www.reddit.com/r/technology/comments/iv4fob/tiktok_to_be_banned_from_us_app_stores_from_sunday/,https://on.ft.com/3iIZTpM,on.ft.com,0,7,,link,False,False,False,
te4com,Microsoft is testing ads in the Windows 11 File Explorer,49399,0.86,8368,2022-03-15 00:04:07,technology,17123051,https://www.reddit.com/r/technology/comments/te4com/microsoft_is_testing_ads_in_the_windows_11_file/,https://www.bleepingcomputer.com/news/microsoft/microsoft-is-testing-ads-in-the-windows-11-file-explorer/,bleepingcomputer.com,0,23,,link,False,False,False,
t7mgjx,Twitter bans more than 100 accounts using the hashtag #IStandWithPutin for violating the platform's 'manipulation and spam policy',49306,0.87,1759,2022-03-06 05:39:35,technology,17123051,https://www.reddit.com/r/technology/comments/t7mgjx/twitter_bans_more_than_100_accounts_using_the/,https://www.businessinsider.com/twitter-bans-accounts-using-istandwithputin-for-violating-spam-policy-2022-3,businessinsider.com,0,4,,link,False,,False,
t0pxzd,"Russian attempts to 'weaponise' energy may fast-track Europe's shift to renewables, after initial pain",49288,0.92,1647,2022-02-25 05:59:52,technology,17123051,https://www.reddit.com/r/technology/comments/t0pxzd/russian_attempts_to_weaponise_energy_may/,https://www.abc.net.au/news/2022-02-25/russia-invasion-of-ukraine-europe-renewable-energy/100858538,abc.net.au,0,7,,link,False,False,False,
apcmtf,Reddit Users Rally Against Chinese Censorship After the Site Receives a $150 Million Reported Investment,49230,0.81,2294,2019-02-11 10:12:39,technology,17123051,https://www.reddit.com/r/technology/comments/apcmtf/reddit_users_rally_against_chinese_censorship/,http://time.com/5526128/china-reddit-tencent-censorship/,time.com,0,5,,link,False,False,False,
108jpyl,Moderna CEO: 400% price hike on COVID vaccine “consistent with the value”,49223,0.86,5802,2023-01-11 01:47:17,technology,17123051,https://www.reddit.com/r/technology/comments/108jpyl/moderna_ceo_400_price_hike_on_covid_vaccine/,https://arstechnica.com/science/2023/01/moderna-may-match-pfizers-400-price-hike-on-covid-vaccines-report-says/,arstechnica.com,0,27,,link,False,False,False,
fhe39k,A sneaky attempt to end encryption is worming its way through Congress,49163,0.95,2275,2020-03-12 15:44:22,technology,17123051,https://www.reddit.com/r/technology/comments/fhe39k/a_sneaky_attempt_to_end_encryption_is_worming_its/,https://www.theverge.com/interface/2020/3/12/21174815/earn-it-act-encryption-killer-lindsay-graham-match-group,theverge.com,0,16,,link,False,False,False,
123nfrx,"There's a 90% chance TikTok will be banned in the US unless it goes through with an IPO or gets bought out by mega-cap tech, Wedbush says",49107,0.89,5484,2023-03-27 19:18:22,technology,17123051,https://www.reddit.com/r/technology/comments/123nfrx/theres_a_90_chance_tiktok_will_be_banned_in_the/,https://markets.businessinsider.com/news/stocks/tiktok-ban-us-without-ipo-mega-cap-tech-acquisition-wedbush-2023-3,markets.businessinsider.com,0,13,,link,False,False,False,
uug6o2,Tesla Asking Owners to Limit Charging During Texas Heatwave Isn’t a Good Sign,49070,0.87,5817,2022-05-21 10:36:53,technology,17123051,https://www.reddit.com/r/technology/comments/uug6o2/tesla_asking_owners_to_limit_charging_during/,https://www.thedrive.com/news/tesla-asks-texan-owners-to-limit-charging-due-to-heat-wave,thedrive.com,0,15,,link,False,False,False,
7pavzc,GOP senator says she’ll vote to restore net neutrality rules,48947,0.85,1399,2018-01-10 04:00:50,technology,17123051,https://www.reddit.com/r/technology/comments/7pavzc/gop_senator_says_shell_vote_to_restore_net/,https://arstechnica.com/tech-policy/2018/01/gop-senator-says-shell-vote-to-restore-net-neutrality-rules/,arstechnica.com,0,1,,link,False,False,False,
f12a6y,The 2020 Election Will Be a War of Disinformation,48896,0.87,2796,2020-02-09 08:11:42,technology,17123051,https://www.reddit.com/r/technology/comments/f12a6y/the_2020_election_will_be_a_war_of_disinformation/,https://www.theatlantic.com/magazine/archive/2020/03/the-2020-disinformation-war/605530/,theatlantic.com,0,4,,link,False,False,False,
