id,title,score,upvote_ratio,num_comments,created_utc,subreddit,subscribers,permalink,url,domain,num_awards,num_crossposts,crosspost_subreddits,post_type,is_nsfw,is_bot,is_megathread,body
9fvghy,"Almost half of US cellphone calls will be scams by next year, says report",42993,0.94,2912,2018-09-15 01:50:55,technology,17123051,https://www.reddit.com/r/technology/comments/9fvghy/almost_half_of_us_cellphone_calls_will_be_scams/,https://www.cnet.com/news/almost-half-of-us-cell-phone-calls-will-be-scams-by-next-year-says-report/,cnet.com,0,6,,link,False,False,False,
53js67,Hillary Clinton IT Paul Combetta Asked How To Destroy Evidence On Reddit,42981,0.72,4208,2016-09-20 02:29:20,technology,17123051,https://www.reddit.com/r/technology/comments/53js67/hillary_clinton_it_paul_combetta_asked_how_to/,http://regated.com/2016/09/paul-combetta-asking-destroy-evidence/,regated.com,0,0,,link,False,False,False,
6oo9mc,Senator Doesn't Buy FCC Justification for Killing Net Neutrality,42923,0.9,1958,2017-07-21 20:01:51,technology,17123051,https://www.reddit.com/r/technology/comments/6oo9mc/senator_doesnt_buy_fcc_justification_for_killing/,http://www.dslreports.com/shownews/Senator-Doesnt-Buy-FCC-Justification-for-Killing-Net-Neutrality-139993,dslreports.com,0,0,,link,False,False,False,
rplbb4,Moderator Who Watched Hours of Traumatic Videos Sues TikTok for Failing to Protect Her Mental Health,42891,0.88,2749,2021-12-27 16:44:38,technology,17123051,https://www.reddit.com/r/technology/comments/rplbb4/moderator_who_watched_hours_of_traumatic_videos/,https://gizmodo.com/moderator-who-watched-hours-of-traumatic-videos-sues-ti-1848272748,gizmodo.com,0,9,,link,False,False,False,
sgak9a,T-Mobile will fire unvaccinated corporate employees starting April 2nd,42883,0.78,1607,2022-01-30 20:11:30,technology,17123051,https://www.reddit.com/r/technology/comments/sgak9a/tmobile_will_fire_unvaccinated_corporate/,https://www.engadget.com/t-mobile-vaccine-mandate-224438946.html,engadget.com,0,1,,link,False,False,False,
jml79j,Students Are Rebelling Against Eye-Tracking Exam Surveillance Technology,42875,0.94,2466,2020-11-02 16:06:44,technology,17123051,https://www.reddit.com/r/technology/comments/jml79j/students_are_rebelling_against_eyetracking_exam/,https://www.vice.com/en/article/n7wxvd/students-are-rebelling-against-eye-tracking-exam-surveillance-tools,vice.com,0,7,,link,False,False,False,
7fxy2o,Comcast quietly drops promise not to charge tolls for Internet fast lanes,42848,0.91,965,2017-11-28 01:28:45,technology,17123051,https://www.reddit.com/r/technology/comments/7fxy2o/comcast_quietly_drops_promise_not_to_charge_tolls/,https://arstechnica.com/tech-policy/2017/11/comcast-quietly-drops-promise-not-to-charge-tolls-for-internet-fast-lanes/,arstechnica.com,0,0,politics,link,False,False,False,
at4me2,"Trump calls for 6G cellular technology, because why the heck not",42771,0.81,3687,2019-02-21 21:18:56,technology,17123051,https://www.reddit.com/r/technology/comments/at4me2/trump_calls_for_6g_cellular_technology_because/,https://techcrunch.com/2019/02/21/trump-calls-for-6g-cellular-technology-because-why-the-heck-not/,techcrunch.com,0,5,,link,False,False,False,
ffu19n,"Australia sues Facebook over Cambridge Analytica, fine could scale to $529BN – TechCrunch",42732,0.94,1607,2020-03-09 18:09:55,technology,17123051,https://www.reddit.com/r/technology/comments/ffu19n/australia_sues_facebook_over_cambridge_analytica/,https://techcrunch.com/2020/03/09/australia-sues-facebook-over-cambridge-analytica-fine-could-scale-to-529bn/,techcrunch.com,0,3,,link,False,,False,
k0bt1m,"YouTube temporarily suspends, demonetizes OANN",42697,0.87,2148,2020-11-25 00:54:33,technology,17123051,https://www.reddit.com/r/technology/comments/k0bt1m/youtube_temporarily_suspends_demonetizes_oann/,https://www.axios.com/youtube-temporarily-suspends-demonetizes-oann-420e8ea9-66c1-4eab-9754-6e3b708483c9.html,axios.com,0,5,,link,False,False,False,
nsduah,Bing Censors Image Search for 'Tank Man' Even in US,42698,0.91,1417,2021-06-05 01:21:47,technology,17123051,https://www.reddit.com/r/technology/comments/nsduah/bing_censors_image_search_for_tank_man_even_in_us/,https://www.vice.com/en/article/qj8v9m/bing-censors-tank-man,vice.com,0,4,,link,False,False,False,
9l7jpe,"'Siri, I'm getting pulled over': a new shortcut for iPhones can automatically record the police",42687,0.82,1647,2018-10-04 07:13:36,technology,17123051,https://www.reddit.com/r/technology/comments/9l7jpe/siri_im_getting_pulled_over_a_new_shortcut_for/,https://www.businessinsider.com/ios-12-shortcut-uses-iphone-to-record-police-during-traffic-stop-2018-10,businessinsider.com,0,14,,link,False,False,False,
a6u3lb,New report shows Russia used every major social media tool to help Trump.,42645,0.68,2681,2018-12-17 04:55:12,technology,17123051,https://www.reddit.com/r/technology/comments/a6u3lb/new_report_shows_russia_used_every_major_social/,https://www.theage.com.au/world/north-america/new-report-shows-russia-used-every-major-social-media-tool-to-help-trump-20181217-p50mn8.html,theage.com.au,0,5,,link,False,False,False,
fwcdt4,"A second potential COVID-19 vaccine, backed by Bill and Melinda Gates, is entering human testing",42616,0.9,2398,2020-04-07 08:05:12,technology,17123051,https://www.reddit.com/r/technology/comments/fwcdt4/a_second_potential_covid19_vaccine_backed_by_bill/,https://techcrunch.com/2020/04/06/a-second-potential-covid-19-vaccine-backed-by-bill-and-melinda-gates-is-entering-human-testing/,techcrunch.com,0,12,,link,False,False,False,
13cpogh,AI cameras are being set up on highways to catch drivers who throw trash out of their car windows,42601,0.9,2601,2023-05-09 18:50:04,technology,17123051,https://www.reddit.com/r/technology/comments/13cpogh/ai_cameras_are_being_set_up_on_highways_to_catch/,https://www.businessinsider.com/ai-cameras-highways-stop-trash-thrown-2023-5,businessinsider.com,0,5,,link,False,False,False,
671opo,Bose headphones spy on listeners and sell personally identifiable information to third parties without permission: Lawsuit,42591,0.83,2106,2017-04-23 16:31:42,technology,17123051,https://www.reddit.com/r/technology/comments/671opo/bose_headphones_spy_on_listeners_and_sell/,http://www.ndtv.com/world-news/bose-headphones-spy-on-listeners-lawsuit-1683707,ndtv.com,0,0,,link,False,False,False,
mt3dn3,Founder of Adobe and developer of PDFs dies at age 81,42582,0.94,1165,2021-04-18 06:52:19,technology,17123051,https://www.reddit.com/r/technology/comments/mt3dn3/founder_of_adobe_and_developer_of_pdfs_dies_at/,https://apnews.com/article/business-john-warnock-san-francisco-b77f216f52d736a6b5a383a429208f51,apnews.com,0,5,,link,False,False,False,
wvvye7,"Amazon denied a worker's death was caused by heat in the warehouse, but it's since installed new AC and more fans, report says",42550,0.91,1469,2022-08-23 23:48:32,technology,17123051,https://www.reddit.com/r/technology/comments/wvvye7/amazon_denied_a_workers_death_was_caused_by_heat/,https://www.businessinsider.com/amazon-installs-ac-in-warehouse-after-worker-death-report-2022-8,businessinsider.com,0,7,,link,False,False,False,
saseea,Some Starlink customers say SpaceX's customer service is 'non-existent' nearly 1 year after paying a $100 deposit and receiving no updates,42528,0.87,3979,2022-01-23 17:44:17,technology,17123051,https://www.reddit.com/r/technology/comments/saseea/some_starlink_customers_say_spacexs_customer/,https://www.businessinsider.com/spacex-starlink-customer-service-non-existent-satellite-internet-deposit-contact-2022-1,businessinsider.com,0,9,,link,False,False,False,
orz7ef,"Facebook is letting religious groups charge users $9.99 per month for exclusive content, such as messages from their bishop",42486,0.82,2800,2021-07-26 19:25:42,technology,17123051,https://www.reddit.com/r/technology/comments/orz7ef/facebook_is_letting_religious_groups_charge_users/,https://www.businessinsider.com/facebook-sheryl-sandberg-courts-religious-groups-monetization-tools-2021-7,businessinsider.com,0,19,,link,False,,False,
pweh4n,Amazon Has to Disclose How Its Algorithms Judge Workers Per a New California Law,42474,0.94,1257,2021-09-27 16:17:36,technology,17123051,https://www.reddit.com/r/technology/comments/pweh4n/amazon_has_to_disclose_how_its_algorithms_judge/,https://interestingengineering.com/amazon-has-to-disclose-how-its-algorithms-judge-workers-per-a-new-california-law,interestingengineering.com,0,9,,link,False,False,False,
uprs67,Texas power grid operator asks customers to conserve electricity after six plants go offline,42456,0.92,3853,2022-05-15 03:48:50,technology,17123051,https://www.reddit.com/r/technology/comments/uprs67/texas_power_grid_operator_asks_customers_to/,https://www.nbcnews.com/news/us-news/texas-power-grid-operator-asks-customers-conserve-electricity-six-plan-rcna28849,nbcnews.com,0,11,,link,False,False,False,
yrnjii,"Musk bans remote work at Twitter, warns staff of “dire” economic outlook",42389,0.88,4837,2022-11-10 23:56:46,technology,17123051,https://www.reddit.com/r/technology/comments/yrnjii/musk_bans_remote_work_at_twitter_warns_staff_of/,https://arstechnica.com/tech-policy/2022/11/musk-bans-remote-work-at-twitter-warns-staff-of-dire-economic-outlook/,arstechnica.com,0,6,,link,False,False,False,
dqx7uh,Microsoft Japan's experiment with 3-day weekend boosts worker productivity by 40 percent,42337,0.95,1279,2019-11-03 12:52:10,technology,17123051,https://www.reddit.com/r/technology/comments/dqx7uh/microsoft_japans_experiment_with_3day_weekend/,https://soranews24.com/2019/11/03/microsoft-japans-experiment-with-3-day-weekend-boosts-worker-productivity-by-40-percent/,soranews24.com,0,6,,link,False,False,False,
jw9gnc,The Trump 2020 campaign's cell phone app gathered its supporters' intimate data - and even tracked their location,42292,0.87,1432,2020-11-18 10:18:44,technology,17123051,https://www.reddit.com/r/technology/comments/jw9gnc/the_trump_2020_campaigns_cell_phone_app_gathered/,https://apnews.com/article/124d914bb082575aeec8042629aa932c,apnews.com,0,11,,link,False,False,False,
7re4rv,Apple has a change of heart and approves an app that finds net neutrality violations,42284,0.86,976,2018-01-19 05:19:56,technology,17123051,https://www.reddit.com/r/technology/comments/7re4rv/apple_has_a_change_of_heart_and_approves_an_app/,https://www.phonearena.com/news/Apple-rejects-app-that-finds-net-neutrality-violations_id101750,phonearena.com,0,2,,link,False,False,False,
xpfajx,Girls Who Code founder speaks out after Pennsylvania school district bans her books: 'This is about controlling women and it starts with controlling our girls',42271,0.79,2053,2022-09-27 17:52:24,technology,17123051,https://www.reddit.com/r/technology/comments/xpfajx/girls_who_code_founder_speaks_out_after/,https://www.businessinsider.com/girls-who-code-founder-speaks-out-banning-books-schools-2022-9,businessinsider.com,0,0,politics,link,False,False,False,
9cl7z0,France has banned all children under 15 from using their phones in school,42271,0.9,2523,2018-09-03 18:20:29,technology,17123051,https://www.reddit.com/r/technology/comments/9cl7z0/france_has_banned_all_children_under_15_from/,https://www.businessinsider.com/france-bans-children-using-phones-at-school-2018-9/,businessinsider.com,0,6,,link,False,,False,
utr061,"Microsoft reportedly censors searches for politically sensitive Chinese personalities | The censorship even applies to searches in the US and Canada, researchers say.",42264,0.92,1370,2022-05-20 15:47:18,technology,17123051,https://www.reddit.com/r/technology/comments/utr061/microsoft_reportedly_censors_searches_for/,https://www.engadget.com/microsoft-censors-searches-politically-sensitive-chinese-names-060509232.html,engadget.com,0,9,,link,False,False,False,
1cwsv4o,Scarlett Johansson Says She Declined ChatGPT's Proposal to Use Her Voice for AI – But They Used It Anyway: 'I Was Shocked',42239,0.91,2378,2024-05-21 04:20:55,technology,17123051,https://www.reddit.com/r/technology/comments/1cwsv4o/scarlett_johansson_says_she_declined_chatgpts/,https://www.thewrap.com/scarlett-johansson-chatgpt-sky-voice-sam-altman-open-ai/,thewrap.com,0,1,,link,False,False,False,
ol4mk9,Apple employees threaten to quit as company takes hard line stance on remote work,42225,0.92,5634,2021-07-16 05:00:37,technology,17123051,https://www.reddit.com/r/technology/comments/ol4mk9/apple_employees_threaten_to_quit_as_company_takes/,https://appleinsider.com/articles/21/07/15/apple-employees-threaten-to-quit-as-company-takes-hard-line-stance-on-remote-work,appleinsider.com,0,7,,link,False,False,False,
fm475i,‘We’re all going to get sick eventually’: Amazon workers are struggling to provide for a nation in quarantine,42231,0.93,1905,2020-03-21 04:03:24,technology,17123051,https://www.reddit.com/r/technology/comments/fm475i/were_all_going_to_get_sick_eventually_amazon/,https://www.theverge.com/2020/3/20/21188292/amazon-workers-coronavirus-essential-service-risk,theverge.com,0,4,,link,False,False,False,
8wdzxu,California's Net Neutrality Bill Is Strong Again Because You Spoke Out,42217,0.87,620,2018-07-06 02:20:13,technology,17123051,https://www.reddit.com/r/technology/comments/8wdzxu/californias_net_neutrality_bill_is_strong_again/,https://www.eff.org/deeplinks/2018/07/californias-net-neutrality-bill-strong-again-because-you-spoke-out,eff.org,0,5,,link,False,False,False,
86r7t7,How To Permanently Delete A Facebook Account,42180,0.9,1791,2018-03-24 11:18:43,technology,17123051,https://www.reddit.com/r/technology/comments/86r7t7/how_to_permanently_delete_a_facebook_account/,https://deletefacebook.com/,deletefacebook.com,0,9,,link,False,False,False,
tgdjsm,Apple Made an Additional $6.5 Billion USD by No Longer Providing Accessories With New iPhones,42137,0.84,2669,2022-03-17 21:32:35,technology,17123051,https://www.reddit.com/r/technology/comments/tgdjsm/apple_made_an_additional_65_billion_usd_by_no/,https://hypebeast.com/2022/3/apple-made-6-5-billion-usd-by-removing-accessories-with-new-iphone-purchases?utm_source=instagram&utm_medium=social&utm_campaign=ig_bio,hypebeast.com,0,3,,link,False,False,False,
1f7kwup,Facebook partner admits smartphone microphones listen to people talk to serve better ads,42136,0.89,3470,2024-09-03 04:43:25,technology,17123051,https://www.reddit.com/r/technology/comments/1f7kwup/facebook_partner_admits_smartphone_microphones/,https://www.tweaktown.com/news/100282/facebook-partner-admits-smartphone-microphones-listen-to-people-talk-serve-better-ads/index.html,tweaktown.com,0,15,,link,False,False,False,
2d77d0,Comcast Tells Customer The Only Reason He’s Getting Bogus Charges Refunded Is Because He Recorded Call,42129,0.94,2302,2014-08-11 08:23:15,technology,17123051,https://www.reddit.com/r/technology/comments/2d77d0/comcast_tells_customer_the_only_reason_hes/,http://consumerist.com/2014/08/10/comcast-tells-customer-the-only-reason-hes-getting-bogus-charges-refunded-is-because-he-recorded-call/,consumerist.com,0,0,,link,False,False,False,
o7cxt0,Hacker reveals smart meters are spilling secrets about the Texas snowstorm: Power companies won't disclose who was protected from blackouts—but smart meters may be leaking insights.,42057,0.95,1705,2021-06-25 06:16:07,technology,17123051,https://www.reddit.com/r/technology/comments/o7cxt0/hacker_reveals_smart_meters_are_spilling_secrets/,https://www.dailydot.com/debug/hacker-smart-meter-texas-snowstorm/,dailydot.com,0,16,,link,False,False,False,
jd02ww,Oracle CEO donated $250K to Graham Super PAC days before TikTok deal went through: report,42039,0.91,1535,2020-10-17 23:41:10,technology,17123051,https://www.reddit.com/r/technology/comments/jd02ww/oracle_ceo_donated_250k_to_graham_super_pac_days/,https://thehill.com/homenews/521538-oracle-ceo-donated-250k-to-graham-super-pac-days-before-tiktok-deal-went-through,thehill.com,0,6,,link,False,,False,
fi9dhf,"Trump announcement of Google coronavirus website shocks many, including Google",42018,0.88,2475,2020-03-14 05:21:13,technology,17123051,https://www.reddit.com/r/technology/comments/fi9dhf/trump_announcement_of_google_coronavirus_website/,https://www.protocol.com/trump-google-coronavirus-website-surprise,protocol.com,0,6,,link,False,False,False,
kc6w4z,Pornhub to ban unverified uploads after child abuse content claims,42019,0.92,3066,2020-12-13 13:32:29,technology,17123051,https://www.reddit.com/r/technology/comments/kc6w4z/pornhub_to_ban_unverified_uploads_after_child/,https://www.theguardian.com/global-development/2020/dec/10/pornhub-to-ban-unverified-uploads-after-child-abuse-content-claims,theguardian.com,0,7,,link,False,,False,
cb3g8b,"Trump Can’t Block Critics From His Twitter Account, Appeals Court Rules",41992,0.84,3821,2019-07-09 22:22:44,technology,17123051,https://www.reddit.com/r/technology/comments/cb3g8b/trump_cant_block_critics_from_his_twitter_account/,https://www.nytimes.com/2019/07/09/us/politics/trump-twitter-first-amendment.html?smid=nytcore-ios-share,nytimes.com,0,6,,link,False,False,False,
8rqe2g,"US court confirms danger posed by 'sound cannons'. ""The problem posed by protesters in the street did not justify the use of force, much less force capable of causing serious injury, such as hearing loss,"" the court said in its ruling.",41980,0.91,2610,2018-06-17 16:45:47,technology,17123051,https://www.reddit.com/r/technology/comments/8rqe2g/us_court_confirms_danger_posed_by_sound_cannons/,https://phys.org/news/2018-06-court-danger-posed-cannons.html,phys.org,0,2,,link,False,False,False,
l4cf2u,Acting FCC Chair Jessica Rosenworcel could save net neutrality,41961,0.89,1449,2021-01-25 06:40:42,technology,17123051,https://www.reddit.com/r/technology/comments/l4cf2u/acting_fcc_chair_jessica_rosenworcel_could_save/,https://appleinsider.com/articles/21/01/24/acting-fcc-chair-jessica-rosenworcel-could-save-net-neutrality,appleinsider.com,0,2,,link,False,False,False,
hbsqrq,Twitter flags Trump tweet featuring fake CNN chyron as 'manipulated media,41913,0.87,2439,2020-06-19 08:25:52,technology,17123051,https://www.reddit.com/r/technology/comments/hbsqrq/twitter_flags_trump_tweet_featuring_fake_cnn/,https://thehill.com/policy/technology/503514-twitter-flags-trump-tweet-featuring-fake-cnn-chyron-as-manipulated-media,thehill.com,0,2,,link,False,False,False,
861rcu,Facebook Just Lost More Than Tesla's Entire Market Cap in Two Days,41889,0.87,1595,2018-03-21 18:12:12,technology,17123051,https://www.reddit.com/r/technology/comments/861rcu/facebook_just_lost_more_than_teslas_entire_market/,https://www.bloomberg.com/news/articles/2018-03-20/facebook-sees-tesla-sized-chunk-vanish-from-market-cap-in-2-days,bloomberg.com,0,2,,link,False,False,False,
12dkshc,Outrage over white-only job ad drives tech firm to delete website,41877,0.88,2727,2023-04-06 19:13:01,technology,17123051,https://www.reddit.com/r/technology/comments/12dkshc/outrage_over_whiteonly_job_ad_drives_tech_firm_to/,https://arstechnica.com/tech-policy/2023/04/tech-firm-posts-white-only-job-ad-then-deletes-website-amid-ensuing-outrage/,arstechnica.com,0,8,,link,False,False,False,
be9nzn,"Alexandria Ocasio-Cortez quits Facebook, says social media is a health risk",41879,0.78,1880,2019-04-17 21:43:11,technology,17123051,https://www.reddit.com/r/technology/comments/be9nzn/alexandria_ocasiocortez_quits_facebook_says/,https://www.cnet.com/news/alexandria-ocasio-cortez-dumps-facebook/,cnet.com,0,4,,link,False,False,False,
ayqmp0,"Elizabeth Warren's new plan: Break up Amazon, Google and Facebook",41828,0.7,6363,2019-03-08 19:35:18,technology,17123051,https://www.reddit.com/r/technology/comments/ayqmp0/elizabeth_warrens_new_plan_break_up_amazon_google/,https://www-m.cnn.com/2019/03/08/politics/elizabeth-warren-amazon-google-facebook/index.html,www-m.cnn.com,0,7,,link,False,False,False,
wt52sr,"Mark Zuckerberg unveils new, boyish metaverse avatar after getting mocked for creepy, dead-eyed version",41824,0.84,4499,2022-08-20 17:12:29,technology,17123051,https://www.reddit.com/r/technology/comments/wt52sr/mark_zuckerberg_unveils_new_boyish_metaverse/,https://www.businessinsider.com/mark-zuckerberg-unveils-new-boyish-avatar-days-after-dead-eyed-2022-8?utm_source=feedly&utm_medium=webfeeds,businessinsider.com,0,12,,link,False,False,False,
nfqijv,"Bill Gates crafted a public image as a likable, nerdy do-gooder. Office affairs, 'uncomfortable' workplace behavior, and Epstein ties reveal cracks in his facade.",41819,0.67,3182,2021-05-19 05:39:36,technology,17123051,https://www.reddit.com/r/technology/comments/nfqijv/bill_gates_crafted_a_public_image_as_a_likable/,https://www.businessinsider.com/bill-gates-image-likable-nerdy-philanthropist-fell-apart-2021-5,businessinsider.com,0,16,,link,False,False,False,
m81rbs,Facebook promised to ban anti-vaxxers. The pages are still up and now they're selling t-shirts,41809,0.85,1641,2021-03-19 03:24:55,technology,17123051,https://www.reddit.com/r/technology/comments/m81rbs/facebook_promised_to_ban_antivaxxers_the_pages/,https://www.abc.net.au/news/science/2021-03-19/facebook-misinformation-covid-19-coronavirus-anti-vaccine/100015890,abc.net.au,0,10,,link,False,False,False,
gxxr9o,Facebook removes hate group accounts that urged people to attend protests with guns,41804,0.85,2362,2020-06-07 01:20:10,technology,17123051,https://www.reddit.com/r/technology/comments/gxxr9o/facebook_removes_hate_group_accounts_that_urged/,https://thehill.com/policy/technology/501487-facebook-removes-hate-group-accounts-that-urged-people-to-attend-protests,thehill.com,0,4,,link,False,False,False,
9kbe2j,Gov. Brown signs California Net Neutrality Bill SB 822,41804,0.89,1808,2018-10-01 05:37:38,technology,17123051,https://www.reddit.com/r/technology/comments/9kbe2j/gov_brown_signs_california_net_neutrality_bill_sb/,https://www.gov.ca.gov/2018/09/30/governor-brown-issues-legislative-update-22/,gov.ca.gov,0,4,,link,False,False,False,
iaqa9e,Facebook algorithm found to 'actively promote' Holocaust denial,41793,0.9,1452,2020-08-16 16:12:45,technology,17123051,https://www.reddit.com/r/technology/comments/iaqa9e/facebook_algorithm_found_to_actively_promote/,https://www.theguardian.com/world/2020/aug/16/facebook-algorithm-found-to-actively-promote-holocaust-denial,theguardian.com,0,18,,link,False,False,False,
fuz9wn,"Zoom banned from New York City schools due to privacy, security flaws.",41780,0.95,1409,2020-04-05 00:33:26,technology,17123051,https://www.reddit.com/r/technology/comments/fuz9wn/zoom_banned_from_new_york_city_schools_due_to/,https://www.fastcompany.com/90486586/zoom-banned-from-new-york-city-schools-due-to-privacy-and-security-flaws,fastcompany.com,0,9,,link,False,False,False,
r1ipi7,Amazon workers plan Black Friday strike,41784,0.88,1662,2021-11-25 05:24:19,technology,17123051,https://www.reddit.com/r/technology/comments/r1ipi7/amazon_workers_plan_black_friday_strike/,https://www.cnet.com/tech/amazon-workers-plan-black-friday-strike/,cnet.com,0,17,,link,False,False,False,
ahpl1k,Google Maps will now display speed limits for its Android and iOS apps,41712,0.93,1644,2019-01-20 01:28:21,technology,17123051,https://www.reddit.com/r/technology/comments/ahpl1k/google_maps_will_now_display_speed_limits_for_its/,https://www.theverge.com/2019/1/19/18189559/google-maps-speed-limits-android-and-ios-apps,theverge.com,0,1,,link,False,False,False,
6x6izw,"Guys, México has no net neutrality laws. This is what it really looks like. No mockup, glimpse into a possible future for the US. (Image in post)",41693,0.88,3229,2017-08-31 17:54:56,technology,17123051,https://www.reddit.com/r/technology/comments/6x6izw/guys_méxico_has_no_net_neutrality_laws_this_is/,https://www.reddit.com/r/technology/comments/6x6izw/guys_méxico_has_no_net_neutrality_laws_this_is/,self.technology,0,0,,text,False,False,False,"Firstoff, I absolutely support Net Neutrality Laws. 

[Here's a screencapture for cellphone data plans in México](http://imgur.com/yYobj7x), which show how carriers basically discriminate data use based on which social network you browse/consume.

I wanted to post this here because I keep finding all these mockups about how Net Neutrality ""might look"" which -albeit correct in it's assumptions- get wrong the business model end of what companies would do with their power.

Basically, what the mockups show... a world where ""regular price for top companies vs pay an extra if you're a small company"", non-net neutral competition in México is actually based on who gives away more ""free app time"". Eg: ""You can order 3 Uber rides for free, no data use, with us!""

Which I guess makes more sense. The point is still the same though... ISPs are looking inside your data packets to make these content discrimination decisions.

(edited to fix my horrible 6AM grammar)"
t9pb9z,Apple given an 'F' by US consumer advocacy group over difficult iPhone repairs,41686,0.92,1194,2022-03-09 01:24:11,technology,17123051,https://www.reddit.com/r/technology/comments/t9pb9z/apple_given_an_f_by_us_consumer_advocacy_group/,https://appleinsider.com/articles/22/03/08/apple-given-an-f-by-us-pirg-for-difficult-iphone-repairs,appleinsider.com,0,3,,link,False,False,False,
7jlwur,"Yes, Net Neutrality Is Being Stolen From Us in a Fucked Up, Undemocratic Heist",41665,0.85,1534,2017-12-14 01:34:19,technology,17123051,https://www.reddit.com/r/technology/comments/7jlwur/yes_net_neutrality_is_being_stolen_from_us_in_a/,https://motherboard.vice.com/en_us/article/xwvg34/ajit-pai-net-neutrality-heist,motherboard.vice.com,0,0,,link,False,False,False,
ak1vfb,FCC accused of colluding with Big Cable to game 5G legal challenge,41643,0.93,775,2019-01-26 21:11:29,technology,17123051,https://www.reddit.com/r/technology/comments/ak1vfb/fcc_accused_of_colluding_with_big_cable_to_game/,https://www.theregister.co.uk/2019/01/25/fcc_accused_of_colluding/,theregister.co.uk,0,2,,link,False,False,False,
