id,title,score,upvote_ratio,num_comments,created_utc,subreddit,subscribers,permalink,url,domain,num_awards,num_crossposts,crosspost_subreddits,post_type,is_nsfw,is_bot,is_megathread,body
kt785i,"Reddit bans subreddit group ""r/DonaldTrump""",147258,0.76,10303,2021-01-08 23:01:15,technology,17123051,https://www.reddit.com/r/technology/comments/kt785i/reddit_bans_subreddit_group_rdonaldtrump/,https://www.axios.com/reddit-bans-rdonaldtrump-subreddit-ff1da2de-37ab-49cf-afbd-2012f806959e.html,axios.com,0,30,,link,False,False,False,
7j6kn4,Congress has set out a bill to stop the FCC taking away our internet. PLEASE SPREAD THIS AS MUCH AS YOU CAN.,140029,0.88,1540,2017-12-12 05:34:23,technology,17123051,https://www.reddit.com/r/technology/comments/7j6kn4/congress_has_set_out_a_bill_to_stop_the_fcc/,https://www.congress.gov/bill/115th-congress/house-bill/4585,congress.gov,0,0,MarchForNetNeutrality,link,False,,False,
u178zp,John Oliver Blackmails Congress With Their Own Digital Data - The ‘Last Week Tonight’ host paid shady brokers for lawmakers’ digital histories — promising not to release the info so long as Congress passes legislation protecting all consumers’ data,133045,0.91,5108,2022-04-11 18:31:54,technology,17123051,https://www.reddit.com/r/technology/comments/u178zp/john_oliver_blackmails_congress_with_their_own/,https://www.rollingstone.com/tv/tv-news/last-week-tonight-john-oliver-recap-season-9-episode-7-congress-data-1335598/,rollingstone.com,0,19,,link,False,False,False,
df1g3g,California-based game company Blizzard bans pro esports player and confiscates his prize money after he voices support for Hong Kong protesters,129862,0.95,6920,2019-10-08 20:51:49,technology,17123051,https://www.reddit.com/r/technology/comments/df1g3g/californiabased_game_company_blizzard_bans_pro/,https://www.businessinsider.com/blizzard-bans-esports-player-blitzchung-supporting-hong-kong-protests-interview-2019-10,businessinsider.com,0,19,,link,False,False,False,
erd274,"Joe Biden calls game developers ""little creeps"" who make titles that ""teach you how to kill""",128351,0.85,10182,2020-01-20 18:45:21,technology,17123051,https://www.reddit.com/r/technology/comments/erd274/joe_biden_calls_game_developers_little_creeps_who/,https://www.techspot.com/news/83623-joe-biden-calls-game-developers-little-creeps-who.html,techspot.com,0,83,,link,False,False,False,
t0y163,"Hacker collective Anonymous declares 'cyber war' against Russia, disables state news website",127479,0.89,3351,2022-02-25 12:56:00,technology,17123051,https://www.reddit.com/r/technology/comments/t0y163/hacker_collective_anonymous_declares_cyber_war/,https://www.abc.net.au/news/science/2022-02-25/hacker-collective-anonymous-declares-cyber-war-against-russia/100861160,abc.net.au,0,20,,link,False,False,False,
t4ynmb,President of USA wants to ban advertising targeted toward kids,121361,0.79,3985,2022-03-02 17:32:27,technology,17123051,https://www.reddit.com/r/technology/comments/t4ynmb/president_of_usa_wants_to_ban_advertising/,https://www.engadget.com/biden-wants-to-ban-advertising-targeted-toward-kids-052140748.html,engadget.com,0,3,,link,False,False,False,
7dwqv6,"If Reddit was half as verbal about net neutrality as they are about Star Wars Battlefront II, then we could stop ISP's and the FCC",121060,0.8,2520,2017-11-19 05:14:27,technology,17123051,https://www.reddit.com/r/technology/comments/7dwqv6/if_reddit_was_half_as_verbal_about_net_neutrality/,https://www.reddit.com/r/technology/comments/7dwqv6/if_reddit_was_half_as_verbal_about_net_neutrality/,self.technology,0,2,,text,False,False,False,"All it takes is one call. It's our internet. 

**https://www.battleforthenet.com/**

**https://www.battleforthenet.com/**

**https://www.battleforthenet.com/**

**https://www.battleforthenet.com/**

**https://www.battleforthenet.com/**

**https://www.battleforthenet.com/**

**https://www.battleforthenet.com/**

EDIT: thank you for my first gold(s) kind strangers. All I want is for people to be aware and take action, not spend money on me."
6cvg82,Comcast is trying to censor our pro-net neutrality website that calls for an investigation into fake FCC comments potentially funded by the cable lobby,114353,0.93,2477,2017-05-23 21:13:21,technology,17123051,https://www.reddit.com/r/technology/comments/6cvg82/comcast_is_trying_to_censor_our_pronet_neutrality/,https://www.reddit.com/r/technology/comments/6cvg82/comcast_is_trying_to_censor_our_pronet_neutrality/,self.technology,0,0,,text,False,False,False,"Fight for the Future has received [a cease and desist order](http://imgur.com/a/BI7YZ) from Comcast’s lawyers, claiming that [Comcastroturf.com](http://comcastroturf.com) - a pro-net neutrality site encouraging Internet users to investigate an astroturfing campaign possibly funded by the cable lobby - violates Comcast’s ""valuable intellectual property."" The letter threatens legal action if the domain is not transferred to Comcast’s control.

The notice is ironic, in that it’s a perfect example of why we need Title II based net neutrality protections that ban ISPs from blocking or throttling content. 

**If the FCC’s current proposal is enacted, there would be nothing preventing Comcast from simply censoring this site -- or other sites critical of their corporate policies -- without even bothering with lawyers.**

The legal notice can be viewed [here](http://imgur.com/a/BI7YZ). It claims that [Comcastroturf.com](http://comcastroturf.com) violates the Anticybersquatting Consumer Protection Act and infringes on Comcast’s trademarks. Of course, these claims are legally baseless, since the site is clearly a form of First Amendment protected political speech and makes no attempt to impersonate Comcast. (See the case ""[Bosley Medical Institute vs. Kremer](https://en.wikipedia.org/wiki/Bosley_Medical_Institute,_Inc._v._Kremer)"" which held that a site critical of a company’s practices could not be considered trademark infringement, or the case Taubman vs. Webfeats, which decided that *sucks.com domain names—in this case taubmansucks.com—were free speech)

[Comcastroturf.com](http://comcastroturf.com) criticizes the cable lobby and encourages Internet users to search the Federal Communication Commission (FCC)’s docket to check if a fake comment was submitted using their name and address to attack Title II based net neutrality protections. It has been [widely reported](https://www.bna.com/fcc-set-move-n73014451155/) that more than 450,000 of these comments have been submitted to the FCC -- and as a result of the site at [Comcastroturf.com](http://comcastroturf.com), Fight for the Future [has heard](https://www.fightforthefuture.org/news/2017-05-18-fcc-ignores-growing-evidence-of-fraud-moves-ahead/) from dozens of people who say that anti-net neutrality comments were submitted using their personal information without their permission. We have connected individuals with Attorneys Generals and have called for the FCC act immediately to investigate this potential fraud.

Companies like Comcast have a long history of funding shady astroturfing operations like the one we are trying to expose with [Comcastroturf.com](http://comcastroturf.com), and also a long history of engaging in censorship. This is exactly why we need net neutrality rules, and why we can’t trust companies like Comcast to just ""behave"" when they have abused their power time and time again.

Fight for the Future has no intention of taking down [Comcastroturf.com](http://comcastroturf.com), and we would be happy to discuss the matter with Comcast in court.
"
e6z7k6,"Bernie Sanders unveils plan to boost broadband access, break up internet and cable titans: “We are going to take on the greedy internet, telecom, and cable monopolies and put an end to their absurd price gouging”",112305,0.84,6062,2019-12-06 19:38:21,technology,17123051,https://www.reddit.com/r/technology/comments/e6z7k6/bernie_sanders_unveils_plan_to_boost_broadband/,https://www.cnbc.com/2019/12/06/bernie-sanders-releases-broadband-plan-targets-comcast-att-verizon.html,cnbc.com,0,18,,link,False,False,False,
8n959q,Reddit just passed Facebook as #3 most popular website in US,110088,0.9,5448,2018-05-30 20:15:38,technology,17123051,https://www.reddit.com/r/technology/comments/8n959q/reddit_just_passed_facebook_as_3_most_popular/,https://www.alexa.com/topsites/countries/US,alexa.com,0,16,,link,False,False,False,
gtka43,"SpaceX successfully launches first crew to orbit, ushering in new era of spaceflight",109145,0.91,3734,2020-05-31 01:06:32,technology,17123051,https://www.reddit.com/r/technology/comments/gtka43/spacex_successfully_launches_first_crew_to_orbit/,https://www.theverge.com/2020/5/30/21269703/spacex-launch-crew-dragon-nasa-orbit-successful,theverge.com,0,12,,link,False,False,False,
lah0rj,Robinhood CEO expected to testify before U.S. House committee on February 18.,109049,0.93,3740,2021-02-02 04:36:47,technology,17123051,https://www.reddit.com/r/technology/comments/lah0rj/robinhood_ceo_expected_to_testify_before_us_house/,https://www.reuters.com/article/us-retail-investing-robinhood-congress/robinhood-ceo-expected-to-testify-before-u-s-house-committee-on-february-18-politico-idUSKBN2A13O2,reuters.com,0,13,,link,False,False,False,
13yc62g,Reddit sparks outrage after a popular app developer said it wants him to pay $20 million a year for data access,108351,0.93,6314,2023-06-02 18:32:33,technology,17123051,https://www.reddit.com/r/technology/comments/13yc62g/reddit_sparks_outrage_after_a_popular_app/,https://www.cnn.com/2023/06/01/tech/reddit-outrage-data-access-charge/index.html,cnn.com,0,121,,link,False,False,False,
144g35v,Apollo for Reddit is shutting down,108090,0.92,5255,2023-06-08 23:23:26,technology,17123051,https://www.reddit.com/r/technology/comments/144g35v/apollo_for_reddit_is_shutting_down/,https://www.theverge.com/2023/6/8/23754183/apollo-reddit-app-shutting-down-api,theverge.com,0,10,,link,False,False,False,
q9dgtx,Canon sued for disabling scanner when printers run out of ink,105641,0.95,4259,2021-10-16 20:19:30,technology,17123051,https://www.reddit.com/r/technology/comments/q9dgtx/canon_sued_for_disabling_scanner_when_printers/,https://www.bleepingcomputer.com/news/legal/canon-sued-for-disabling-scanner-when-printers-run-out-of-ink/,bleepingcomputer.com,0,14,,link,False,False,False,
7eqmci,"Congressmen demand investigation of FCC Chairman Ajit Pai, Sinclair Broadcast Group",104656,0.9,2014,2017-11-22 18:04:03,technology,17123051,https://www.reddit.com/r/technology/comments/7eqmci/congressmen_demand_investigation_of_fcc_chairman/,http://static.techspot.com/news/71865-congressmen-demand-investigation-fcc-chairman-ajit-pai-sinclair.html,static.techspot.com,0,0,,link,False,False,False,
6bytpx,"SOPA, PIPA, CISPA, ACTA, TPP, ITU, CISPA again, TAFTA. We won them all. In 2015 Net Neutrality, for free access to our Internets. The FCC just signalled the death knell for that hard-won fight. We need to have a serious conversation and fight this, and time is short. Let's have that conversation.",104095,0.9,3832,2017-05-19 01:48:08,technology,17123051,https://www.reddit.com/r/technology/comments/6bytpx/sopa_pipa_cispa_acta_tpp_itu_cispa_again_tafta_we/,https://www.reddit.com/r/technology/comments/6bytpx/sopa_pipa_cispa_acta_tpp_itu_cispa_again_tafta_we/,self.technology,0,0,,text,False,False,False,"Via the wonderful /u/vriska1

If you want to help protect NN you can support groups like the Electronic Frontier Foundation and the ACLU and Free Press who are fighting to keep Net Neutrality.

https://contactingcongress.org - Contact your member of Congress

https://www.eff.org/

https://www.aclu.org/

https://www.freepress.net/

https://www.fightforthefuture.org/

https://www.publicknowledge.org/

https://demandprogress.org/

also you can set them as your charity on
https://smile.amazon.com/

also write to your House Representative and senators

http://www.house.gov/representatives/find/

https://www.senate.gov/general/contact_ ... erBy=state

and the FCC
https://www.fcc.gov/about/contact

You can now add a comment to the repeal here

https://www.fcc.gov/ecfs/search/filings ... nated,DESC

here a easier URL you can use thanks to John Oliver

www.gofccyourself.com

(its down right now but will likely be back up after today)

you can also use this that help you contact your house and congressional reps, its easy to use and cuts down on the transaction costs with writing a letter to your reps.

https://resistbot.io/

also check out https://democracy.io/#!/

which was made by the EFF and is a low transaction​cost tool for writing all your reps in one fell swoop

[Major tech companies are for Net Neutrality](https://www.washingtonpost.com/news/the-switch/wp/2017/04/12/tech-companies-are-teeing-up-another-fcc-fight-on-net-neutrality/?utm_term=.cedc03fc38c3) (open in incognito mode to skip wall),  And [Senate Democrats are for Net Neutrality.](https://www.theverge.com/2017/5/17/15654496/senate-democrats-open-letter-net-neutrality)"
996ep8,Verizon throttled fire department’s “unlimited” data during Calif. wildfire,102555,0.93,4702,2018-08-22 01:23:22,technology,17123051,https://www.reddit.com/r/technology/comments/996ep8/verizon_throttled_fire_departments_unlimited_data/,https://arstechnica.com/tech-policy/2018/08/verizon-throttled-fire-departments-unlimited-data-during-calif-wildfire/,arstechnica.com,0,19,,link,False,,False,
xfv07g,"The US is moving one step closer to letting Americans file their taxes online for free directly to the IRS, cutting out private companies like Turbotax and H&R Block",102554,0.92,3125,2022-09-16 21:22:29,technology,17123051,https://www.reddit.com/r/technology/comments/xfv07g/the_us_is_moving_one_step_closer_to_letting/,https://www.businessinsider.com/us-moving-closer-letting-americans-file-taxes-online-and-free-2022-9,businessinsider.com,0,14,,link,False,False,False,
l1cn1e,Gigantic Asshole Ajit Pai Is Officially Gone. Good Riddance (Time of Your Life),101637,0.85,2020,2021-01-20 22:03:03,technology,17123051,https://www.reddit.com/r/technology/comments/l1cn1e/gigantic_asshole_ajit_pai_is_officially_gone_good/,https://www.vice.com/en/article/bvxpja/gigantic-asshole-ajit-pai-is-officially-gone-good-riddance-time-of-your-life,vice.com,0,7,,link,False,False,False,
11zg1ki,The FTC wants to ban those tough-to-cancel gym and cable subscriptions | The proposed ‘click to cancel’ rule would require companies to let you cancel a membership in as many steps as it takes to sign up.,101094,0.96,2818,2023-03-23 15:53:33,technology,17123051,https://www.reddit.com/r/technology/comments/11zg1ki/the_ftc_wants_to_ban_those_toughtocancel_gym_and/,https://www.theverge.com/2023/3/23/23652373/ftc-click-to-cancel-subscription-service-dark-patterns-ban,theverge.com,0,14,,link,False,False,False,
7l0whi,Massive Fraud in Net Neutrality Process is a Crime Deserving of Justice Department Attention,100688,0.86,2984,2017-12-20 17:16:46,technology,17123051,https://www.reddit.com/r/technology/comments/7l0whi/massive_fraud_in_net_neutrality_process_is_a/,https://townhall.com/columnists/bobbarr/2017/12/20/massive-fraud-in-net-neutrality-process-is-a-crime-deserving-of-justice-department-attention-n2424724,townhall.com,0,4,,link,False,False,False,
7mmjij,"A lawsuit against Apple is launched in France, one of the only countries where planned obsolescence is explicitly illegal",97393,0.9,6067,2017-12-28 18:47:57,technology,17123051,https://www.reddit.com/r/technology/comments/7mmjij/a_lawsuit_against_apple_is_launched_in_france_one/,https://www.thelocal.fr/20171228/french-lawsuit-launched-against-apple-for-alleged-crime-of-slowing-down-iphones,thelocal.fr,0,4,,link,False,False,False,
rjzhsh,It's time to stop hero worshiping the tech billionaires,95637,0.7,6554,2021-12-19 21:25:14,technology,17123051,https://www.reddit.com/r/technology/comments/rjzhsh/its_time_to_stop_hero_worshiping_the_tech/,https://www.businessinsider.com/time-magazine-elon-musk-person-of-the-year-critics-elizabeth-warren-taxes2021-12,businessinsider.com,0,23,,link,False,False,False,
l6awjw,"GameStop, AMC surge after Reddit users lead chaotic revolt against big Wall Street funds",94520,0.9,6965,2021-01-27 23:48:17,technology,17123051,https://www.reddit.com/r/technology/comments/l6awjw/gamestop_amc_surge_after_reddit_users_lead/,https://www.washingtonpost.com/business/2021/01/27/gamestop-amc-reddit-short-sellers-wallstreetbets/,washingtonpost.com,0,11,,link,False,,False,
7ldqzm,Apple Being Sued for 'Purposefully Slowing Down Older iPhone Models',94354,0.88,5788,2017-12-22 05:58:32,technology,17123051,https://www.reddit.com/r/technology/comments/7ldqzm/apple_being_sued_for_purposefully_slowing_down/,https://www.macrumors.com/2017/12/21/apple-lawsuit-slowing-down-old-iphone-models/,macrumors.com,0,2,,link,False,False,False,
zj7uat,"Neuralink killed 1,500 animals in four years; Now under trial for animal cruelty: Report",93262,0.8,7373,2022-12-12 02:10:54,technology,17123051,https://www.reddit.com/r/technology/comments/zj7uat/neuralink_killed_1500_animals_in_four_years_now/,https://me.mashable.com/tech/22724/elon-musks-neuralink-killed-1500-animals-in-four-years-now-under-trial-for-animal-cruelty-report,me.mashable.com,0,27,,link,False,False,False,
lf6nhr,Amazon warehouse workers to begin historic vote to unionize,93093,0.9,3763,2021-02-08 12:55:25,technology,17123051,https://www.reddit.com/r/technology/comments/lf6nhr/amazon_warehouse_workers_to_begin_historic_vote/,https://techcrunch.com/2021/02/07/amazon-warehouse-workers-begin-historic-vote-to-unionize/,techcrunch.com,0,18,,link,False,False,False,
8jxxxn,Senate votes in favor of overturning FCC on Net Neutrality,92976,0.88,3691,2018-05-17 01:22:48,technology,17123051,https://www.reddit.com/r/technology/comments/8jxxxn/senate_votes_in_favor_of_overturning_fcc_on_net/,https://www.c-span.org/video/?445642-1/us-senate-vote-reinstating-net-neutrality-rules-3pm&live=,c-span.org,0,4,,link,False,False,False,
y9tlbu,Blink-182 Tickets Are So Expensive Because Ticketmaster Is a Disastrous Monopoly and Now Everyone Pays Ticket Broker Prices | Or: Why you are not ever getting an inexpensive ticket to a popular concert ever again.,92888,0.9,8360,2022-10-21 18:51:34,technology,17123051,https://www.reddit.com/r/technology/comments/y9tlbu/blink182_tickets_are_so_expensive_because/,https://www.vice.com/en/article/m7gx34/blink-182-tickets-are-so-expensive-because-ticketmaster-is-a-disastrous-monopoly-and-now-everyone-pays-ticket-broker-prices,vice.com,0,18,,link,False,False,False,
tbszex,Russia moves to ban Instagram as it designates Meta an ‘extremist organisation’,91671,0.92,4738,2022-03-11 21:18:48,technology,17123051,https://www.reddit.com/r/technology/comments/tbszex/russia_moves_to_ban_instagram_as_it_designates/,https://www.independent.co.uk/tech/russia-instagram-ban-meta-whatsapp-b2033767.html,independent.co.uk,0,13,,link,False,False,False,
hdvac7,Hackers just leaked sensitive files from over 200 police departments that are searchable by badge number,91075,0.87,2570,2020-06-22 21:45:01,technology,17123051,https://www.reddit.com/r/technology/comments/hdvac7/hackers_just_leaked_sensitive_files_from_over_200/,https://www.businessinsider.com/blueleaks-hackers-publish-sensitive-files-from-200-police-departments-2020-6,businessinsider.com,0,21,,link,False,False,False,
gttccz,"Hacktivist Group Anonymous Takes Down Minneapolis PD Website, Releases Video Threatening To Expose Corrupt Police Officers",91019,0.86,2877,2020-05-31 11:00:38,technology,17123051,https://www.reddit.com/r/technology/comments/gttccz/hacktivist_group_anonymous_takes_down_minneapolis/,https://brobible.com/culture/article/hacktivist-group-anonymous-minneapolis-pd-george-floyd/,brobible.com,0,19,,link,False,False,False,
141borj,"Major Reddit communities will go dark to protest threat to third-party apps | App developers have said next month’s changes to Reddit’s API pricing could make their apps unsustainable. Now, dozens of the site’s biggest subreddits plan to go private for two days in protest.",90882,0.91,3351,2023-06-05 17:07:48,technology,17123051,https://www.reddit.com/r/technology/comments/141borj/major_reddit_communities_will_go_dark_to_protest/,https://www.theverge.com/2023/6/5/23749188/reddit-subreddit-private-protest-api-changes-apollo-charges,theverge.com,0,43,,link,False,False,False,
6h82ji,"PornHub, OK Cupid, Imgur, DuckDuckGo, Namecheap, Bittorrent, and a bunch of other big sites have joined the Internet-Wide Day of Action for Net Neutrality on July 12 (Amazon, Kickstarter, Etsy, Mozilla, and Reddit were already on board.)",90545,0.91,2853,2017-06-14 20:36:26,technology,17123051,https://www.reddit.com/r/technology/comments/6h82ji/pornhub_ok_cupid_imgur_duckduckgo_namecheap/,https://www.reddit.com/r/technology/comments/6h82ji/pornhub_ok_cupid_imgur_duckduckgo_namecheap/,self.technology,0,1,,text,False,False,False,"Hey reddit, I wanted to give a quick update on the **[Internet-Wide Day of Action to Save Net Neutrality](https://www.battleforthenet.com/july12)** that lots of us are planning for July 12th.

There's a huge amount of momentum. This morning PornHub (with 75 million daily visitors) [announced](https://motherboard.vice.com/en_us/article/pornhub-will-show-its-75-million-daily-visitors-why-net-neutrality-matters) that they will be participating. Since we announced earlier this month a ton of other high-traffic sites have signed on including Imgur, Amazon, Namecheap, OK Cupid, Bittorrent, Mozilla, Kickstarter, Etsy, GitHub, Vimeo, Chess.com, Fark, Checkout.com, Y Combinator, and Private Internet Access. 

Reddit itself has also joined, [along with](https://www.reddit.com/r/technology/comments/6g9pkl/reddit_lets_get_organized_more_than_30_subreddits/) more than 30 subreddits!

Net neutrality is the basic principle that prevents Internet Service Providers like Comcast and Verizon from charging us extra fees to access the content we want -- or throttling, blocking, and censoring websites and apps. Title II is the legal framework for net neutrality, and the FCC is trying to get rid of it, under immense pressure for the Cable lobby.

This day of action is an incredibly important moment for the Internet to come together -- across political lines -- and show that we don't want our Cable companies controlling what we can do online, or picking winners and losers when it comes to streaming services, games, and online content.

The current FCC chairman, Ajit Pai, is a former Verizon lawyer and seems intent on getting rid of net neutrality and misleading the public about it. But the FCC has to answer to Congress. If we can create another moment of massive online protest like the SOPA Blackout and the Internet Slowdown, we have a real chance of stopping the FCC in its tracks, and protecting the Internet as a free and open platform for creativity, innovation, and exchange of ideas. 

So! If you've got a website, blog, Tumblr, or any kind of social media following, or if you are a subreddit mod or active in an online community or forum, please get involved! There's so much we as redditors can do, from blacking out our sites to drive emails and phone calls to organizing in-person meetings with our lawmakers. Feel free to message me directly or email team (at) fightforthefuture (dot) org to get involved, and **[learn more here.](https://www.battleforthenet.com/july12)**

**EDIT:** Oh hai, everyone! Very glad you're here. Lots of awesome brainstorming happening in the comments. Keep it coming. A lot of people are asking what sites will be doing on July 12. We're still encouraging brainstorming and creativity, but the basic idea is that sites will have a few options of things they can do to their homepage to show what the web would be like without net neutrality, ie a slow loading icon to show they are stuck in the slow lane, a ""site blocked"" message to show they could be censored, or an ""upgrade your Internet service to access this site"" fake paywall to show how we could be charged special fees to access content. Love all your ideas! Keep sharing, and **[go here for more info about the protest.](https://www.battleforthenet.com/july12)**

**EDIT 2:** It's worth noting that given the current chairman of the FCC's political orientation, it's extra important that conservatives, libertarians, and others to the right of center speak out on this issue. The cable lobby is working super hard to turn this technological issue into a partisan circus. We can't let them. Net neutrality protects free speech, free markets, innovation, and economic opportunity. We need people and sites from all across the political spectrum to be part of this. "
9kt7un,"The rise of Netflix competitors has pushed consumers back toward piracy - BitTorrent usage has bounced back because there's too many streaming services, and too much exclusive content.",89860,0.94,7459,2018-10-02 23:58:02,technology,17123051,https://www.reddit.com/r/technology/comments/9kt7un/the_rise_of_netflix_competitors_has_pushed/,https://motherboard.vice.com/en_us/article/d3q45v/bittorrent-usage-increases-netflix-streaming-sites,motherboard.vice.com,0,15,,link,False,False,False,
r2zibf,"The CEO of cosmetics retailer Lush says he's 'happy to lose' $13 million by deleting Facebook, TikTok, Snapchat accounts over teen mental-health harms",89550,0.86,1719,2021-11-27 04:52:25,technology,17123051,https://www.reddit.com/r/technology/comments/r2zibf/the_ceo_of_cosmetics_retailer_lush_says_hes_happy/,https://www.businessinsider.com/lush-ceo-happy-to-lose-13m-deleting-social-media-accounts-2021-11,businessinsider.com,0,8,,link,False,False,False,
