id,title,score,upvote_ratio,num_comments,created_utc,subreddit,subscribers,permalink,url,domain,num_awards,num_crossposts,crosspost_subreddits,post_type,is_nsfw,is_bot,is_megathread,body
14edlii,Reddit CEO Steve Huffman is fighting a losing battle against the site's moderators,63173,0.8,6172,2023-06-20 20:35:50,technology,17123051,https://www.reddit.com/r/technology/comments/14edlii/reddit_ceo_steve_huffman_is_fighting_a_losing/,https://qz.com/reddit-ceo-steve-huffman-is-fighting-a-losing-battle-ag-1850555604,qz.com,0,8,,link,False,False,False,
8i1lqh,"AT&T paid $200,000 to Trump’s attorney, Michael Cohen, and the payments stop right after Trump’s FCC pick Ajit Pai repealed net neutrality",63122,0.84,2644,2018-05-09 05:37:49,technology,17123051,https://www.reddit.com/r/technology/comments/8i1lqh/att_paid_200000_to_trumps_attorney_michael_cohen/,https://medium.com/@fightfortheftr/at-t-paid-200-000-to-trumps-attorney-michael-cohen-and-the-payments-stop-right-after-trump-s-3356687f4827,medium.com,0,6,,link,False,False,False,
ubjp7g,Twitter to accept Elon Musk’s $45 billion bid to buy company,63086,0.82,18094,2022-04-25 17:41:59,technology,17123051,https://www.reddit.com/r/technology/comments/ubjp7g/twitter_to_accept_elon_musks_45_billion_bid_to/,https://www.independent.co.uk/tech/twitter-elon-musk-buy-company-b2064819.html,independent.co.uk,0,20,,link,False,False,False,
myy0ab,CEOs are hugely expensive – why not automate them?,63081,0.72,4979,2021-04-26 19:15:05,technology,17123051,https://www.reddit.com/r/technology/comments/myy0ab/ceos_are_hugely_expensive_why_not_automate_them/,https://www.newstatesman.com/business/companies/2021/04/ceos-are-hugely-expensive-why-not-automate-them,newstatesman.com,0,20,,link,False,False,False,
7g7am0,Comcast Wants You to Think It Supports Net Neutrality While It Pushes for Net Neutrality to Be Destroyed,63077,0.88,1207,2017-11-29 02:13:02,technology,17123051,https://www.reddit.com/r/technology/comments/7g7am0/comcast_wants_you_to_think_it_supports_net/,http://www.slate.com/blogs/future_tense/2017/11/28/comcast_wants_you_to_think_it_supports_net_neutrality_while_it_pushes_for.html,slate.com,0,0,,link,False,False,False,
l2rb9s,New Acting FCC Chief Jessica Rosenworcel Supports Restoring Net Neutrality,62978,0.92,1468,2021-01-22 22:03:54,technology,17123051,https://www.reddit.com/r/technology/comments/l2rb9s/new_acting_fcc_chief_jessica_rosenworcel_supports/,https://www.vice.com/en/article/v7mxja/new-acting-fcc-chief-jessica-rosenworcel-supports-restoring-net-neutrality,vice.com,0,4,,link,False,False,False,
7li4vl,26 Senators Support CRA Reversal of FCC Attack on Net Neutrality: an uphill effort to reverse the FCC's repeal via the Congressional Review Act (CRA) is gaining steam.,62916,0.85,1408,2017-12-22 21:05:13,technology,17123051,https://www.reddit.com/r/technology/comments/7li4vl/26_senators_support_cra_reversal_of_fcc_attack_on/,http://www.dslreports.com/shownews/26-Senators-Support-CRA-Reversal-of-FCC-Attack-on-Net-Neutrality-140933,dslreports.com,0,6,,link,False,False,False,
aqp9zw,Amazon Will Pay a Whopping $0 in Federal Taxes on $11.2 Billion Profits,62839,0.62,3897,2019-02-15 03:34:52,technology,17123051,https://www.reddit.com/r/technology/comments/aqp9zw/amazon_will_pay_a_whopping_0_in_federal_taxes_on/,http://fortune.com/2019/02/14/amazon-doesnt-pay-federal-taxes-2019/,fortune.com,0,14,,link,False,False,False,
pp85vw,'Dislike' button would improve Spotify's recommendations,62722,0.93,2213,2021-09-16 12:19:07,technology,17123051,https://www.reddit.com/r/technology/comments/pp85vw/dislike_button_would_improve_spotifys/,https://techxplore.com/news/2021-09-button-spotify.html,techxplore.com,0,2,,link,False,False,False,
vecyv8,USB-C iPhone could become mandatory in the US as senators push for common charger law.,62560,0.92,4313,2022-06-17 18:47:12,technology,17123051,https://www.reddit.com/r/technology/comments/vecyv8/usbc_iphone_could_become_mandatory_in_the_us_as/,https://9to5mac.com/2022/06/17/usb-c-iphone-united-states/,9to5mac.com,0,2,,link,False,False,False,
ko5uzo,"Apple knew a supplier was using child labor but took 3 years to fully cut ties, despite the company's promises to hold itself to the 'highest standards,' report says",62375,0.88,1742,2021-01-01 11:04:19,technology,17123051,https://www.reddit.com/r/technology/comments/ko5uzo/apple_knew_a_supplier_was_using_child_labor_but/,https://www.businessinsider.com/apple-knowingly-used-child-labor-supplier-3-years-cut-costs-2020-12,businessinsider.com,0,15,,link,False,False,False,
z2s93d,"Mercedes locks faster acceleration behind a $1,200 annual paywall",62258,0.9,6729,2022-11-23 21:08:06,technology,17123051,https://www.reddit.com/r/technology/comments/z2s93d/mercedes_locks_faster_acceleration_behind_a_1200/,https://www.theverge.com/2022/11/23/23474969/mercedes-car-subscription-faster-acceleration-feature-price,theverge.com,0,25,,link,False,False,False,
nxh9si,Amazon is fighting against laws that could force it to verify third-party sellers' identities and give out their contact information,62230,0.93,2309,2021-06-11 19:58:25,technology,17123051,https://www.reddit.com/r/technology/comments/nxh9si/amazon_is_fighting_against_laws_that_could_force/,https://www.businessinsider.in/tech/news/amazon-is-fighting-against-laws-that-could-force-it-to-verify-third-party-sellers-identities-and-give-out-their-contact-information/articleshow/83432989.cms,businessinsider.in,0,9,,link,False,False,False,
h891d6,"Outrage over police brutality has finally convinced Amazon, Microsoft, and IBM to rule out selling facial recognition tech to law enforcement.",62196,0.9,1485,2020-06-13 20:26:54,technology,17123051,https://www.reddit.com/r/technology/comments/h891d6/outrage_over_police_brutality_has_finally/,https://www.businessinsider.com/amazon-microsoft-ibm-halt-selling-facial-recognition-to-police-2020-6,businessinsider.com,0,13,,link,False,False,False,
7iio7s,Leaked Video Shows FCC Chair Ajit Pai Roasting Himself With 'Jokes' About Being a Verizon Shill,62087,0.88,2425,2017-12-09 04:19:24,technology,17123051,https://www.reddit.com/r/technology/comments/7iio7s/leaked_video_shows_fcc_chair_ajit_pai_roasting/,https://gizmodo.com/leaked-video-shows-fcc-chair-ajit-pai-roasting-himself-1821134881,gizmodo.com,0,2,,link,False,False,False,
szq4ru,Twitter accounts sharing video from Ukraine are being suspended when they’re needed most,62078,0.92,1770,2022-02-24 01:17:50,technology,17123051,https://www.reddit.com/r/technology/comments/szq4ru/twitter_accounts_sharing_video_from_ukraine_are/,https://www.theverge.com/2022/2/23/22947769/twitter-osint-russia-ukraine-invasion-suspended-error,theverge.com,0,8,,link,False,False,False,
pv5l19,"The world's biggest carbon-removal plant just opened. In a year, it'll negate just 3 seconds' worth of global emissions.",62022,0.92,3508,2021-09-25 17:41:33,technology,17123051,https://www.reddit.com/r/technology/comments/pv5l19/the_worlds_biggest_carbonremoval_plant_just/,https://www.businessinsider.com/carbon-capture-storage-expensive-climate-change-2021-9,businessinsider.com,0,11,,link,False,False,False,
s26ayo,"The FTC can move forward with its bid to make Meta sell Instagram and WhatsApp, judge rules",62013,0.94,2349,2022-01-12 19:00:36,technology,17123051,https://www.reddit.com/r/technology/comments/s26ayo/the_ftc_can_move_forward_with_its_bid_to_make/,https://www.businessinsider.com/ruling-ftc-meta-facebook-lawsuit-instagram-whatsapp-can-proceed-2022-1,businessinsider.com,0,6,,link,False,False,False,
kwg2ce,TikTok: All under-16s' accounts made private,61961,0.93,2413,2021-01-13 18:35:51,technology,17123051,https://www.reddit.com/r/technology/comments/kwg2ce/tiktok_all_under16s_accounts_made_private/,https://www.bbc.com/news/technology-55639920,bbc.com,0,7,,link,False,False,False,
iq156d,"Biden Campaign Firm Hit by Suspected Kremlin Hacking Attack — the failed hacking attempt was caught by Microsoft, which reportedly gathered information identifying hackers linked to the Kremlin as the most likely suspect",61944,0.89,1814,2020-09-10 16:29:57,technology,17123051,https://www.reddit.com/r/technology/comments/iq156d/biden_campaign_firm_hit_by_suspected_kremlin/,https://www.thedailybeast.com/biden-campaign-firm-hit-by-suspected-kremlin-hacking-attack,thedailybeast.com,0,7,,link,False,False,False,
11wh7rs,"Data center uses its waste heat to warm public pool, saving $24,000 per year | Stopping waste heat from going to waste",61927,0.94,1198,2023-03-20 17:41:48,technology,17123051,https://www.reddit.com/r/technology/comments/11wh7rs/data_center_uses_its_waste_heat_to_warm_public/,https://www.techspot.com/news/97995-data-center-uses-waste-heat-warm-public-pool.html,techspot.com,0,13,,link,False,False,False,
canmvc,Amazon staff will strike during Prime Day over working conditions.,61826,0.93,3647,2019-07-08 22:28:26,technology,17123051,https://www.reddit.com/r/technology/comments/canmvc/amazon_staff_will_strike_during_prime_day_over/,https://www.engadget.com/2019/07/08/amazon-warehouse-workers-prime-day-strike/,engadget.com,0,6,,link,False,False,False,
td4vwe,Goldman Sachs’ CEO demanded all employees return full-time to the office. Only half showed up,61703,0.92,4080,2022-03-13 16:50:03,technology,17123051,https://www.reddit.com/r/technology/comments/td4vwe/goldman_sachs_ceo_demanded_all_employees_return/,https://finance.yahoo.com/news/goldman-sachs-ceo-demanded-employees-210608499.html,finance.yahoo.com,0,15,,link,False,False,False,
jg0lj0,Former Google CEO Calls Social Networks ‘Amplifiers for Idiots’,61660,0.93,1820,2020-10-22 19:55:24,technology,17123051,https://www.reddit.com/r/technology/comments/jg0lj0/former_google_ceo_calls_social_networks/,https://www.bloomberg.com/news/articles/2020-10-21/former-google-ceo-calls-social-networks-amplifiers-for-idiots,bloomberg.com,0,9,,link,False,False,False,
ktf457,Twitter Permanently Bans President Donald Trump’s Account - ASAT 2325GMT,61610,0.81,5527,2021-01-09 05:21:39,technology,17123051,https://www.reddit.com/r/technology/comments/ktf457/twitter_permanently_bans_president_donald_trumps/,https://www.bloomberg.com/news/articles/2021-01-08/twitter-permanently-suspends-donald-trump-from-social-network?utm_campaign=pol&utm_medium=bd&utm_source=applenews,bloomberg.com,0,3,,link,False,False,False,
dfj0sv,Blizzard's Hong Kong Screw-Up Is Officially an International Incident,61577,0.95,2305,2019-10-09 21:25:51,technology,17123051,https://www.reddit.com/r/technology/comments/dfj0sv/blizzards_hong_kong_screwup_is_officially_an/,https://www.vice.com/en_us/article/bjw535/blizzards-hong-kong-screw-up-is-officially-an-international-incident,vice.com,0,5,,link,False,False,False,
10o2vu7,Gen Z says that school is not shipping them with the skills necessary to survive in a digital world,61540,0.84,8463,2023-01-29 13:58:36,technology,17123051,https://www.reddit.com/r/technology/comments/10o2vu7/gen_z_says_that_school_is_not_shipping_them_with/,https://www.fastcompany.com/90839901/dell-study-gen-z-success-in-digital-world,fastcompany.com,0,5,,link,False,False,False,
8a8gzg,"Wondered why Google removed the ""view image"" button on Google Images?",61506,0.89,3252,2018-04-06 16:08:59,technology,17123051,https://www.reddit.com/r/technology/comments/8a8gzg/wondered_why_google_removed_the_view_image_button/,https://www.reddit.com/r/technology/comments/8a8gzg/wondered_why_google_removed_the_view_image_button/,self.technology,0,2,,text,False,False,False,"So it turns out Getty Images took them to court and forced them to remove it so that they would get more traffic on their own page. 

Getty Images have removed one of the most useful features of the internet. I for one will never be using their services again because of this. "
v471tj,"New York state passes first-ever ""right to repair"" law for electronics | ‘Repairs should become less expensive and more comprehensive’ because of the new measure, says iFixit",61453,0.95,1224,2022-06-04 01:02:16,technology,17123051,https://www.reddit.com/r/technology/comments/v471tj/new_york_state_passes_firstever_right_to_repair/,https://www.theverge.com/2022/6/3/23153504/right-to-repair-new-york-state-law-ifixit-repairability-diy,theverge.com,0,24,,link,False,False,False,
i54g2o,Facebook Fired An Employee Who Collected Evidence Of Right-Wing Pages Getting Preferential Treatment,61397,0.84,2367,2020-08-07 06:42:49,technology,17123051,https://www.reddit.com/r/technology/comments/i54g2o/facebook_fired_an_employee_who_collected_evidence/,https://www.buzzfeednews.com/article/craigsilverman/facebook-zuckerberg-what-if-trump-disputes-election-results?scrolla=5eb6d68b7fedc32c19ef33b4,buzzfeednews.com,0,12,,link,False,False,False,
ox263z,Zoom to pay $85M for lying about encryption and sending data to Facebook and Google,61359,0.95,1796,2021-08-03 17:42:04,technology,17123051,https://www.reddit.com/r/technology/comments/ox263z/zoom_to_pay_85m_for_lying_about_encryption_and/,https://arstechnica.com/tech-policy/2021/08/zoom-to-pay-85m-for-lying-about-encryption-and-sending-data-to-facebook-and-google/,arstechnica.com,0,10,,link,False,False,False,
85snbc,Mark Zuckerberg has been sent a formal request to appear before MPs and answer questions regarding a growing scandal about user data,61229,0.92,2782,2018-03-20 18:50:47,technology,17123051,https://www.reddit.com/r/technology/comments/85snbc/mark_zuckerberg_has_been_sent_a_formal_request_to/,http://news.sky.com/story/mps-formally-request-zuckerberg-answer-questions-11297936,news.sky.com,0,3,,link,False,False,False,
3c6ajx,"Reddit CEO Ellen Pao: ""The Vast Majority of Reddit Users are Uninterested in"" Victoria Taylor, Subreddits Going Private",61056,0.86,5705,2015-07-05 11:41:12,technology,17123051,https://www.reddit.com/r/technology/comments/3c6ajx/reddit_ceo_ellen_pao_the_vast_majority_of_reddit/,http://www.thesocialmemo.org/2015/07/reddit-ceo-ellen-pao-vast-majority-of.html,thesocialmemo.org,0,0,,link,False,False,False,
mnfpxi,Americans are super-spreaders of COVID-19 misinformation,61057,0.73,4501,2021-04-09 17:34:20,technology,17123051,https://www.reddit.com/r/technology/comments/mnfpxi/americans_are_superspreaders_of_covid19/,https://www.mcgill.ca/newsroom/channels/news/americans-are-super-spreaders-covid-19-misinformation-330229,mcgill.ca,0,12,,link,False,False,False,
fl8687,Elon Musk says Tesla will make ventilators for hospitals if needed.,60934,0.78,3674,2020-03-19 16:29:44,technology,17123051,https://www.reddit.com/r/technology/comments/fl8687/elon_musk_says_tesla_will_make_ventilators_for/,https://mashable.com/article/elon-musk-ventilators-coronavirus/,mashable.com,0,15,,link,False,False,False,
abj2rv,'We are not robots': Amazon warehouse employees push to unionize,60923,0.85,4722,2019-01-01 21:14:42,technology,17123051,https://www.reddit.com/r/technology/comments/abj2rv/we_are_not_robots_amazon_warehouse_employees_push/,https://www.theguardian.com/technology/2019/jan/01/amazon-fulfillment-center-warehouse-employees-union-new-york-minnesota,theguardian.com,0,14,,link,False,False,False,
yjcdnq,"People return to offices, productivity plunges",60876,0.86,3278,2022-11-01 21:26:20,technology,17123051,https://www.reddit.com/r/technology/comments/yjcdnq/people_return_to_offices_productivity_plunges/,https://ktla.com/news/money-smart/people-return-to-offices-productivity-plunges/amp/,ktla.com,0,20,,link,False,False,False,
vd1n4r,Senator Elizabeth Warren proposes sweeping ban on location and health data sales,60817,0.92,1328,2022-06-16 00:17:26,technology,17123051,https://www.reddit.com/r/technology/comments/vd1n4r/senator_elizabeth_warren_proposes_sweeping_ban_on/,https://www.theverge.com/2022/6/15/23169718/roe-wade-elizabeth-warren-location-data-tracking-ban-sale-brokers,theverge.com,0,5,,link,False,False,False,
ysh4x7,"Twitter quietly drops $8 paid verification; “tricking people not OK,” Musk says",60733,0.9,4581,2022-11-11 23:01:47,technology,17123051,https://www.reddit.com/r/technology/comments/ysh4x7/twitter_quietly_drops_8_paid_verification/,https://arstechnica.com/tech-policy/2022/11/twitter-quietly-drops-8-paid-verification-tricking-people-not-ok-musk-says/,arstechnica.com,0,10,,link,False,False,False,
6i6bdq,GOP Data Firm Accidentally Leaks Personal Details of Nearly 200 Million American Voters,60714,0.83,4370,2017-06-19 18:44:04,technology,17123051,https://www.reddit.com/r/technology/comments/6i6bdq/gop_data_firm_accidentally_leaks_personal_details/,https://gizmodo.com/gop-data-firm-accidentally-leaks-personal-details-of-ne-1796211612,gizmodo.com,0,0,,link,False,False,False,
i0137m,Trump says he is considering banning TikTok,60689,0.9,2753,2020-07-29 19:24:16,technology,17123051,https://www.reddit.com/r/technology/comments/i0137m/trump_says_he_is_considering_banning_tiktok/,https://www.independent.co.uk/news/world/americas/us-politics/trump-tiktok-ban-china-app-pompeo-a9644041.html,independent.co.uk,0,12,,link,False,False,False,
v1pbcy,"Netflix's plan to charge people for sharing passwords is already a mess before it's even begun, report suggests",60675,0.91,5055,2022-05-31 18:07:38,technology,17123051,https://www.reddit.com/r/technology/comments/v1pbcy/netflixs_plan_to_charge_people_for_sharing/,https://www.businessinsider.com/netflix-password-sharing-crackdown-already-a-mess-report-2022-5,businessinsider.com,0,6,,link,False,False,False,
v4qvum,Elon Musk’s Plan to Send a Million Colonists to Mars by 2050 Is Pure Delusion,60617,0.74,9737,2022-06-04 20:42:11,technology,17123051,https://www.reddit.com/r/technology/comments/v4qvum/elon_musks_plan_to_send_a_million_colonists_to/,https://gizmodo.com/elon-musk-mars-colony-delusion-1848839584,gizmodo.com,0,13,,link,False,False,False,
widpmt,Flight tracking exposure irks billionaires and baddies,60610,0.91,2579,2022-08-07 17:07:30,technology,17123051,https://www.reddit.com/r/technology/comments/widpmt/flight_tracking_exposure_irks_billionaires_and/,https://techxplore.com/news/2022-08-flight-tracking-exposure-irks-billionaires.html,techxplore.com,0,6,,link,False,False,False,
e671nb,"TikTok admits it suppressed videos by disabled, queer, and fat creators.",60592,0.89,3685,2019-12-05 03:50:36,technology,17123051,https://www.reddit.com/r/technology/comments/e671nb/tiktok_admits_it_suppressed_videos_by_disabled/,https://slate.com/technology/2019/12/tiktok-disabled-users-videos-suppressed.html,slate.com,0,19,,link,False,False,False,
kztwne,GitHub apologizes for firing Jewish employee who warned of Nazis in U.S. Capitol: TechCrunch,60561,0.82,3972,2021-01-18 18:09:27,technology,17123051,https://www.reddit.com/r/technology/comments/kztwne/github_apologizes_for_firing_jewish_employee_who/,https://www.reuters.com/article/us-usa-trump-capitol-github/github-apologizes-for-firing-jewish-employee-who-warned-of-nazis-in-u-s-capitol-techcrunch-idUSKBN29M0NN,reuters.com,0,7,,link,False,False,False,
8qammr,RIP net neutrality: Ajit Pai's 'fuck you' to the American people becomes official.,60539,0.83,5035,2018-06-11 21:24:30,technology,17123051,https://www.reddit.com/r/technology/comments/8qammr/rip_net_neutrality_ajit_pais_fuck_you_to_the/,https://thenextweb.com/opinion/2018/06/11/rip-net-neutrality-ajit-pais-fuck-you-to-the-american-people-becomes-official/,thenextweb.com,0,2,,link,False,False,False,
10v48ok,Silicon Valley needs to stop laying off workers and start firing CEOs,60479,0.87,2021,2023-02-06 16:53:38,technology,17123051,https://www.reddit.com/r/technology/comments/10v48ok/silicon_valley_needs_to_stop_laying_off_workers/,https://businessinsider.com/fire-blame-ceo-tech-employee-layoffs-google-facebook-salesforce-amazon-2023-2,businessinsider.com,0,9,,link,False,False,False,
a58hrd,Comcast rejected by small town—residents vote for municipal fiber instead,60426,0.93,1214,2018-12-11 22:17:59,technology,17123051,https://www.reddit.com/r/technology/comments/a58hrd/comcast_rejected_by_small_townresidents_vote_for/,https://arstechnica.com/tech-policy/2018/12/comcast-rejected-by-small-town-residents-vote-for-municipal-fiber-instead/,arstechnica.com,0,3,,link,False,False,False,
gryed2,"'Absolutely no legal authority': Trump's threats to shut down Twitter are 'totally asinine' and reek of censorship, according to legal experts",60394,0.84,4247,2020-05-28 08:46:16,technology,17123051,https://www.reddit.com/r/technology/comments/gryed2/absolutely_no_legal_authority_trumps_threats_to/,https://www.businessinsider.com/can-trump-regulate-or-shut-down-twitter-facebook-2020-5,businessinsider.com,0,2,,link,False,False,False,
7c8xmx,"Equifax sells your salary history to debt collectors, financial service companies, and prospective employers",60189,0.92,2411,2017-11-11 20:52:45,technology,17123051,https://www.reddit.com/r/technology/comments/7c8xmx/equifax_sells_your_salary_history_to_debt/,https://www.nbcnews.com/technology/exclusive-your-employer-may-share-your-salary-equifax-might-sell-1B8173066,nbcnews.com,0,2,,link,False,False,False,
5zbv3w,These are the 17 House Representatives that introduced a bill to let telecoms sell your personal internet history,60013,0.88,2962,2017-03-14 18:09:35,technology,17123051,https://www.reddit.com/r/technology/comments/5zbv3w/these_are_the_17_house_representatives_that/,https://www.privateinternetaccess.com/blog/2017/03/17-house-representatives-introduced-bill-let-telecoms-sell-personal-internet-history/,privateinternetaccess.com,0,0,,link,False,False,False,
7o41rf,"The FCC is preparing to weaken the definition of broadband - ""Under this new proposal, any area able to obtain wireless speeds of at least 10 Mbps down, 1 Mbps would be deemed good enough for American consumers.""",59866,0.88,4841,2018-01-04 21:53:12,technology,17123051,https://www.reddit.com/r/technology/comments/7o41rf/the_fcc_is_preparing_to_weaken_the_definition_of/,http://www.dslreports.com/shownews/the-fcc-is-preparing-to-weaken-the-definition-of-broadband-140987,dslreports.com,0,4,,link,False,False,False,
udx3nm,64% of workers would consider quitting if asked to return to the office full-time,59853,0.87,3363,2022-04-28 20:34:56,technology,17123051,https://www.reddit.com/r/technology/comments/udx3nm/64_of_workers_would_consider_quitting_if_asked_to/,https://www.cnbc.com/2022/04/28/64percent-of-workers-would-consider-quitting-if-asked-to-return-to-office-full-time.html,cnbc.com,0,5,,link,False,False,False,
10jbdlg,An engineer laid off after over 16 years at Google said 'faceless' tech giants see staff as '100% disposable',59860,0.86,4586,2023-01-23 18:01:15,technology,17123051,https://www.reddit.com/r/technology/comments/10jbdlg/an_engineer_laid_off_after_over_16_years_at/,https://www.businessinsider.com/laid-off-engineer-says-google-considers-staff-disposable-2023-1,businessinsider.com,0,8,,link,False,False,False,
ucqidk,"Tesla shares sink, wipe out over $125 billion in value, as Musk scores Twitter deal",59844,0.81,6640,2022-04-27 05:37:31,technology,17123051,https://www.reddit.com/r/technology/comments/ucqidk/tesla_shares_sink_wipe_out_over_125_billion_in/,https://www.npr.org/2022/04/26/1094870412/tesla-shares-sink-twitter-elon-musk,npr.org,0,7,,link,False,False,False,
fegk4b,"Reddit ran wild with Boston bombing conspiracy theories in 2013, and is now an epicenter for coronavirus misinformation. The site is doing almost nothing to change that.",59810,0.79,3277,2020-03-06 22:39:51,technology,17123051,https://www.reddit.com/r/technology/comments/fegk4b/reddit_ran_wild_with_boston_bombing_conspiracy/,https://www.businessinsider.com/coronavirus-reddit-social-platforms-spread-misinformation-who-cdc-2020-3?utm_source=reddit.com,businessinsider.com,0,15,,link,False,False,False,
j35ay2,The EU wants to limit which apps Apple and Google pre-install on your phone,59739,0.95,2840,2020-10-01 14:57:29,technology,17123051,https://www.reddit.com/r/technology/comments/j35ay2/the_eu_wants_to_limit_which_apps_apple_and_google/,https://www.businessinsider.com/us-tech-giants-face-curbs-on-data-sharing-digital-marketplaces-under-draft-eu-rules-2020-9,businessinsider.com,0,3,,link,False,False,False,
q9y0vy,Facebook created its own PR nightmare and it deserves everything that's happening.,59723,0.87,2124,2021-10-17 18:17:05,technology,17123051,https://www.reddit.com/r/technology/comments/q9y0vy/facebook_created_its_own_pr_nightmare_and_it/,https://www.businessinsider.com/facebook-pr-press-problems-journalism-apple-tesla-media-2021-10,businessinsider.com,0,10,,link,False,,False,
7d6ujp,FCC Plans December Vote to Kill Net Neutrality Rules,59657,0.91,2160,2017-11-16 01:43:50,technology,17123051,https://www.reddit.com/r/technology/comments/7d6ujp/fcc_plans_december_vote_to_kill_net_neutrality/,https://www.bloomberg.com/news/articles/2017-11-15/killing-net-neutrality-rules-is-said-readied-for-december-vote,bloomberg.com,0,0,,link,False,False,False,
l8nxjv,"Global tax on tech giants now 'highly likely,' German minister says after Yellen call",59526,0.92,1887,2021-01-30 20:57:07,technology,17123051,https://www.reddit.com/r/technology/comments/l8nxjv/global_tax_on_tech_giants_now_highly_likely/,https://www.cnbc.com/2021/01/28/olaf-scholz-global-tax-on-tech-giants-now-highly-likely.html,cnbc.com,0,9,,link,False,False,False,
x5j08j,"The super-rich ‘preppers’ planning to save themselves from the apocalypse | Tech billionaires are buying up luxurious bunkers and hiring military security to survive a societal collapse they helped create, but like everything they do, it has unintended consequences",59467,0.87,5243,2022-09-04 15:13:41,technology,17123051,https://www.reddit.com/r/technology/comments/x5j08j/the_superrich_preppers_planning_to_save/,https://www.theguardian.com/news/2022/sep/04/super-rich-prepper-bunkers-apocalypse-survival-richest-rushkoff,theguardian.com,0,36,,link,False,False,False,
